Questions,Answer
What is gabapentin? Gabapentin,"''Gabapentin is an anti-epileptic drug, also called an anticonvulsant. It affects chemicals and nerves in the body that are involved in the cause of seizures and some types of pain.''Gabapentin is used together with other medicines to treat partial seizures in adults and children at least 3 years old.''Gabapentin is also used to treat neuropathic pain (nerve pain) caused by herpes virus or shingles (herpes zoster) in adults.''Use only the brand and form of gabapentin your doctor has prescribed. Check your medicine each time you get a refill to make sure you receive the correct form.''The Gralise brand of gabapentin is indicated for the management of neuropathic pain only. It is not used for epilepsy.''Horizant is used to treat nerve pain and restless legs syndrome (RLS).''The Neurontin brand is used to treat seizures in adults and children who are at least 3 years old, in addition to neuropathic pain.''"
Important Information Gabapentin,"''Gabapentin can cause life-threatening breathing problems, especially in older adults or people with COPD. Seek emergency medical attention if you have very slow breathing.''Some people have thoughts about suicide or behavior changes while taking gabapentin. Stay alert to changes in your mood or symptoms. Report any new or worsening symptoms to your doctor.''Avoid driving or hazardous activity until you know how gabapentin will affect you. Dizziness or drowsiness can cause falls, accidents, or severe injuries.''Do not stop using gabapentin suddenly, even if you feel fine.''"
Before taking this medicine Gabapentin,"''You should not use gabapentin if you are allergic to it.''To make sure gabapentin is safe for you, tell your doctor if you have ever had:''lung disease, such as chronic obstructive pulmonary disease (COPD);kidney disease (or if you are on dialysis);diabetes;depression, a mood disorder, or suicidal thoughts or actions;a drug addiction;a seizure (unless you take gabapentin to treat seizures);liver disease;heart disease; or(for patients with RLS) if you are a day sleeper or work a night shift.''Some people have thoughts about suicide while taking this medicine. Children taking gabapentin may have behavior changes. Stay alert to changes in your mood or symptoms. Report any new or worsening symptoms to your doctor.''It is not known whether this medicine will harm an unborn baby. Tell your doctor if you are pregnant or plan to become pregnant.''Seizure control is very important during pregnancy, and having a seizure could harm both mother and baby. Do not start or stop taking gabapentin for seizures without your doctor's advice, and tell your doctor right away if you become pregnant.''It may not be safe to breastfeed while using this medicine. Ask your doctor about any risk.''"
How should I take gabapentin? Gabapentin,"''Take gabapentin exactly as prescribed by your doctor. Follow all directions on your prescription label. Do not take in larger or smaller amounts or for longer than recommended.''If your doctor changes your brand, strength, or type of gabapentin, your dosage needs may change. Ask your pharmacist if you have any questions about the new kind of gabapentin you receive at the pharmacy.''The Horizant brand of gabapentin should not be taken during the day. For best results, take Horizant with food at about 5:00 in the evening.''Both Gralise and Horizant should be taken with food.''Neurontin can be taken with or without food.''If you break a Neurontin tablet and take only half of it, take the other half at your next dose. Any tablet that has been broken should be used as soon as possible or within a few days.''Swallow the capsule or tablet whole and do not crush, chew, break, or open it.''Measure liquid medicine carefully. Use the dosing syringe provided, or use a medicine dose-measuring device (not a kitchen spoon).''Do not stop taking this medicine suddenly, even if you feel fine. Stopping suddenly may cause increased seizures. Follow your doctor's instructions about tapering your dose.''In case of emergency, wear or carry medical identification to let others know you have seizures.''This medicine can cause unusual results with certain medical tests. Tell any doctor who treats you that you are using gabapentin.''Store both the tablets and capsules at room temperature away from light and moisture.''Store the liquid medicine in the refrigerator. Do not freeze.''"
Gabapentin dosing information,"''Usual Adult Dose for Epilepsy:''Initial dose: 300 mg orally on day one, 300 mg orally 2 times day on day two, then 300 mg orally 3 times a day on day threeMaintenance dose: 300 to 600 mg orally 3 times a dayMaximum dose: 3600 mg orally daily (in 3 divided doses)-Maximum time between doses in the 3 times a day schedule should not exceed 12 hours-The safety and effectiveness of gabapentin available under the trade name Gralise or Horizant in patients with epilepsy has not been studied.Use: Adjunctive therapy in the treatment of partial onset seizures, with and without secondary generalization''Usual Adult Dose for Postherpetic Neuralgia:''-Initial dose: 300 mg orally on day one, 300 mg orally 2 times day on day two, then 300 mg orally 3 times a day on day three-Titrate up as needed for pain relief-Maximum dose: 1800 mg per day (600 mg orally 3 times a day)Gabapentin available under the trade name Gralise:-Maintenance dose: Gralise should be titrated to 1800 mg orally once daily with the evening meal.-Recommended titration schedule:Day 1: 300 mg orally with the evening mealDay 2: 600 mg orally with the evening mealDays 3 through 6: 900 mg orally with the evening mealDays 7 through 10: 1200 mg orally with the evening mealDays 11 through 14: 1500 mg orally with the evening mealDay 15: 1800 mg orally with the evening mealCOMMENT:-Gralise is not interchangeable with other gabapentin products because of differing pharmacokinetic profiles that affect the frequency of administration.Gabapentin enacarbil extended release tablets are available under the trade name Horizant:-The recommended dosage is 600 mg orally 2 times a day. Therapy should be initiated at a dose of 600 mg orally in the morning for 3 days of therapy, then increased to 600 mg 2 times a day (1200 mg/day) on day four.COMMENT:Gabapentin enacarbil extended release tablets available under the trade name Horizant and gabapentin are not interchangeable.Use: Postherpetic neuralgia''Usual Adult Dose for Restless Legs Syndrome:''Gabapentin enacarbil available under the trade name Horizant:600 mg orally once daily with food at about 5 PMUse: For the treatment of moderate-to-severe primary Restless Legs Syndrome (RLS) in adults''Usual Pediatric Dose for Epilepsy:''Less than 3 years: Not recommendedGreater than or equal to 3 and less than 12 years:Starting Dose: Ranges from 10 to 15 mg/kg/day in 3 divided dosesEffective Dose: Reached by upward titration over a period of approximately 3 days; the effective dose in patients 5 years of age and older is 25 to 35 mg/kg/day in divided doses (3 times a day). The effective dose in pediatric patients ages 3 and 4 years is 40 mg/kg/day and given in divided doses (3 times a day). Gabapentin may be administered as the oral solution, capsule, or tablet, or using combinations of these formulations. Dosages up to 50 mg/kg/day have been well tolerated in a long term clinical study. The maximum time interval between doses should not exceed 12 hours.Greater than 12 years:-Initial dose: 300 mg orally on day one, 300 mg orally 2 times a day on day two, then 300 mg orally 3 times a day on day three-Maintenance dose: 900 to 1800 mg orally in 3 divided doses; the dose may be increased up to 1800 mg/day. Dosages up to 2400 mg/day have been well tolerated in long term clinical studies. Doses of 3600 mg/day have also been administered to a small number of patients for a relatively short duration, and have been well tolerated. The maximum time between doses in the three times a day schedule should not exceed 12 hours.Use: Adjunctive therapy in the treatment of partial onset seizures, with and without secondary generalization in patients 3 years of age and older''''What happens if I miss a dose?''Take the medicine as soon as you can, but skip the missed dose if it is almost time for your next dose. Do not take two doses at one time.''If you take Horizant: Skip the missed dose and use your next dose at the regular time. Do not use two doses of Horizant at one time.''"
What happens if I overdose? Gabapentin,''Seek emergency medical attention or call the Poison Help line at 1-800-222-1222.''
What should I avoid while taking gabapentin? Gabapentin,"''Avoid driving or hazardous activity until you know how gabapentin will affect you. Your reactions could be impaired. Dizziness or drowsiness can cause falls, accidents, or severe injuries.''Avoid taking an antacid within 2 hours before or after you take gabapentin. Antacids can make it harder for your body to absorb gabapentin.''Avoid drinking alcohol while taking gabapentin.''"
Gabapentin side effects,"''Get emergency medical help if you have signs of an allergic reaction to gabapentin: hives; difficult breathing; swelling of your face, lips, tongue, or throat.''Seek medical treatment if you have a serious drug reaction that can affect many parts of your body. Symptoms may include: skin rash, fever, swollen glands, muscle aches, severe weakness, unusual bruising, upper stomach pain, or yellowing of your skin or eyes.''Report any new or worsening symptoms to your doctor, such as: mood or behavior changes, anxiety, panic attacks, trouble sleeping, or if you feel impulsive, irritable, agitated, hostile, aggressive, restless, hyperactive (mentally or physically), depressed, or have thoughts about suicide or hurting yourself.''Call your doctor at once if you have:''weak or shallow breathing;blue-colored skin, lips, fingers, and toes;confusion, extreme drowsiness or weakness;problems with balance or muscle movement;unusual or involuntary eye movements; orincreased seizures.''Gabapentin can cause life-threatening breathing problems. A person caring for you should seek emergency medical attention if you have slow breathing with long pauses, blue colored lips, or if you are hard to wake up. Breathing problems may be more likely in older adults or in people with COPD.''Some side effects are more likely in children taking gabapentin. Contact your doctor if the child taking this medicine has any of the following side effects:''changes in behavior;memory problems;trouble concentrating; oracting restless, hostile, or aggressive.''Common gabapentin side effects may include:''headache;dizziness, drowsiness, tiredness;problems with balance or eye movements; or(in children) fever, nausea, vomiting.''This is not a complete list of side effects and others may occur. Call your doctor for medical advice about side effects. You may report side effects to FDA at 1-800-FDA-1088.''''"
What other drugs will affect gabapentin? Gabapentin,"''Using gabapentin with other drugs that slow your breathing can cause dangerous side effects or death. Ask your doctor before using opioid medication, a sleeping pill, cold or allergy medicine, a muscle relaxer, or medicine for anxiety or seizures.''other drugs may interact with gabapentin, including prescription and over-the-counter medicines, vitamins, and herbal products. Tell your doctor about all your current medicines and any medicine you start or stop using.''''"
What is galantamine? Galantamine,"''Galantamine improves the function of nerve cells in the brain. It works by preventing the breakdown of a chemical called acetylcholine (ah see til KO leen). People with dementia usually have lower levels of this chemical, which is important for the processes of memory, thinking, and reasoning.''Galantamine is used to treat mild to moderate Alzheimer's type dementia.''Galantamine may also be used for purposes not listed in this medication guide.''''"
Important Information Galantamine,"''Follow all directions on your medicine label and package. Tell each of your healthcare providers about all your medical conditions, allergies, and all medicines you use.''''"
Before taking this medicine Galantamine,"''You should not use galantamine if you are allergic to it.''To make sure galantamine is safe for you, tell your doctor if you have:''urination problems;heart disease or a heart rhythm disorder;a history of stomach ulcer or bleeding;seizures or epilepsy;kidney disease;liver disease; ora history of asthma or chronic obstructive pulmonary disease (COPD).''It is not known whether  galantamine will harm an unborn baby. Tell your doctor if you are pregnant or plan to become pregnant.''It is not known whether galantamine passes into breast milk or if it could affect the nursing baby. Tell your doctor if you are breast-feeding.''''"
How should I take galantamine? Galantamine,"''Follow all directions on your prescription label. Your doctor may occasionally change your dose to make sure you get the best results. Do not use this medicine in larger or smaller amounts or for longer than recommended.''The galantamine extended-release capsule is usually taken once per day in the morning. Follow your doctor's instructions.''The galantamine short-acting tablet or the oral solution (liquid) are usually given two times per day, with meals. Follow your doctor's instructions.''The extended-release capsule works best if you take it with food.''Do not crush, chew, break, or open an extended-release capsule. Swallow it whole.''Measure liquid medicine with the dosing syringe provided, or with a special dose-measuring spoon or medicine cup. If you do not have a dose-measuring device, ask your pharmacist for one.''Read all patient information, medication guides, and instruction sheets provided to you. Ask your doctor or pharmacist if you have any questions.''Take galantamine with a full glass of water. Drink 6 to 8 full glasses of water each day to keep from getting dehydrated while taking this medication.''If you need surgery, tell the surgeon ahead of time that you are using galantamine. You may need to stop using the medicine for a short time.''If you have stopped taking galantamine for any reason, talk with your doctor before you start taking it again. You may need to restart the medication at a lower dose.''Store at room temperature away from moisture and heat. Do not allow the liquid medicine to freeze.''''What happens if I miss a dose?''Take the missed dose as soon as you remember. Skip the missed dose if it is almost time for your next scheduled dose. Do not take extra medicine to make up the missed dose.''''"
What happens if I overdose? Galantamine,"''Seek emergency medical attention or call the Poison Help line at 1-800-222-1222.''Overdose symptoms may include severe nausea, vomiting, stomach cramps, muscle weakness or spasm, watery eyes, drooling, increased urination or bowel movements, sweating, slow heart rate, feeling light-headed or fainting, and seizure (convulsions).''''"
What should I avoid while taking galantamine? Galantamine,''This medication may impair your thinking or reactions. Be careful if you drive or do anything that requires you to be alert.''''
Galantamine side effects,"''Get emergency medical help if you have signs of an allergic reaction: hives; difficulty breathing; swelling of your face, lips, tongue, or throat.''Galantamine can cause serious skin reactions. Stop using  galantamine and call your doctor at once if you have the first signs of any skin rash, no matter how mild.''Call your doctor at once if you have:''chest pain, slow heart rate;little or no urinating;blood in your urine;signs of stomach bleeding--bloody or tarry stools, coughing up blood or vomit that looks like coffee grounds;liver problems--nausea, upper stomach pain, itching, tired feeling, loss of appetite, dark urine, clay-colored stools, jaundice (yellowing of the skin or eyes);dehydration symptoms--feeling very thirsty or hot, being unable to urinate, heavy sweating, or hot and dry skin;a light-headed feeling, like you might pass out; orsevere skin reaction--fever, sore throat, swelling in your face or tongue, burning in your eyes, skin pain, followed by a red or purple skin rash that spreads (especially in the face or upper body) and causes blistering and peeling.''Common side effects may include:''nausea, vomiting, diarrhea, loss of appetite;headache, dizziness; orweight loss.''This is not a complete list of side effects and others may occur. Call your doctor for medical advice about side effects. You may report side effects to FDA at 1-800-FDA-1088.''''"
Galantamine dosing information,"''Usual Adult Dose for Alzheimer's Disease:Immediate release tablet and oral solution:Initial dose: 4 mg orally twice a day, preferably with morning and evening meals -After a minimum of four weeks, increase to 8 mg twice a day, then after an additional 4 weeks, may increase to 12 mg twice a day Maintenance dose: 16 to 24 mg per day given in 2 divided doses Maximum dose: 24 mg/dayExtended release capsule:Initial dose: 8 mg orally once a day, preferably with the morning meal-After 4 weeks, dose should be increased to 16 mg once a day, a further increase to 24 mg once a day may be considered after a minimum of 4 weeks of taking 16 mg/dayMaintenance dose: 16 to 24 mg orally once a day based on clinical benefit and tolerabilityMaximum dose: 24 mg/dayConversion from Immediate-Release (IR) Tablets or Oral Solution to Extended-Release (ER) Capsules:-Take the last dose of IR formulation n in the evening prior to starting ER capsule; start ER capsule following morning at once a day dosing -Converting from IR to ER should occur at the same total daily dosageComments:-During clinical trials, an immediate-release dose of 32 mg per day was found to be less well tolerated and did not increase clinical benefit; dosing at 24 mg/day was not found to provide statistically significant increased clinical benefit from 16 mg/day; however, it might provide additional benefit for some patients.  -Dose increases should be based upon assessment of clinical benefit and tolerability of the previous dose.-If therapy is interrupted for more than 3 days, the patient should be restarted at the lowest dosage and the dosage escalated to current dose.Use: For the treatment of mild to moderate dementia of the Alzheimer's type.''"
What is garlic? Garlic,"''Garlic is an herb also known as Ail, Ajo, Allii Sativi Bulbus, Allium, Allium sativum, Camphor of the Poor, Da Suan, Lasun, Lasuna, Nectar of the Gods, Poor Man's Treacle, Rason, Rust Treacle, or Stinking Rose.''Garlic is a commonly used food and flavoring agent. When used as a food product, garlic is not likely to produce health benefits or side effects. When used as a medicinal product, garlic may produce both desired and unwanted effects on the body.''Garlic products sold as health supplements may vary widely in amount of allicin, the active ingredient in garlic. Allicin is unstable and can be reduced in garlic products that are aged to reduce odor. Odorless garlic may contain little to no allicin. The lower the amount of allicin, the less effective a garlic product might be.''Garlic taken orally (by mouth) has been used in alternative medicine as a possibly effective aid in treating high blood pressure, coronary artery disease (hardened arteries), stomach cancer, colon cancer or rectal cancer, and in preventing tick bites. Garlic applied to the skin may also be possibly effective in treating fungal skin infections such as ringworm, jock itch, or athlete's foot.''Garlic has also been used to treat high cholesterol, stomach ulcers caused by H. pylori, cancer, or circulation problems in the legs. However, research has shown that garlic may not be effective in treating these conditions.''Other uses not proven with research have included preventing the common cold, and improving urination problems caused by an enlarged prostate.''It is not certain whether garlic is effective in treating any medical condition. Medicinal use of this product has not been approved by the FDA. Garlic should not be used in place of medication prescribed for you by your doctor.''Garlic is often sold as an herbal supplement. There are no regulated manufacturing standards in place for many herbal compounds and some marketed supplements have been found to be contaminated with toxic metals or other drugs. Herbal/health supplements should be purchased from a reliable source to minimize the risk of contamination.''Garlic may also be used for purposes not listed in this product guide.''''"
Important Information Garlic,"''Follow all directions on the product label and package. Tell each of your healthcare providers about all your medical conditions, allergies, and all medicines you use.''''"
Before taking this medicine Garlic,"''You should not use garlic if you are allergic to it.''Ask a doctor, pharmacist, or other healthcare provider if it is safe for you to use this product if you have:''a stomach ulcer;problems with digestion; ora bleeding or blood clotting disorder such as hemophilia.''Ask a doctor before using garlic if you are pregnant or breastfeeding.''The use of garlic as a flavoring agent in foods is considered safe during pregnancy.''Do not give any herbal/health supplement to a child without medical advice. Garlic taken by mouth in large doses may be harmful to children.''''"
How should I take garlic? Garlic,"''When considering the use of herbal supplements, seek the advice of your doctor. You may also consider consulting a practitioner who is trained in the use of herbal/health supplements.''If you choose to use garlic, use it as directed on the package or as directed by your doctor, pharmacist, or other healthcare provider. Do not use more of this product than is recommended on the label.''Do not use different forms (cloves, tablets, oil, etc) of garlic at the same time without medical advice. Using different formulations together increases the risk of an overdose.''Do not crush, chew, or break an enteric coated pill. Swallow it whole. The pill has a special coating to protect your stomach. Breaking the pill will damage this coating.''Call your doctor if the condition you are treating with garlic does not improve, or if it gets worse while using this product.''Garlic can affect blood-clotting and may increase your risk of bleeding. If you need surgery, dental work, or a medical procedure, stop taking garlic at least 2 weeks ahead of time.''Store at room temperature away from moisture, heat, and light, or as directed on the package.''''What happens if I miss a dose?''Skip the missed dose and take the next regularly scheduled dose. Do not use two doses at one time.''''"
What happens if I overdose? Garlic,''Seek emergency medical attention or call the Poison Help line at 1-800-222-1222.''''
What should I avoid while taking garlic? Garlic,"''Avoid taking fish oil or vitamin E while you are taking garlic.''Also avoid using garlic together with other herbal/health supplements that can also affect blood-clotting. This includes angelica (dong quai), capsicum, clove, danshen, ginger, ginkgo, horse chestnut, panax ginseng, poplar, red clover, turmeric, and willow.''''"
Garlic side effects,"''Get emergency medical help if you have any of these signs of an allergic reaction: hives; difficult breathing; swelling of your face, lips, tongue, or throat.''Although not all side effects are known, garlic is thought to be possibly safe when taken for a short period of time.''Stop using garlic and call your healthcare provider at once if you have:''redness, swelling, or blistering (when applied to the skin); oreasy bruising or bleeding (nosebleeds, bleeding gums).''Common side effects (especially when eating raw garlic) may include:''unpleasant breath or body odor;heartburn, burning in your mouth or throat;nausea, vomiting, gas ordiarrhea.''This is not a complete list of side effects and others may occur. Call your doctor for medical advice about side effects. You may report side effects to FDA at 1-800-FDA-1088.''''"
What is  Gas-X?,"''Gas-X is used to relieve painful pressure caused by excess gas in the stomach and intestines. This medicine is for use in babies, children, and adults.''Gas-X may also be used for purposes not listed in this medication guide.''''"
Important Information Gas-X,"''Follow all directions on your medicine label and package. Tell each of your healthcare providers about all your medical conditions, allergies, and all medicines you use.''''"
Before taking this medicine Gas-X,"''You should not use Gas-X if you are allergic to it.''Ask a doctor or pharmacist if it is safe for you to take  Gas-X if you are allergic to any drugs, or if you have any type of serious illness (especially one that affects your stomach or intestines).''Ask a doctor before using this medicine if you are pregnant or breastfeeding.''The liquid form may contain phenylalanine. Talk to your doctor before using this form of simethicone if you have phenylketonuria (PKU).''''"
