Questions,Answer
Glucotrol dosing information,"''Usual Adult Dose of Glucotrol for Diabetes Type 2:''Immediate release:Initial dose: 5 mg orally once a day, 30 minutes before breakfastMaintenance dose: Up to 40 mg in divided doses 30 minutes before a meal of adequate caloric content. Doses may be increased in intervals of 2.5 to 5 mg a day according to blood glucose response.Maximum single dose: 15 mgMaximum daily dose: 40 mgComments:-At least several days should elapse between titration steps.-If response to a single dose is not satisfactory, dividing that dose may prove effective.Extended Release:Initial dose: 5 mg orally once a day, 30 minutes before breakfastMaintenance dose: 5 to 10 mg orally once a dayMaximum daily dose: 20 mgPatients receiving immediate release may be switched safely to extended release tablets once-a-day at the nearest equivalent total daily dose, or titrate to the appropriate extended release dose starting with 5 mg once daily.Combination use:-When adding other blood-glucose-lowering agents to the extended release tablets, the agent should be initiated at the lowest recommended dose. Observe for hypoglycemia.-When adding extended release tablets to other blood-glucose-lowering agents, Glucotrol XL extended release can be initiated at 5 mg. Start at a lower dose in patients that are more sensitive to hypoglycemia.When transferring patients from insulin to glipizide, the following general guidelines should be considered:-For patients with daily insulin doses of 20 units or less: Discontinue insulin and begin glipizide at usual dosages.-For patients with daily insulin doses greater than 20 units: Insulin dose should be reduced by 50% and glipizide therapy may begin at usual dosages.Comments:-Several days should elapse between titration steps.-Subsequent reductions in insulin dosage should depend on individual patient response.-During the insulin withdrawal period, the patient should test urine samples for sugar and ketone bodies at least three times daily.-Some patients receiving greater than 40 units of insulin daily may need to consider hospitalization during the transition period.Patients Receiving Other Oral Hypoglycemic Agents:-When transferring from longer half-life sulfonylureas: Observe for 1 to 2 weeks for hypoglycemia.-Glucotrol XL extended release coadministered with colesevelam: Glipizide should be administered at least 4 hours prior to colesevelam.Use: Adjunct to diet and exercise to improve glycemic control in adults with type 2 diabetes mellitus.''Usual Geriatric Dose of Glucotrol for Diabetes Type 2:''Initial dose: 2.5 mg orally once a day 30 minutes before breakfastComments:-Maintenance dosing should be conservative to avoid hypoglycemic reactions.-Doses can be adjusted with caution taking into account the degree of hepatic, renal, or cardiac function, and the concomitant disease or other drug therapy.Use: Adjunct to diet and exercise to improve glycemic control in adults with type 2 diabetes mellitus.''''What happens if I miss a dose?''Take your dose as soon as you can, but only if you are getting ready to eat a meal. If you skip a meal, skip the missed dose and wait until your next meal. Do not take two doses at one time.''Get your prescription refilled before you run out of medicine completely.''"
What happens if I overdose? Glucotrol,"''Seek emergency medical attention or call the Poison Help line at 1-800-222-1222. A glipizide overdose can cause life-threatening hypoglycemia.''Symptoms of severe hypoglycemia include extreme weakness, blurred vision, sweating, trouble speaking, tremors, stomach pain, confusion, and seizure (convulsions).''"
What should I avoid while taking Glucotrol?,''Avoid drinking alcohol. It lowers blood sugar and can cause side effects.''Avoid driving or operating machinery until you know how glipizide will affect you.''
Glucotrol side effects,"''Get emergency medical help if you have signs of an allergic reaction to Glucotrol: hives; difficulty breathing; swelling of your face, lips, tongue, or throat.''Call your doctor at once if you have symptoms of low blood sugar:''headache, irritabilitysweating, fast heart rate;dizziness, nausea; orhunger, feeling anxious or shaky.''Common Glucotrol side effects may include:''diarrhea, constipation, gas;dizziness, drowsiness;tremors; orskin rash, redness, or itching.''This is not a complete list of side effects and others may occur. Call your doctor for medical advice about side effects. You may report side effects to FDA at 1-800-FDA-1088.''''"
What is glyburide? Glyburide,''Glyburide is an oral diabetes medicine that helps control blood sugar levels.''Glyburide is used together with diet and exercise to improve blood sugar control in adults with type 2 diabetes mellitus.''Glyburide is not for treating type 1 diabetes.''
Important Information Glyburide,"''You should not use glyburide if you are being treated with bosentan (Tracleer), or if you have diabetic ketoacidosis (call your doctor for treatment). Glyburide is not for treating type 1 diabetes.''Before taking glyburide, tell your doctor if you are allergic to sulfa drugs, if you have been using insulin or chlorpropamide (Diabinese), or if you have hemolytic anemia (a lack of red blood cells), an enzyme deficiency (G6PD), a nerve disorder, liver disease, or kidney disease.''Take care not to let your blood sugar get too low. Low blood sugar (hypoglycemia) can occur if you skip a meal, exercise too long, drink alcohol, or are under stress. Symptoms include headache, hunger, weakness, sweating, tremor, irritability, or trouble concentrating. Carry hard candy or glucose tablets with you in case you have low blood sugar. Other sugar sources include orange juice and milk. Be sure your family and close friends know how to help you in an emergency.''"
Before taking this medicine Glyburide,"''You should not use glyburide if you are allergic to it, or if:''you are being treated with bosentan (Tracleer);you have type 1 diabetes; oryou have diabetic ketoacidosis (call your doctor for treatment).''Tell your doctor if you have ever had:''hemolytic anemia (a lack of red blood cells);an enzyme deficiency called glucose-6-phosphate dehydrogenase deficiency (G6PD);a nerve disorder affecting bodily functions;liver or kidney disease; oran allergy to sulfa drugs.''Before taking glyburide, tell your doctor if you have taken another oral diabetes medicine or used insulin during the past 2 weeks.''Glyburide may increase your risk of serious heart problems, but not treating your diabetes can also damage your heart and other organs. Talk to your doctor about the risks and benefits of this medicine.''Tell your doctor if you are pregnant or breastfeeding.''Follow your doctor's instructions about using glyburide if you are pregnant or you become pregnant. Controlling diabetes is very important during pregnancy, and having high blood sugar may cause complications in both the mother and the baby.''"
How should I take glyburide? Glyburide,"''Glyburide is usually taken with breakfast or the first main meal of the day.''Follow all directions on your prescription label and read all medication guides or instruction sheets. Your doctor may occasionally change your dose. Use the medicine exactly as directed.''Your blood sugar may need to be checked often, and you may need other blood tests at your doctor's office.''Low blood sugar (hypoglycemia) can happen to anyone who has diabetes. Symptoms include headache, hunger, sweating, irritability, dizziness, nausea, fast heart rate, and feeling anxious or shaky. To quickly treat low blood sugar, always keep a fast-acting source of sugar with you such as fruit juice, hard candy, crackers, raisins, or non-diet soda.''Your doctor can prescribe a glucagon emergency injection kit to use in case you have severe hypoglycemia and cannot eat or drink. Be sure your family and close friends know how to give you this injection in an emergency.''Also watch for signs of high blood sugar (hyperglycemia) such as increased thirst or urination.''Blood sugar levels can be affected by stress, illness, surgery, exercise, alcohol use, or skipping meals. Ask your doctor before changing your dose or medication schedule.''If your doctor changes your brand, strength, or type of glyburide, your dosage needs may change. Ask your pharmacist if you have any questions about the new kind of glyburide you receive at the pharmacy.''Store at room temperature away from moisture and heat. Keep the bottle tightly closed when not in use.''''What happens if I miss a dose?''Take the medicine as soon as you can, but skip the missed dose if it is almost time for your next dose. Do not take two doses at one time.''"
What happens if I overdose? Glyburide,"''Seek emergency medical attention or call the Poison Help line at 1-800-222-1222. A glyburide overdose can cause life-threatening hypoglycemia.''Symptoms of severe hypoglycemia include extreme weakness, nausea, tremors, sweating, confusion, trouble speaking, fast heartbeats, or seizure.''"
What should I avoid while taking glyburide? Glyburide,''Avoid drinking alcohol. It lowers blood sugar and may interfere with your diabetes treatment.''Glyburide could make you sunburn more easily. Avoid sunlight or tanning beds. Wear protective clothing and use sunscreen (SPF 30 or higher) when you are outdoors.''
Glyburide side effects,"''Get emergency medical help if you have signs of an allergic reaction to glyburide (hives, difficult breathing, swelling in your face or throat) or a severe skin reaction (fever, sore throat, burning in your eyes, skin pain, red or purple skin rash that spreads and causes blistering and peeling).''Call your doctor at once if you have:''dark urine, jaundice (yellowing of the skin or eyes);severe skin rash, redness, or itching;pale skin, easy bruising or bleeding;fever, chills, sore throat, mouth sores; orlow levels of sodium in the bodyheadache, confusion, slurred speech, severe weakness, vomiting, loss of coordination, feeling unsteady.''Older adults may be more likely to have low blood sugar while taking glyburide.''Common glyburide side effects may include:''low blood sugar;nausea, heartburn, feeling full;muscle or joint pain;blurred vision; ormild rash or skin redness.''This is not a complete list of side effects and others may occur. Call your doctor for medical advice about side effects. You may report side effects to FDA at 1-800-FDA-1088.''''"
Glyburide dosing information,"''Usual Adult Dose for Diabetes Type 2:''Standard glyburide:-Initial dose: 2.5 mg to 5 mg orally once a day-Dose titration: Increase in increments of no more than 2.5 mg at weekly intervals based upon blood glucose response-Maintenance dose: 1.25 to 20 mg orally as a single dose or in divided doses-Maximum dose: 20 mg/dayMicronized glyburide:-Initial dose: 1.5 mg to 3 mg orally once a day-Dose titration: Increase in increments of no more than 1.5 mg at weekly intervals based upon blood glucose response-Maintenance dose: 0.75 to 12 mg orally as a single dose or in divided doses-Maximum dose: 12 mg/dayComments:-Administer with breakfast or the first main meal of the day-Lower initial doses may be used in patients who are sensitive to hypoglycemic drugs-Once a day therapy is generally satisfactory, however, some patients may have a more satisfactory response with twice-a-day dosing, especially those receiving higher doses.TRANSFER FROM OTHER HYPOGLYCEMIC THERAPY:-Oral Antidiabetic Therapy: No exact dosage relationships exists between standard glyburide, micronized glyburide, or other oral hypoglycemic agents; when transferring patients from other oral hypoglycemic therapy, the maximum starting doses should be observed.-Insulin:--If the insulin dose is less than 20 units per day substitute 2.5 to 5 mg (standard) OR 1.5 to 3 mg (micronized) orally once a day.--If the insulin dose is between 20 and 40 units per day, substitute 5 mg (standard) OR 3 mg (micronized) orally once a day.--If the insulin dose is more than 40 units per day; transition the patient by concomitantly decreasing insulin by 50% and starting glyburide at 5 mg (standard) OR 3 mg (micronized) orally once a day; as insulin is progressively withdrawn, titrate in increments of 1.25 to 2.5 mg (standard) OR 0.75 to 1.5 mg (micronized) orally once a day every 2 to 10 days.Use: As an adjunct to diet and exercise to improve glycemic control in adults with type 2 diabetes mellitus.''Usual Geriatric Dose for Diabetes Type 2:''Initial dose: 1.25 to 2.5 mg (standard) orally or 0.75 to 1.5 mg (micronized) orally once a day.''"
What is  GlycoLax?,''GlycoLax is a laxative solution that increases the amount of water in the intestinal tract to stimulate bowel movements.''GlycoLax is used as a laxative to treat occasional constipation or irregular bowel movements.''GlycoLax may also be used for purposes not listed in this medication guide.''''
Important Information GlycoLax,"''You should not use  GlycoLax if you have a bowel obstruction or intestinal blockage. If you have any of these conditions, you could have dangerous or life-threatening side effects from GlycoLax.''Do not use GlycoLax more than once per day. Call your doctor if you are still constipated or irregular after using this medication for 7 days in a row.''''"
Before taking this medicine GlycoLax,"''You should not use this medicine if you are allergic to polyethylene glycol, or if you have a bowel obstruction or intestinal blockage. If you have any of these conditions, you could have dangerous or life-threatening side effects from GlycoLax.''People with eating disorders (such as anorexia or bulimia) should not use this medication without the advice of a doctor.''To make sure this medicine is safe for you, tell your doctor if you have:''nausea, vomiting, or severe stomach pain;ulcerative colitis;irritable bowel syndrome;kidney disease; orif you have had a sudden change in bowel habits that has lasted 2 weeks or longer.''FDA pregnancy category C. It is not known whether GlycoLax will harm an unborn baby. Tell your doctor if you are pregnant or plan to become pregnant while using this medication.''It is not known whether polyethylene glycol 3350 passes into breast milk or if it could harm a nursing baby. Tell your doctor if you are breast-feeding a baby.''''"
How should I take  GlycoLax?,"''Follow all directions on your prescription label. Do not use  GlycoLax in larger or smaller amounts or for longer than recommended.''To use the powder form of this medicine, measure your dose with the medicine cap on the bottle. This cap should contain dose marks on the inside of it. Pour the powder into 4 to 8 ounces of a cold or hot beverage such as water, juice, soda, coffee, or tea. Stir this mixture and drink it right away. Do not save for later use.''GlycoLax should produce a bowel movement within 1 to 3 days of using the medication. This medicine normally causes loose or even watery stools.''Do not use GlycoLax more than once per day. Call your doctor if you are still constipated or irregular after using this medication for 7 days in a row.''Store at room temperature away from moisture and heat.''''What happens if I miss a dose?''Take the missed dose as soon as you remember. Skip the missed dose if it is almost time for your next scheduled dose. Do not take extra medicine to make up the missed dose.''''"
What happens if I overdose? GlycoLax,''Seek emergency medical attention or call the Poison Help line at 1-800-222-1222.''''
What should I avoid while taking  GlycoLax?,"''Follow your doctor's instructions about any restrictions on food, beverages, or activity.''''"
 GlycoLax side effects,"''Get emergency medical help if you have signs of an allergic reaction: hives; difficult breathing; swelling of your face, lips, tongue, or throat.''Stop taking  GlycoLax and call your doctor at once if you have:''severe or bloody diarrhea;rectal bleeding;blood in your stools; orsevere and worsening stomach pain.''Common side effects may include:''bloating, gas, upset stomach;dizziness; orincreased sweating.''This is not a complete list of side effects and others may occur. Call your doctor for medical advice about side effects. You may report side effects to FDA at 1-800-FDA-1088.''''"
What is glycopyrrolate? Glycopyrrolate,"''Glycopyrrolate helps to control conditions such as peptic ulcers that involve excessive stomach acid production.''Glycopyrrolate is also used to reduce drooling in children ages 3 to 16 who have certain medical conditions, such as cerebral palsy.''Glycopyrrolate injection is also used during surgery to reduce secretions in your stomach or airway, and to help protect your heart and nervous system while you are under general anesthesia.''Glycopyrrolate may also be used for purposes not listed in this medication guide.''''"
Important Information Glycopyrrolate,"''You should not use glycopyrrolate if you have urination problems, a blockage in your stomach or intestines, severe constipation, severe ulcerative colitis or toxic megacolon, glaucoma, myasthenia gravis, or active bleeding with heart and blood circulation problems.''''"
Before taking this medicine Glycopyrrolate,"''You should not use glycopyrrolate if you are allergic to it, or if you have:''a bladder obstruction or other urination problems;a stomach or bowel obstruction (including paralytic ileus);severe constipation;severe ulcerative colitis or toxic megacolon;glaucoma;myasthenia gravis; oractive bleeding with fast heartbeats, low blood pressure, shortness of breath, and cold hands or feet.''Tell your doctor if you have ever had:''an enlarged prostate;liver or kidney disease;heart problems or a heart rhythm disorder;high blood pressure;a stomach disorder such as ulcerative colitis, hiatal hernia, reflux disease, or slow digestion;a colostomy or ileostomy;a thyroid disorder; ora nerve disorder.''It is not known whether  glycopyrrolate will harm an unborn baby. Tell your doctor if you are pregnant or plan to become pregnant.''You should not breastfeed while using glycopyrrolate. Glycopyrrolate may slow breast milk production.''Do not give this medicine to a child without medical advice.''''"
How should I take glycopyrrolate? Glycopyrrolate,"''Follow all directions on your prescription label and read all medication guides or instruction sheets. Your doctor may occasionally change your dose. Use the medicine exactly as directed.''You may need to take glycopyrrolate on an empty stomach, at least 1 hour before or 2 hours after a meal. Follow the instructions provided with your medicine.''Measure liquid medicine carefully. Use the dosing syringe provided, or use a medicine dose-measuring device (not a kitchen spoon).''Glycopyrrolate doses are based on weight in children. Your child's dose needs may change if the child gains or loses weight.''Store at room temperature away from moisture and heat. Keep the bottle tightly closed when not in use.''Glycopyrrolate injection is given as an infusion into a vein or or injected into a muscle. A healthcare provider will give you this injection if you are unable to take the medicine by mouth.''''What happens if I miss a dose?''Take the medicine as soon as you can, but skip the missed dose if it is almost time for your next dose. Do not take two doses at one time.''''"
What happens if I overdose? Glycopyrrolate,"''Seek emergency medical attention or call the Poison Help line at 1-800-222-1222.''Overdose symptoms may include severe muscle weakness, loss of movement, dilated pupils, jerky muscle movements, or seizure (convulsions).''''"
What should I avoid while taking glycopyrrolate? Glycopyrrolate,''Avoid driving or hazardous activity until you know how  glycopyrrolate will affect you. Your reactions could be impaired.''Avoid becoming overheated or dehydrated during exercise and in hot weather. Glycopyrrolate can decrease sweating and you may be more prone to heat stroke.''Drinking alcohol with this medicine can cause side effects.''''
Glycopyrrolate side effects,"''Get emergency medical help if you have signs of an allergic reaction: hives; difficult breathing; swelling of your face, lips, tongue, or throat.''Stop using glycopyrrolate and call your doctor at once if you have:''severe constipation, severe stomach pain and bloating;diarrhea (especially if you have a colostomy or ileostomy);painful or difficult urination;fast or pounding heartbeats, fluttering in your chest;confusion, severe drowsiness;eye pain, seeing halos around lights;fever, shallow breathing, weak pulse, hot and red skin; or(in a child taking glycopyrrolate) dry diapers, fussiness, or excessive crying.''Common side effects may include:''constipation, nausea, vomiting, bloating;drowsiness, dizziness, weakness, feeling nervous;slow heartbeats;sleep problems (insomnia);blurred vision, sensitivity to light;dry mouth, decreased sense of taste;decreased sweating, decreased urination;impotence, sexual problems;headache; orrash.''This is not a complete list of side effects and others may occur. Call your doctor for medical advice about side effects. You may report side effects to FDA at 1-800-FDA-1088.''''"
What is Glyxambi?,"''Glyxambi contains a combination of empagliflozin and linagliptin. Empagliflozin and linagliptin are oral diabetes medicines that help control blood sugar levels. Empagliflozin works by helping the kidneys get rid of glucose from your bloodstream. Linagliptin works by regulating the levels of insulin your body produces after eating.''Glyxambi is used together with diet and exercise to improve blood sugar control in adults with type 2 diabetes mellitus.''Glyxambi is also used to lower the risk of death from heart attack, stroke, or heart failure in adults with type 2 diabetes who also have heart disease.''This medicine is not for treating type 1 diabetes.''"
Important Information Glyxambi,"''You should not use Glyxambi if you have severe kidney disease (or if you are on dialysis) or diabetic ketoacidosis, or if you have ever had a severe allergic reaction to empagliflozin or linagliptin.''Call your doctor at once if you have signs of a serious side effect, such as severe pain in your upper stomach spreading to your back, vomiting, fast heart rate, dizziness, feeling very thirsty or hot, decreased urination, heavy sweating, or hot and dry skin.''In rare cases, Glyxambi can cause serious infections in the penis or vagina. Get medical help right away if you have burning, itching, odor, discharge, pain, tenderness, redness or swelling of the genital or rectal area, fever, or if you don't feel well.''"
Before taking this medicine Glyxambi,"''You should not use Glyxambi if you are allergic to empagliflozin and linagliptin, or if you have:''severe kidney disease (or if you are on dialysis);a history of severe allergic or skin reaction after taking linagliptin; ordiabetic ketoacidosis (call your doctor for treatment).''To make sure Glyxambi is safe for you, tell your doctor if you have ever had:''liver or kidney disease;a bladder infection or urination problems;a pancreas disorder;heart failure, low blood pressure;gallstones;alcoholism;a genital infection (penis or vagina);if you are on a low salt diet; orif you are 65 or older.''Follow your doctor's instructions about using this medicine if you are pregnant or you become pregnant. Controlling diabetes is very important during pregnancy, and having high blood sugar may cause complications in both the mother and the baby.''You should not breastfeed while using Glyxambi.''"
How should I take Glyxambi?,"''Take Glyxambi exactly as it was prescribed for you. Follow all directions on your prescription label and read all medication guides or instruction sheets. Your doctor may occasionally change your dose.''Glyxambi is usually taken in the morning, with or without food.''Your blood sugar will need to be checked often, and you may also need to test the level of ketones your urine. Empagliflozin can cause life-threatening ketoacidosis (too much acid in the blood). Even if your blood sugar is normal, contact your doctor if a urine test shows that you have ketones in the urine.''You may have low blood sugar (hypoglycemia) and feel very hungry, dizzy, irritable, confused, anxious, or shaky. To quickly treat hypoglycemia, eat or drink a fast-acting source of sugar (fruit juice, hard candy, crackers, raisins, or non-diet soda).''Your doctor may prescribe a glucagon injection kit in case you have severe hypoglycemia. Be sure your family or close friends know how to give you this injection in an emergency.''Also watch for signs of high blood sugar (hyperglycemia) such as increased thirst or urination.''Blood sugar levels can be affected by stress, illness, surgery, exercise, alcohol use, or skipping meals. Ask your doctor before changing your Glyxambi dose or dosing schedule.''This medicine can affect the results of certain lab tests for glucose (sugar) in the urine. Tell any doctor who treats you that you are using Glyxambi.''Store at room temperature away from moisture and heat.''"
