Questions,Answer
Nexplanon side effects,"''Get emergency medical help if you have signs of an allergic reaction to Nexplanon: hives; difficult breathing; swelling of your face, lips, tongue, or throat.''Call your doctor at once if you have:''warmth, redness, swelling, or oozing where the implant was inserted;severe pain or cramping in your pelvic area (may be only on one side);signs of a stroke - sudden numbness or weakness (especially on one side of the body), sudden severe headache, slurred speech, problems with vision or balance;signs of a blood clot - sudden vision loss, stabbing chest pain, feeling short of breath, coughing up blood, pain or warmth in one or both legs;heart attack symptoms - chest pain or pressure, pain spreading to your jaw or shoulder, nausea, sweating;increased blood pressure - severe headache, blurred vision, pounding in your neck or ears;swelling in your hands, ankles, or feet;jaundice (yellowing of the skin or eyes);a breast lump; orsymptoms of depression - sleep problems, weakness, tired feeling, mood changes.''Common Nexplanon side effects may include:''pain where the implant was inserted;changes in your menstrual periods;vaginal itching or discharge;acne, mood changes, weight gain;breakthrough bleeding, menstrual cramps;nausea, stomach pain;breast pain;headache, dizziness; orflu-like symptoms, sore throat.''This is not a complete list of side effects and others may occur. Call your doctor for medical advice about side effects. You may report side effects to FDA at 1-800-FDA-1088.''''"
What other drugs will affect Nexplanon?,"''Certain other medicines or herbal products may make etonogestrel less effective, which could result in pregnancy. You may need to use a non-hormonal form of back-up birth control (such as condoms with spermicide) while you are taking certain medicine, and for up to 28 days after stopping the medicine.''Tell your doctor about all your current medicines and any other medicines you start or stop using, especially:''aprepitant;bosentan;griseofulvin;rifampin;St. John's wort;topiramate;medicine to treat hepatitis C, HIV, or AIDS;a barbiturate - butabarbital, secobarbital, phenobarbital (Solfoton); orseizure medicine - carbamazepine, felbamate, oxcarbazepine, phenytoin.''This list is not complete. Other drugs may interact with etonogestrel, including prescription and over-the-counter medicines, vitamins, and herbal products. Not all possible interactions are listed in this medication guide.''''"
What is niacin? Niacin,"''Niacin, also called nicotinic acid, is a B vitamin (vitamin B3). It occurs naturally in plants and animals, and is also added to many foods as a vitamin supplement. It is also present in many multiple vitamins and nutritional supplements.''Niacin is used to lower blood levels of ""bad"" cholesterol (low-density lipoprotein, or LDL) and triglycerides, and increase levels of ""good"" cholesterol (high-density lipoprotein, or HDL).''Niacin may also be used for purposes not listed in this medication guide.''"
Important Information Niacin,"''You should not take niacin if you have severe liver disease, a stomach ulcer, or active bleeding.''Niacin can cause certain side effects, such as flushing (warmth, itching, redness, or tingly feeling under your skin). These effects can be made worse if you drink alcohol or hot beverages shortly after you take this medicine. These effects should disappear over time as you keep taking the medication.''Avoid getting up too fast from a sitting or lying position, or you may feel dizzy. Get up slowly and steady yourself to prevent a fall.''Avoid taking colestipol (Colestid) or cholestyramine (Locholest, Prevalite, Questran) at the same time you take niacin. If you take either of these other medications, take them at least 4 to 6 hours before or after you take this medicine.''Niacin is only part of a complete program of treatment that may also include diet, exercise, weight control, and other medications. Follow your diet, medication, and exercise routines very closely.''"
Before taking this medicine Niacin,"''You should not take niacin if you are allergic to it.''To make sure you can safely take niacin, tell your doctor if you have ever had:''severe liver disease;a stomach ulcer; oractive bleeding.''Tell your doctor if you have ever had:''liver disease;heart disease, chest pain (angina);gout; ordiabetes.''It is not known whether niacin will harm an unborn baby. You may not be able to use this medicine during pregnancy. Tell your doctor right away if you become pregnant.''You should not breastfeed while using this medicine.''Niacin is not approved for use by anyone younger than 18 years old.''"
How should I take niacin ? Niacin,"''Use niacin exactly as directed on the label, or as prescribed by your doctor. Read all medication guides or instruction sheets.''Niacin can cause flushing (warmth, itching, redness, or tingly feeling under your skin). These effects should disappear over time as you keep taking the medicine. Flushing may be worse if you drink alcohol or hot beverages shortly after taking niacin.''Swallow the capsule or tablet whole and do not crush, chew, break, or open it.''Your dose needs may change if you switch to a different brand, strength, or form of this medicine. Avoid medication errors by using only the form and strength your doctor prescribes.''If you stop taking niacin for any length of time, talk with your doctor before starting the medication again. You may need to restart the medication at a lower dose.''This medicine can affect the results of certain medical tests. Tell any doctor who treats you that you are using this medicine.''Niacin is only part of a complete treatment program that may also include diet, exercise, and weight control. Follow your diet, medication, and exercise routines very closely.''Your doctor may recommend you take aspirin or an NSAID (such as ibuprofen, Advil, or Aleve) to help prevent flushing. Keep using these medicines for as long as your doctor has prescribed.''Store at room temperature away from moisture and heat.''''What happens if I miss a dose?''Take the medicine as soon as you can, but skip the missed dose if it is almost time for your next dose. Do not take two doses at one time.''"
What happens if I overdose? Niacin,''Seek emergency medical attention or call the Poison Help line at 1-800-222-1222.''
What should I avoid while taking niacin ? Niacin,"''Avoid drinking alcohol. It may increase your risk of liver damage, and can also worsen the flushing effects of niacin.''Avoid getting up too fast from a sitting or lying position, or you may feel dizzy.''Avoid eating foods high in fat or cholesterol, or niacin will not be as effective.''"
Niacin side effects,"''Get emergency medical help if you have signs of an allergic reaction to niacin: hives; difficult breathing; swelling of your face, lips, tongue, or throat.''Call your doctor at once if you have:''a light-headed feeling, like you might pass out;irregular heartbeats;severe warmth or redness under your skin;vision problems; orjaundice (yellowing of the skin or eyes).''Common niacin side effects may include:''flushing (sudden warmth, redness, or tingly feeling);upset stomach, vomiting, diarrhea;abnormal liver function tests;itching, dry skin;cough;skin discoloration; orheadache.''This is not a complete list of side effects and others may occur. Call your doctor for medical advice about side effects. You may report side effects to FDA at 1-800-FDA-1088.''''"
What other drugs will affect niacin? Niacin,"''Tell your doctor about all your other medicines, especially:''statin cholesterol medication;heart or blood pressure medication; orother medicines that lower blood pressure.''This list is not complete. Other drugs may interact with niacin, including prescription and over-the-counter medicines, vitamins, and herbal products. Not all possible drug interactions are listed here.''''"
What is Niaspan ER?,"''Niaspan ER extended release works by reducing LDL (""bad"") cholesterol and triglycerides and increasing HDL (""good"") cholesterol. Niaspan contains niacin, also called nicotinic acid, a B vitamin (vitamin B3). It occurs naturally in plants and animals and is present in many multiple vitamin supplements.''Niaspan ER is used to lower cholesterol and triglycerides (types of fat) in the blood. It is also used to lower the risk of heart attack in people with high cholesterol who have already had a heart attack. It is sometimes used to treat coronary artery disease (also called atherosclerosis).''Niaspan ER may also be used for purposes not listed in this medication guide.''"
Important information Niaspan ER,"''You should not take Niaspan ER if you are allergic to niacin, or if you have severe liver disease, a stomach ulcer, or active bleeding.''Niaspan ER can cause certain side effects, such as flushing (warmth, itching, redness, or tingly feeling under your skin). These effects can be made worse if you drink alcohol or hot beverages shortly after you take Niaspan ER. These effects should disappear over time as you keep taking the medication.''Avoid getting up too fast from a sitting or lying position, or you may feel dizzy. Get up slowly and steady yourself to prevent a fall.''Avoid taking colestipol (Colestid) or cholestyramine (Locholest, Prevalite, Questran) at the same time you take Niaspan ER. If you take either of these other medications, take them at least 4 to 6 hours before or after you take this medicine.''Niaspan ER is only part of a complete program of treatment that may also include diet, exercise, weight control, and other medications. Follow your diet, medication, and exercise routines very closely.''"
Before taking this medicine Niaspan ER,"''You should not take Niaspan ER if you are allergic to niacin, or if you have severe liver disease, a stomach ulcer, or active bleeding.''To make sure you can safely take Niaspan ER, tell your doctor if you have any of these other conditions:''liver or kidney disease;heart disease or uncontrolled angina (chest pain);a stomach ulcer;diabetes;gout; ora muscle disorder such as myasthenia gravis.''FDA pregnancy category C. Niaspan ER may be harmful to an unborn baby when the medication is taken at doses to treat high cholesterol or other conditions. Tell your doctor if you are pregnant or plan to become pregnant during treatment. Niacin can pass into breast milk and may harm a nursing baby. Do not use this medication without telling your doctor if you are breast-feeding a baby.''"
How should I take Niaspan ER ?,"''Use Niaspan ER exactly as directed on the label, or as prescribed by your doctor. Do not use in larger or smaller amounts or for longer than recommended.''Niaspan ER is sometimes taken at bedtime with a low-fat snack. Follow your doctor's instructions.''Niaspan ER can cause certain side effects, such as flushing (warmth, itching, redness, or tingly feeling under your skin). These effects can be made worse if you drink alcohol or hot beverages shortly after you take Niaspan ER. These effects should disappear over time as you keep taking the medication.''Take Niaspan ER with a full glass of cold or cool water. Taking the medication with a hot drink may increase your risk of side effects such as flushing. Do not crush, chew, break, or open an extended-release Niaspan ER tablet. Swallow it whole. Breaking or opening the tablet may cause too much of the drug to be released at one time. Extended-release tablets contain higher strengths of niacin than the regular tablets.''Niaspan ER can cause you to have unusual results with certain medical tests (urine tests). Tell any doctor who treats you that you are using this medicine.''If you stop taking Niaspan ER for any length of time, talk with your doctor before starting the medication again. You may need to restart the medication at a lower dose.''While using Niaspan ER, you may need blood tests at your doctor's office. Your kidney or liver function may also need to be checked. Visit your doctor regularly.''Niaspan ER is only part of a complete program of treatment that may also include diet, exercise, weight control, and other medications. Follow your diet, medication, and exercise routines very closely.''Store at room temperature away from moisture and heat.''''What happens if I miss a dose?''Take the missed dose as soon as you remember. Be sure to take the missed dose with food if you normally take your Niaspan ER dose with a meal or snack.''Skip the missed dose if it is almost time for your next scheduled dose. Do not take extra medicine to make up the missed dose.''"
What happens if I overdose? Niaspan ER,"''Seek emergency medical attention or call the Poison Help line at 1-800-222-1222.''Overdose symptoms may include nausea, dizziness, itching, vomiting, upset stomach, and flushing (warmth, redness, or tingly feeling).''"
What should I avoid? Niaspan ER,"''Avoid drinking hot beverages shortly after taking Niaspan ER. Hot drinks can worsen the flushing effect (warmth, itching, redness, or tingly feeling under your skin).''Avoid drinking alcohol while taking Niaspan ER. Alcohol may increase your risk of liver damage, and can also worsen the flushing effects of this medicine.''Avoid taking colestipol (Colestid) or cholestyramine (Locholest, Prevalite, Questran) at the same time you take Niaspan ER. If you take either of these other medications, take them at least 4 to 6 hours before or after you take Niaspan ER.''Avoid getting up too fast from a sitting or lying position, or you may feel dizzy. Get up slowly and steady yourself to prevent a fall.''"
Niaspan ER side effects,"''Get emergency medical help if you have any of these signs of an allergic reaction to Niaspan ER: hives; difficulty breathing; swelling of your face, lips, tongue, or throat.''Call your doctor at once if you have any of these serious side effects:''feeling like you might pass out;fast, pounding, or uneven heart beats;feeling short of breath;swelling;jaundice (yellowing of your skin or eyes); ormuscle pain, tenderness, or weakness with fever or flu symptoms and dark colored urine.''If you are diabetic, tell your doctor about any changes in your blood sugar levels.''Less serious Niaspan ER side effects include:''mild dizziness;warmth, redness, or tingly feeling under your skin;itching, dry skin;sweating or chills;nausea, diarrhea, belching, gas;muscle pain, leg cramps; orsleep problems (insomnia).''This is not a complete list of side effects and others may occur. Call your doctor for medical advice about side effects. You may report side effects to FDA at 1-800-FDA-1088.''''"
What other drugs will affect Niaspan ER?,"''Tell your doctor about all other cholesterol-lowering drugs you are taking with Niaspan ER, especially atorvastatin (Lipitor, Caduet), fluvastatin (Lescol), lovastatin (Mevacor, Altoprev, Advicor), pravastatin (Pravachol), or simvastatin (Zocor, Simcor, Vytorin, Juvisync).''Ask a doctor or pharmacist if it is safe for you to use Niaspan ER if you are also using any of the following drugs:''a blood thinner such as warfarin (Coumadin, Jantoven);multivitamins or mineral supplements that contain niacin;blood pressure or heart medications such as amlodipine (Norvasc, Caduet, Exforge, Lotrel, Tekamlo, Tribenzor, Twynsta, Amturnide), diltiazem (Cardizem, Cartia, Dilacor, Diltia, Diltzac, Taztia, Tiazac), felodipine (Plendil), nicardipine (Cardene), nifedipine (Procardia, Adalat), nimodipine (Nimotop), nisoldipine (Sular), or verapamil (Calan, Covera, Isoptin, Verelan); orheart medications such as doxazosin (Cardura), isosorbide (Dilatrate, Imdur, Isordil, Monoket, Sorbitrate), nitroglycerin (Nitro-Bid, Nitro-Dur, Nitrostat), prazosin (Minipress), or terazosin (Hytrin).''This list is not complete and other drugs may interact with Niaspan ER. Tell your doctor about all medications you use. This includes prescription, over-the-counter, vitamin, and herbal products. Do not start a new medication without telling your doctor.''''"
What is nifedipine? Nifedipine,''Nifedipine is in a group of drugs called calcium channel blockers. It works by relaxing the muscles of your heart and blood vessels.''Nifedipine is used to treat hypertension (high blood pressure) and angina (chest pain).''Nifedipine may also be used for purposes not listed in this medication guide.''
What is the most important information I should know about nifedipine? Nifedipine,"''You should not use nifedipine if you have severe coronary artery disease, or if you have had a heart attack within the past 2 weeks.''Before taking nifedipine, tell your doctor if you have kidney or liver disease, a blockage in your digestive tract (stomach or intestines), a history of stomach surgery, coronary artery disease, underactive thyroid, diabetes, or congestive heart failure.''If you need surgery, tell the surgeon ahead of time that you are using nifedipine. You may need to stop using the medicine for a short time.''Do not stop taking nifedipine without first talking to your doctor, even if you feel fine. Stopping suddenly may make your condition worse. High blood pressure often has no symptoms. You may need to use blood pressure medication for the rest of your life.''"
Before taking this medicine Nifedipine,"''You should not use this medicine if you are allergic to nifedipine, if you have severe coronary artery disease, or if you have had a heart attack within the past 2 weeks.''To make sure nifedipine is safe for you, tell your doctor if you have:''severe COPD (chronic obstructive pulmonary disease);kidney disease;congestive heart failure; orif you take other medications, especially an antibiotic or antifungal medicine, an antidepressant, heart or blood pressure medicine, or drugs to treat HIV/AIDS or hepatitis C.''It is not known whether nifedipine will harm an unborn baby. Tell your doctor if you are pregnant or plan to become pregnant while using this medication.''Nifedipine can pass into breast milk and may harm a nursing baby. Tell your doctor if you are breast-feeding a baby.''The nifedipine extended-release tablet may contain lactose. Talk to your doctor before using this form of nifedipine if you have galactose intolerance, or severe problems with lactose (milk sugar).''"
How should I take nifedipine? Nifedipine,"''Take nifedipine exactly as prescribed by your doctor. Follow all directions on your prescription label. Your doctor may occasionally change your dose to make sure you get the best results. Do not take this medicine in larger or smaller amounts or for longer than recommended.''You may need to take an extended-release tablet on an empty stomach. Follow the directions on your medicine label about taking this medication with or without food.''Do not crush, chew, or break a nifedipine extended-release tablet. Swallow it whole.''Your blood pressure will need to be checked often and you may need other blood tests at your doctor's office.''Some tablet forms of nifedipine are made with a shell that is not absorbed or melted in the body. Part of the tablet shell may appear in your stool. This is a normal side effect of nifedipine and will not make the medication less effective.''If you need surgery, tell the surgeon ahead of time that you are using nifedipine. You may need to stop using the medicine at least 36 hours before surgery.''You may have very low blood pressure while taking this medication. Call your doctor if you are sick with vomiting or diarrhea, or if you are sweating more than usual.''If you are also taking a beta-blocker (atenolol, carvedilol, labetalol, metoprolol, nadolol, nebivolol, propranolol, sotalol, and others) you should not stop using the beta-blocker suddenly or you could have serious heart problems that will not be prevented by nifedipine. Follow your doctor's instructions about tapering your beta-blocker dose.''You should not stop using nifedipine suddenly. Stopping suddenly may make your condition worse.''If you are being treated for high blood pressure, keep using this medication even if you feel well. High blood pressure often has no symptoms. You may need to use blood pressure medication for the rest of your life.''Store at room temperature away from moisture, heat, and light.''''What happens if I miss a dose?''Take the missed dose as soon as you remember. Skip the missed dose if it is almost time for your next scheduled dose. Do not take extra medicine to make up the missed dose.''"
What happens if I overdose? Nifedipine,''Seek emergency medical attention or call the Poison Help line at 1-800-222-1222.''
What should I avoid? Nifedipine,"''Grapefruit and grapefruit juice may interact with nifedipine and lead to unwanted side effects. Discuss the use of grapefruit products with your doctor.''Avoid getting up too fast from a sitting or lying position, or you may feel dizzy. Get up slowly and steady yourself to prevent a fall.''"
Nifedipine side effects,"''Get emergency medical help if you have any signs of an allergic reaction to nifedipine: hives; difficult breathing; swelling of your face, lips, tongue, or throat.''Call your doctor at once if you have:''worsening angina;a light-headed feeling, like you might pass out;pounding heartbeats or fluttering in your chest;chest pain or heavy feeling, pain spreading to the jaw or shoulder, nausea, sweating, general ill feeling;swelling in your ankles or feet; orupper stomach pain, jaundice (yellowing of the skin or eyes).''Common nifedipine side effects may include:''mild dizziness;flushing (warmth, redness, or tingly feeling);weakness, headache, mood changes;heartburn, nausea;tremors, muscle cramps; orcough, wheezing, sore throat, stuffy nose.''This is not a complete list of side effects and others may occur. Call your doctor for medical advice about side effects. You may report side effects to FDA at 1-800-FDA-1088.''''"
What is nitrofurantoin? Nitrofurantoin,''Nitrofurantoin is an antibiotic that fights bacteria in the body.''Nitrofurantoin is used to treat urinary tract infections.''Nitrofurantoin may also be used for purposes not listed in this medication guide.''
Important information Nitrofurantoin,"''You should not take nitrofurantoin if you have severe kidney disease, urination problems, or a history of jaundice or liver problems caused by nitrofurantoin.''Do not take this medicine if you are in the last 2 to 4 weeks of pregnancy.''"
Before taking this medicine Nitrofurantoin,"''You should not take nitrofurantoin if you are allergic to it, or if you have:''severe kidney disease;a history of jaundice or liver problems caused by taking nitrofurantoin;if you are urinating less than usual or not at all; orif you are in the last 2 to 4 weeks of pregnancy.''Do not take nitrofurantoin if you are in the last 2 to 4 weeks of pregnancy.''To make sure nitrofurantoin is safe for you, tell your doctor if you have:''kidney disease;anemia;diabetes;an electrolyte imbalance or vitamin B deficiency;glucose-6-phosphate dehydrogenase (G6PD) deficiency; orany type of debilitating disease.''FDA pregnancy category B. This medicine is not expected to be harmful to an unborn baby during early pregnancy. Tell your doctor if you are pregnant or plan to become pregnant during treatment.''Nitrofurantoin can pass into breast milk and may harm a nursing baby. You should not breast-feed while you are taking this medicine.''Nitrofurantoin should not be given to a child younger than 1 month old.''"
How should I take nitrofurantoin? Nitrofurantoin,"''Follow all directions on your prescription label. Do not take this medicine in larger or smaller amounts or for longer than recommended.''Take nitrofurantoin with food.''Shake the oral suspension (liquid) well just before you measure a dose. Measure liquid medicine with the dosing syringe provided, or with a special dose-measuring spoon or medicine cup. If you do not have a dose-measuring device, ask your pharmacist for one.''You may mix your liquid dose with water, milk, or fruit juice to make it easier to swallow. Drink the entire mixture right away.''Use this medicine for the full prescribed length of time. Your symptoms may improve before the infection is completely cleared. Skipping doses may also increase your risk of further infection that is resistant to antibiotics. Nitrofurantoin will not treat a viral infection such as the common cold or flu.''Nitrofurantoin is usually given for up to 3 to 7 days.''If you use this medicine long-term, you may need frequent medical tests at your doctor's office.''Nitrofurantoin can cause unusual results with certain lab tests for glucose (sugar) in the urine. Tell any doctor who treats you that you are using nitrofurantoin.''Store at room temperature away from moisture, heat, and light.''''What happens if I miss a dose?''Take the missed dose as soon as you remember. Skip the missed dose if it is almost time for your next scheduled dose. Do not take extra medicine to make up the missed dose.''"
What happens if I overdose? Nitrofurantoin,''Seek emergency medical attention or call the Poison Help line at 1-800-222-1222.''
What should I avoid while taking nitrofurantoin? Nitrofurantoin,"''Antibiotic medicines can cause diarrhea, which may be a sign of a new infection. If you have diarrhea that is watery or has blood in it, call your doctor. Do not use any medicine to stop the diarrhea unless your doctor has told you to.''Avoid using antacids without your doctor's advice. Use only the type of antacid your doctor recommends. Some antacids can make it harder for your body to absorb nitrofurantoin.''"
