Questions,Answer
Before taking this medicine,"''You should not use  naratriptan if you are allergic to naratriptan, or if you have:''severe or uncontrolled high blood pressure;past or present heart problems;history of coronary artery disease, heart attack, or stroke, including ""mini-stroke"";Wolff-Parkinson-White syndrome or other heart rhythm disorder;a blood vessel disorder or circulation problems that cause a lack of blood supply within the body;severe liver or kidney disease; ora headache that seems different from your usual migraine headaches.''To make sure naratriptan is safe for you, tell your doctor if you have:''liver or kidney disease;high blood pressure, a heart rhythm disorder; orcoronary heart disease (or risk factors such as diabetes, menopause, smoking, being overweight, having high cholesterol, having a family history of coronary artery disease, being older than 40 and a man, or being a woman who has had a hysterectomy).''It is not known whether this medicine will harm an unborn baby. Tell your doctor if you are pregnant or plan to become pregnant.''It is not known whether naratriptan passes into breast milk or if it could harm a nursing baby. You should not breast-feed while using this medicine.''Do not give this medicine to anyone younger than 18.''''How should I use naratriptan?''Your doctor may want to give your first dose of this medicine in a hospital or clinic setting to quickly treat any serious side effects that occur.''Follow all directions on your prescription label. Never use more than your recommended dose. Overuse of migraine headache medicine can make headaches worse. Tell your doctor if the medicine seems to stop working as well in treating your migraine attacks.''Take naratriptan as soon as you notice migraine symptoms.''Take 1 tablet whole with a full glass of water.''After taking a tablet: If your headache does not go away completely, or if it goes away and comes back, call your doctor before taking a second tablet.''Do not take the second tablet until at least 4 hours have passed since you took the first tablet. Do not take more than 5 milligrams (mg) of naratriptan in 24 hours.''If your symptoms have not improved after taking 2 tablets in 24 hours, contact your doctor before taking any more tablets.''Tell your doctor if you have more than four headaches in one month (30 days).''Naratriptan can raise blood pressure to dangerous levels. Your blood pressure may need to be checked often while you are using this medicine. If you use naratriptan long-term, your heart function may need to be checked using an electrocardiograph or ECG (sometimes called an EKG).''Store at room temperature away from moisture, heat, and light.''''What happens if I miss a dose?''Since naratriptan is used as needed, it does not have a daily dosing schedule. Call your doctor if your symptoms do not improve after using naratriptan.''''"
What happens if I overdose?,"''Seek emergency medical attention or call the Poison Help line at 1-800-222-1222.''Overdose symptoms may include tiredness, neck stiffness, loss of coordination, or feeling light-headed.''''"
What should I avoid while using naratriptan?,"''Do not take naratriptan within 24 hours before or after using another migraine headache medicine, including:''medicines like naratriptan--almotriptan, eletriptan, frovatriptan, rizatriptan, sumatriptan, zolmitriptan, and others; orergot medicine--dihydroergotamine, ergotamine, ergonovine, methylergonovine.''naratriptan may impair your thinking or reactions. Be careful if you drive or do anything that requires you to be alert.''''"
Naratriptan side effects,"''Get emergency medical help if you have signs of an allergic reaction: hives; difficult breathing; swelling of your face, lips, tongue, or throat.''Stop using naratriptan and call your doctor at once if you have:''fast or pounding heartbeats;numbness or tingling and a pale or blue-colored appearance in your fingers or toes;pain or heavy feeling in your legs, hip pain, burning pain in your feet;sudden and severe stomach pain, bloody diarrhea, constipation, fever, weight loss;dangerously high blood pressure--severe headache, blurred vision, pounding in your neck or ears, nosebleed, anxiety, confusion, severe chest pain, shortness of breath, irregular heartbeats, seizure;heart attack symptoms--chest pain or pressure, pain spreading to your jaw or shoulder, nausea, sweating;high levels of serotonin in the body--agitation, hallucinations, fever, fast heart rate, overactive reflexes, nausea, vomiting, diarrhea, loss of coordination, fainting; orsigns of a stroke--sudden numbness or weakness (especially on one side of the body), sudden severe headache, slurred speech, problems with vision or balance.''Common side effects may include:''dizziness, drowsiness;feeling weak or tired;numbness or tingling;flushing (warmth, redness, or tingly feeling);nausea; orpain or tightness in your jaw, neck, or throat.''This is not a complete list of side effects and others may occur. Call your doctor for medical advice about side effects. You may report side effects to FDA at 1-800-FDA-1088.''''"
Naratriptan dosing information,"''Usual Adult Dose for Migraine:Use only after a clear diagnosis of migraine has been establishedInitial dose: 1 mg or 2.5 mg orally, once-Provided there has been some response to first dose, a second dose may be administered at least 4 hours later if migraine returns or symptoms recur.Maximum dose: 5 mg in a 24-hour period Comments:-This drug should not be used to treat basilar or hemiplegic migraines because these patients are at a greater risk of stroke.-The safety of treating an average of 4 or more migraine attacks in a 30-day period has not been established.  Use: For the acute treatment of migraine with or without aura.''"
What is Nasonex?,"''Nasonex (mometasone) is a steroid. It prevents the release of substances in the body that cause inflammation.''Nasonex nasal spray is used to treat nasal symptoms of seasonal or year-round allergies, including congestion, sneezing, and runny nose. This medicine is approved for this use in adults and children who are at least 2 years old.''Nasonex is also used to prevent seasonal allergy symptoms in adults and children who are at least 12 years old.''Nasonex nasal spray is used to treat nasal polyps only in adults.''"
Important Information Nasonex,"''Before using Nasonex, tell your doctor if you have been sick or had an infection of any kind. Also tell your doctor if you have glaucoma or cataracts, herpes simplex infection of your eyes, tuberculosis, sores or ulcers in your nose, or if you have recently had injury of or surgery on your nose.''It may take up to 2 weeks of using this medicine before your symptoms improve. For best results, keep using the medication as directed. Talk with your doctor if your symptoms do not improve after a week of treatment.''Mometasone can lower the blood cells that help your body fight infections. Avoid being near people who are sick or have infections. Call your doctor for preventive treatment if you are exposed to chicken pox or measles. These conditions can be serious or even fatal in people who are using Nasonex.''Avoid getting Nasonex in your eyes. If this does happen, rinse with water and call your doctor''"
Before taking this medicine Nasonex,"''You should not use Nasonex nasal spray if you are allergic to mometasone.''Tell your doctor if you have ever had:''an active or chronic infection;glaucoma or cataracts;herpes simplex virus of your eyes;tuberculosis or any other infection or illness;sores or ulcers inside your nose; ornasal surgery or injury to your nose.''Tell your doctor if you are pregnant or plan to become pregnant.''It may not be safe to breast-feed a baby while you are using this medicine. Ask your doctor about any risks.''Nasonex nasal spray is not approved to treat allergy symptoms in anyone younger than 2 years old, or to prevent allergy symptoms in anyone younger than 12 years old.''How should I use Nasonex?''Use Nasonex nasal spray exactly as it was prescribed for you. Follow all directions on your prescription label and read all medication guides or instruction sheets. Use the medicine exactly as directed.''Do not take by mouth. Nasonex nasal spray is for use only in your nose.''Your doctor may recommend you start using Nasonex 2 to 4 weeks before the start of allergy season.''Read and carefully follow any Instructions for Use provided with your medicine. Ask your doctor or pharmacist if you do not understand these instructions.''Shake the nasal spray well just before each use. Before your first use, prime the nasal spray pump by spraying the medicine into the air until a fine mist appears. If the nasal spray has not been used for longer than 1 week, prime it by spraying the medicine into the air until a fine mist appears.''To use the Nasonex nasal spray:''Blow your nose gently. Keep your head upright and insert the tip of the bottle into one nostril. Press your other nostril closed with your finger. Breathe in quickly and gently spray the medicine into your nose. Then use the spray in your other nostril.Do not blow your nose for at least a few minutes after using the nasal spray.Use only the number of sprays your doctor has prescribed.If the spray gets in your eyes or mouth or on your skin, rinse with water.If the nasal spray has not been used for longer than 1 week, prime it by spraying the medicine into the air until a fine mist appears.''Read all patient information, medication guides, and instruction sheets provided to you. Ask your doctor or pharmacist if you have any questions.''It may take up to 2 weeks before your symptoms improve. Keep using Nasonex as directed and tell your doctor if your symptoms do not improve.''While you are using Nasonex, your doctor may need to examine you to make sure the medicine is not harming your nose or sinuses.''It may take up to 2 weeks before your symptoms improve. Keep using the medicine as directed and tell your doctor if your symptoms do not improve.''Store Nasonex in an upright position at room temperature, away from moisture and heat. Throw the medicine away after you have used 120 sprays, even if there is still medicine left in the bottle.''"
Nasonex dosing information,"''Usual Adult Dose of Nasonex for Allergic Rhinitis:''2 sprays in each nostril once a day.When used for the prevention of allergic rhinitis, treatment should begin 2-4 weeks prior to pollen season.''Usual Adult Dose of Nasonex for Nasal Polyps:''2 sprays in each nostril twice daily. 2 sprays in each nostril once daily may be effective in some patients.''Usual Pediatric Dose of Nasonex for Allergic Rhinitis:''2 years to 11 years:1 spray in each nostril once a day.12 years or older:2 sprays in each nostril once a day.When used for the prevention of allergic rhinitis, treatment should begin 2 to 4 weeks prior to pollen season.''''What happens if I miss a dose?''Use the medicine as soon as you can, but skip the missed dose if it is almost time for your next dose. Do not use two doses at one time.''"
What happens if I overdose? Nasonex,"''Seek emergency medical attention or call the Poison Help line at 1-800-222-1222.''An overdose of mometasone nasal spray is not expected to produce life threatening symptoms. Long term use of high doses can lead to thinning skin, easy bruising, changes in body fat (especially in your face, neck, back, and waist), increased acne or facial hair, menstrual problems, impotence, or loss of interest in sex.''"
What should I avoid while using Nasonex?,''Rinse with water if this medicine gets in your eyes.''Avoid being near people who are sick or have infections. Call your doctor for preventive treatment if you are exposed to chickenpox or measles. These conditions can be serious or even fatal in people who are using steroid medicine.''
Nasonex side effects,"''Get emergency medical help if you have signs of an allergic reaction to Nasonex: hives; difficult breathing; swelling of your face, lips, tongue, or throat.''Call your doctor at once if you have:''severe bleeding or increased drainage from your nose;nose pain or discomfort, headache;white patches or sores in the nose that won't heal;wheezing, trouble breathing;vision problems;ear pain or full feeling, trouble hearing, drainage from the ear.''Steroid medicine can affect growth in children. Tell your doctor if your child is not growing at a normal rate while using Nasonex.''Although the risk of serious side effects is low when mometasone is used in the nose, side effects can occur if the medicine is absorbed into your bloodstream. Tell your doctor if you have possible signs of long-term steroid use:''weight gain (especially in your face or your upper back and torso);slow wound healing, thinning skin, increased body hair;irregular menstrual periods, changes in sexual function; ormuscle weakness, tired feeling, depression, anxiety, or feeling irritable.''Common Nasonex side effects may include:''nosebleeds;headache;stuffy nose, sore throat, cough; orflu-like symptoms.''This is not a complete list of side effects and others may occur. Call your doctor for medical advice about side effects. You may report side effects to FDA at 1-800-FDA-1088.''''"
What other drugs will affect Nasonex?,"''Sometimes it is not safe to use certain medications at the same time. Some drugs can affect your blood levels of other drugs you take, which may increase side effects or make the medications less effective.''Tell your doctor about all your other medicines, especially:''an antibiotic;antifungal medicine;an antidepressant; orantiviral medicine to treat HIV/AIDS.''This list is not complete. Other drugs may interact with mometasone nasal, including prescription and over-the-counter medicines, vitamins, and herbal products. Not all possible drug interactions are listed here.''''"
What is nateglinide? Nateglinide,''Nateglinide is used together with diet and exercise to improve blood sugar control in adults with type 2 diabetes mellitus.  nateglinide is not for treating type 1 diabetes.''Other diabetes medicines are sometimes used in combination with nateglinide if needed.''Nateglinide may also be used for purposes not listed in this medication guide.''''
Important Information Nateglinide,''You should not use nateglinide if you have diabetic ketoacidosis (call your doctor for treatment).''''
Before taking this medicine Nateglinide,"''You should not use nateglinide if you are allergic to it, or if you have:''diabetic ketoacidosis (call your doctor for treatment).''Tell your doctor if you have ever had:''liver disease; orgout.''Follow your doctor's instructions about using  nateglinide if you are pregnant or you become pregnant. Controlling diabetes is very important during pregnancy, and having high blood sugar may cause complications in both the mother and the baby.''You should not breastfeed while using this medicine.''Nateglinide is not approved for use by anyone younger than 18 years old.''''"
How should I take nateglinide? Nateglinide,"''Follow all directions on your prescription label and read all medication guides or instruction sheets. Use the medicine exactly as directed.''Nateglinide is usually taken 3 times daily, within 1 to 30 minutes before a meal. If you skip a meal, do not take your dose of nateglinide. Wait until your next meal.''You may have low blood sugar (hypoglycemia) and feel very hungry, dizzy, irritable, confused, anxious, or shaky. To quickly treat hypoglycemia, eat or drink a fast-acting source of sugar (fruit juice, hard candy, crackers, raisins, or non-diet soda).''Your doctor may prescribe a glucagon injection kit in case you have severe hypoglycemia. Be sure your family or close friends know how to give you this injection in an emergency.''Also watch for signs of high blood sugar (hyperglycemia) such as increased thirst or urination.''Blood sugar levels can be affected by stress, illness, surgery, exercise, alcohol use, or skipping meals. Ask your doctor before changing your dose or medication schedule.''Nateglinide is only part of a treatment program that may also include diet, exercise, weight control, blood sugar testing, and special medical care. Follow your doctor's instructions very closely.''Store at room temperature away from moisture and heat.''''What happens if I miss a dose?''Take your dose as soon as you can, but only if you are getting ready to eat a meal. If you skip a meal, skip the missed dose and wait until your next meal. Do not take two doses at one time.''''"
What happens if I overdose? Nateglinide,"''Seek emergency medical attention or call the Poison Help line at 1-800-222-1222. You may have signs of low blood sugar, such as extreme weakness, blurred vision, sweating, trouble speaking, tremors, stomach pain, confusion, and seizure (convulsions).''''"
What should I avoid while taking nateglinide? Nateglinide,''Avoid drinking alcohol. It lowers blood sugar and may interfere with your diabetes treatment.''''
Nateglinide side effects,"''Get emergency medical help if you have signs of an allergic reaction: hives; difficulty breathing; swelling of your face, lips, tongue, or throat.''Call your doctor at once if you have:''seizure (convulsions); orjaundice (yellowing of the skin or eyes).''Common side effects may include:''runny or stuffy nose, sneezing, cough, cold or flu symptoms;diarrhea;back pain;dizziness; orjoint pain or stiffness.''This is not a complete list of side effects and others may occur. Call your doctor for medical advice about side effects. You may report side effects to FDA at 1-800-FDA-1088.''''"
Nateglinide dosing information,"''Usual Adult Dose for Diabetes Type 2:Initial dose: 60 to 120 mg orally 3 times a day before mealsMaintenance dose: 60 to 120 mg orally 3 times a day before mealsComments:-For patients who are near HbA1c goal when therapy is initiated, initial dose should be 60 mg orally 3 times.-Patients should take this drug 1 to 30 minutes before a meal; if a meal is skipped, the dose scheduled to be given with that meal should be skipped to avoid hypoglycemia.  -This drug should not be used in patients with type 1 diabetes mellitus or for the treatment of diabetic ketoacidosis.  Use: As an adjunct to diet and exercise to improve glycemic control in adults with type 2 diabetes mellitus.''"
What is nebivolol? Nebivolol,''Nebivolol is a beta-blocker that is used to treat hypertension (high blood pressure). Lowering blood pressure may lower your risk of a stroke or heart attack.''Nebivolol may also be used for purposes not listed in this medication guide.''''
Important Information Nebivolol,''Do not skip doses or stop taking nebivolol without first talking to your doctor.''''
Before taking this medicine Nebivolol,"''You should not take nebivolol if you are allergic to it, or if you have:''a serious heart condition such as heart failure, ""AV block"" (2nd or 3rd degree), or sick sinus syndrome (unless you have a pacemaker);very slow heartbeats;severe liver disease; orif your heart cannot pump blood properly.''Tell your doctor if you have ever had:''asthma, bronchitis, emphysema;a heart attack;problems with circulation (especially in your feet and legs);diabetes (taking nebivolol can make it harder for you to tell when you have low blood sugar);a thyroid disorder;liver or kidney disease;allergies; orpheochromocytoma (tumor of the adrenal gland).''Tell your doctor if you are pregnant or plan to become pregnant. It is not known whether nebivolol will harm an unborn baby. However, having high blood pressure during pregnancy may cause complications such as diabetes or eclampsia (dangerously high blood pressure that can lead to medical problems in both mother and baby). The benefit of treating hypertension may outweigh any risks to the baby.''You should not breastfeed while using nebivolol.''''"
How should I take nebivolol? Nebivolol,"''Follow all directions on your prescription label and read all medication guides or instruction sheets. Your doctor may occasionally change your dose. Use the medicine exactly as directed.''You may take nebivolol with or without food.''Your blood pressure will need to be checked often.''If you need surgery, tell the surgeon ahead of time that you are using nebivolol.''You should not skip doses or stop using nebivolol suddenly. Stopping suddenly may make your condition worse or cause serious heart problems, including heart attack. Follow your doctor's instructions about tapering your dose.''Keep using  nebivolol as directed, even if you feel well. High blood pressure often has no symptoms. You may need to use blood pressure medicine for the rest of your life.''Store at room temperature away from moisture and heat.''''What happens if I miss a dose?''Take the medicine as soon as you can, but skip the missed dose if it is almost time for your next dose. Do not take two doses at one time.''''"
What happens if I overdose? Nebivolol,"''Seek emergency medical attention or call the Poison Help line at 1-800-222-1222.''Overdose symptoms may include slow heart rate, dizziness, vomiting, trouble breathing, or feeling like you might pass out.''''"
What should I avoid while taking nebivolol? Nebivolol,''Avoid driving or hazardous activity until you know how  nebivolol will affect you. Your reactions could be impaired.''''
Nebivolol side effects,"''Get emergency medical help if you have signs of an allergic reaction: hives; difficult breathing; swelling of your face, lips, tongue, or throat.''Call your doctor at once if you have:''a light-headed feeling, like you might pass out;rapid weight gain;shortness of breath;slow or uneven heartbeats; ornumbness or cold feeling in your hands and feet.''Common side effects may include:''dizziness;swelling in your legs;slow heartbeats;tiredness; orheadache.''This is not a complete list of side effects and others may occur. Call your doctor for medical advice about side effects. You may report side effects to FDA at 1-800-FDA-1088.''''"
Nebivolol dosing information,"''Usual Adult Dose for Hypertension:Initial dose: 5 mg orally once a dayDose adjustment: Titrate dose at 2-week intervals up to 40 mg once a day as needed.Maximum dose: 40 mg per dayComments:-Titrating doses more frequently than every 2 weeks is unlikely to be beneficial.-The dose should be individualized to patient requirements.   Use: For the management of hypertension, alone or with another antihypertensive agent.''"
What is neomycin? Neomycin,''Neomycin is an antibiotic that fights bacteria in the body.''Neomycin is used to reduce the risk of infection during surgery of your intestines. Neomycin is also used to reduce the symptoms of hepatic coma.''Neomycin may also be used for purposes not listed in this medication guide.''''
Important Information Neomycin,"''You should not take  neomycin if you are allergic to neomycin or similar antibiotics such as amikacin (Amikin), gentamicin (Garamycin), kanamycin (Kantrex), paromomycin (Humatin, Paromycin), streptomycin, or tobramycin (Nebcin, Tobi).''You should not take neomycin if you have ulcerative colitis, Crohn's disease, a blockage in your intestines, or other inflammatory bowel disease.''Do not use neomycin if you are pregnant. It could harm the unborn baby.''Before you take neomycin, tell your doctor if you have kidney disease, myasthenia gravis, or Parkinson's disease.''Never take neomycin in larger amounts than recommended, or for longer than 2 weeks. High doses or long-term use of neomycin can cause serious kidney problems, or hearing loss that may not be reversible. The longer you take neomycin, the more likely you are to develop these serious side effects.''To be sure this medication is not causing harmful effects, your kidney function, and your nerve and muscle function will need to be tested often. You may also need hearing tests. Neomycin can have long lasting effects on your body. Do not miss any follow up visits to your doctor for blood or urine tests.''Neomycin can harm your kidneys, and this effect is increased when you also use certain other medicines harmful to the kidneys. Before using neomycin, tell your doctor about all other medicines you use. Many other drugs (including some over-the-counter medicines) can be harmful to the kidneys.''If you are being treated for hepatic coma, avoid eating foods that are high in protein. Follow your doctor's instructions about any other restrictions on food, beverages, or activity.''''"
Before taking this medicine Neomycin,"''You should not take this medicine if you are allergic to neomycin or similar antibiotics such as amikacin (Amikin), gentamicin (Garamycin), kanamycin (Kantrex), paromomycin (Humatin, Paromycin), streptomycin, or tobramycin (Nebcin, Tobi).''You should not take neomycin if you have ulcerative colitis, Crohn's disease, a blockage in your intestines, or other inflammatory bowel disease.''To make sure you can safely take neomycin, tell your doctor if you have any of these other conditions:''kidney disease;myasthenia gravis; orParkinson's disease.''FDA pregnancy category D. Do not use neomycin if you are pregnant. It could harm the unborn baby. Use effective birth control, and tell your doctor if you become pregnant during treatment.''It is not known whether neomycin passes into breast milk or if it could harm a nursing baby. You should not breast-feed while you are using neomycin.''''"
