Questions,Answer
Tolterodine side effects,"''Get emergency medical help if you have any of these signs of an allergic reaction: hives; difficulty breathing; swelling of your face, lips, tongue, or throat.''Stop using tolterodine and call your doctor at once if you have any of these serious side effects:''chest pain, fast or uneven heart rate;confusion, hallucinations;urinating less than usual or not at all; orpainful or difficult urination.''Less serious side effects may include:''dry mouth, dry eyes;blurred vision;dizziness, drowsiness;constipation or diarrhea;stomach pain or upset;joint pain; orheadache.''This is not a complete list of side effects and others may occur. Call your doctor for medical advice about side effects. You may report side effects to FDA at 1-800-FDA-1088.''''"
Tolterodine dosing information,"''Usual Adult Dose for Urinary Incontinence:Immediate release tablets:-Initial dose: 2 mg orally 2 times a day-Maintenance dose: 1 to 2 mg orally 2 times a day, depending on patient response and tolerabilityExtended release capsules: -Initial dose: 4 mg orally once a day-Maintenance dose: 2 to 4 mg orally once a day, depending on patient response and tolerabilityComments:-This drug can be taken with or without food.-The extended release formulation should be swallowed whole.Use: For the treatment of overactive bladder (OAB) with symptoms of urge urinary incontinence, urgency, and frequencyUsual Adult Dose for Urinary Frequency:Immediate release tablets:-Initial dose: 2 mg orally 2 times a day-Maintenance dose: 1 to 2 mg orally 2 times a day, depending on patient response and tolerabilityExtended release capsules: -Initial dose: 4 mg orally once a day-Maintenance dose: 2 to 4 mg orally once a day, depending on patient response and tolerabilityComments:-This drug can be taken with or without food.-The extended release formulation should be swallowed whole.Use: For the treatment of overactive bladder (OAB) with symptoms of urge urinary incontinence, urgency, and frequency''"
What is Topamax?,"''Topamax (topiramate) was originally FDA-approved as a seizure medicine, also called an anticonvulsant. Topiramate is used to treat seizures in adults and children who are at least 2 years old.''Topamax is also used to prevent migraine headaches in adults and teenagers who are at least 12 years old. This medicine will only prevent migraine headaches or reduce the number of attacks. It will not treat a headache that has already begun.''Topamax may also be used for purposes not listed in this medication guide.''"
Important Information Topamax,"''Topamax may cause vision problems that can be permanent if not treated quickly. Call your doctor right away if you have a sudden decrease in vision.''Topamax can decrease sweating and may cause life-threatening hyperthermia (especially in children). Avoid becoming overheated or dehydrated. Tell your doctor if you have decreased sweating, high fever, and hot dry skin.''Some people have thoughts about suicide while taking seizure medicine. Stay alert to changes in your mood or symptoms. Report any new or worsening symptoms to your doctor.''Do not stop using Topamax suddenly or you could have increased seizures.''"
Before taking this medicine Topamax,"''You should not use Topamax if you are allergic to topiramate. You should not use extended-release topiramate if you have metabolic acidosis (high levels of acid in your blood) and are also taking metformin for diabetes.''To make sure Topamax is safe for you, tell your doctor if you have ever had:''glaucoma or other eye problems;diabetes, or metabolic acidosis;kidney disease, kidney stones, or dialysis;lung disease, breathing problems;mood problems, depression, or suicidal thoughts or actions;an eating disorder;liver disease;soft or brittle bones (osteoporosis, osteomalacia);a growth disorder; orif you are sick with diarrhea.''Topiramate can increase the level of acid in your blood (metabolic acidosis). This can weaken your bones, cause kidney stones, or cause growth problems in children or harm to an unborn baby. You may need blood tests to make sure you do not have metabolic acidosis, especially if you are pregnant.''Some people have thoughts about suicide while taking an anticonvulsant. Your doctor will need to check your progress at regular visits while you are using Topamax. Your family or other caregivers should also be alert to changes in your mood or symptoms.''Taking Topamax during pregnancy may increase the risk of cleft lip and/or cleft palate, a birth defect that can develop early in pregnancy even before you know you are pregnant. However, having a seizure during pregnancy could harm both the mother and the baby. Tell your doctor right away if you become pregnant.''If you take Topamax during pregnancy: The benefit of preventing seizures may outweigh any risks posed by this medicine. There may be other medications that are safer to use. Do not start or stop taking Topamax without your doctor's advice.''If you are not pregnant or planning to become pregnant, use effective birth control to prevent pregnancy while taking topiramate.''Topiramate can make birth control pills less effective. Ask your doctor about using a non-hormonal birth control (condom, diaphragm, cervical cap, or contraceptive sponge) to prevent pregnancy.''It may not be safe to breastfeed a baby while you are using this medicine. Ask your doctor about any risks.''"
How should I take Topamax?,"''Take Topamax max exactly as prescribed by your doctor. Follow all directions on your prescription label. Your doctor may occasionally change your dose. Do not take this medicine in larger or smaller amounts or for longer than recommended.''Topamax can be taken with or without food.''Do not crush, chew, or break a Topamax tablet. Swallow the tablet whole.''Topamax Sprinkle Capsule can be swallowed whole. Or you may open the capsule and sprinkle the medicine into a spoonful of applesauce or other soft food. Swallow right away without chewing. Do not save the mixture for later use.''Carefully follow the swallowing instructions for your medicine.''Topiramate doses are based on weight in children. Your child's dose needs may change if the child gains or loses weight.''Drink plenty of liquids while you are taking topiramate, to prevent kidney stones or an electrolyte imbalance.''While using Topamax, you may need frequent blood tests. If you need surgery, tell the surgeon ahead of time that you are using this medicine. Any medical care provider who treats you should know that you take seizure medication.''Do not stop using Topamax suddenly, even if you feel fine. Stopping suddenly may cause increased seizures. Follow your doctor's instructions about tapering your dose.''Call your doctor if your seizures get worse or you have them more often while taking Topamax.''Store at cool room temperature away from moisture, light, and high heat. Keep the bottle tightly closed when not in use.''''What happens if I miss a dose?''Take the missed dose as soon as you remember. Skip the missed dose if you are more than 6 hours late in taking it. Wait until your next scheduled dose. Do not take extra medicine to make up the missed dose.''Call your doctor for instructions if you miss two or more doses.''"
What happens if I overdose? Topamax,"''Seek emergency medical attention or call the Poison Help line at 1-800-222-1222.''Overdose symptoms may include drowsiness, agitation, depression, double vision, thinking problems, problems with speech or coordination, fainting, and seizures (convulsions).''"
What should I avoid while taking Topamax?,"''Do not drink alcohol. Dangerous side effects or increased seizures may occur.''Avoid becoming overheated or dehydrated in hot weather. Topiramate can decrease sweating and increase body temperature, leading to life-threatening dehydration (especially in children).''Ketogenic or ""ketosis"" diets that are high in fat and low in carbohydrates can increase the risk of kidney stones. Avoid the use of such diets while you are taking Topamax.''Topiramate may cause blurred vision or impair your thinking or reactions. Avoid driving or operating machinery until you know how this medicine will affect you.''Also avoid activities that could be dangerous if you have an unexpected seizure, such as swimming or climbing in high places.''"
Topamax side effects,"''Get emergency medical help if you have signs of an allergic reaction to Topamax (hives, difficult breathing, swelling in your face or throat) or a severe skin reaction (fever, sore throat, burning eyes, skin pain, red or purple skin rash with blistering and peeling).''Report any new or worsening mood symptoms to your doctor, such as: mood or behavior changes, anxiety, panic attacks, trouble sleeping, or if you feel impulsive, irritable, agitated, hostile, aggressive, restless, hyperactive (mentally or physically), depressed, or have thoughts about suicide or hurting yourself.''Call your doctor at once if you have:''a skin rash, no matter how mild;vision problems, eye pain or redness, sudden vision loss (can be permanent if not treated quickly);confusion, problems with thinking or memory, trouble concentrating, problems with speech;dehydration symptoms - decreased sweating, high fever, hot and dry skin;signs of a kidney stone - severe pain in your side or lower back, painful or difficult urination;signs of too much acid in your blood - irregular heartbeats, feeling tired, loss of appetite, trouble thinking, feeling short of breath; orsigns of too much ammonia in your blood - vomiting, unexplained weakness, feeling like you might pass out.''Common Topamax side effects may include:''fever, weight loss;numbness or tingling in your arms and legs;flushing (warmth, redness, or tingly feeling);headache, dizziness, drowsiness, tired feeling, slow reactions;mood problems, feeling nervous;nausea, diarrhea, stomach pain, loss of appetite, indigestion;cold symptoms such as stuffy nose, sneezing, sore throat; orchanges in your sense of taste.''This is not a complete list of side effects and others may occur. Call your doctor for medical advice about side effects. You may report side effects to FDA at 1-800-FDA-1088.''''"
What other drugs will affect Topamax?,"''Taking Topamax with other drugs that make you sleepy can worsen this effect. Ask your doctor before taking a sleeping pill, opioid pain medication, muscle relaxer, or medicine for anxiety or depression.''Tell your doctor about all your current medicines and any you start or stop using, especially:''zonisamide;birth control pills;divalproex, valproic acid; orother glaucoma medications, including eye drops.''This list is not complete. Other drugs may interact with topiramate, including prescription and over-the-counter medicines, vitamins, and herbal products. Not all possible interactions are listed in this medication guide.''''"
What is topiramate? Topiramate,"''Topiramate is a seizure medicine, also called an anticonvulsant. Topiramate is used to treat certain types of seizures in adults and children who are at least 2 years old. Trokendi XR is for use in adults and children who are at least 6 years old.''Some brands of topiramate are also used to prevent migraine headaches in adults and teenagers who are at least 12 years old. These medicines will only prevent migraine headaches or reduce the number of attacks, but will not treat a headache that has already begun.''Topiramate may also be used for purposes not listed in this medication guide.''''"
Important Information Topiramate,"''Topiramate may cause vision problems that can be permanent if not treated quickly. Call your doctor right away if you have a sudden decrease in vision.''topiramate may increase the risk of a birth defect called cleft lip and palate in a newborn. There may be other medications that are safer to use during pregnancy. Tell your doctor right away if you become pregnant.''Topiramate can increase body temperature and decrease sweating, which may lead to life-threatening dehydration. Tell your doctor if you have decreased sweating, high fever, and hot dry skin.''Topiramate can also increase the level of acid in your blood (metabolic acidosis). Tell your doctor if you have irregular heartbeats, shortness of breath, loss of appetite, or trouble thinking.''Some people have thoughts about suicide while taking seizure medicine. Stay alert to changes in your mood or symptoms. Report any new or worsening symptoms to your doctor.''Do not stop using topiramate suddenly or you could have increased seizures.''''"
Before taking this medicine Topiramate,"''You should not use topiramate if you are allergic to it. Do not take Trokendi XR within 6 hours before or 6 hours after drinking alcohol.''Tell your doctor if you are sick with diarrhea, or if you have ever had:''glaucoma or other eye problems;metabolic acidosis (high levels of acid in your blood);kidney disease, kidney stones, or dialysis;lung disease, breathing problems;mood problems, depression, or suicidal thoughts or actions;liver disease;a growth disorder; orsoft or brittle bones (osteoporosis, osteomalacia).''Topiramate can increase the level of acid in your blood (metabolic acidosis). This can weaken your bones, cause kidney stones, or cause growth problems in children or harm to an unborn baby. You may need blood tests to make sure you do not have metabolic acidosis, especially if you are pregnant.''Some people have thoughts about suicide while taking an anticonvulsant. Your doctor should check your progress at regular visits. Your family or other caregivers should also be alert to changes in your mood or symptoms.''Taking topiramate during pregnancy may increase the risk of cleft lip and/or cleft palate, a birth defect that can develop early in pregnancy even before you know you are pregnant. However, having a seizure during pregnancy could harm both the mother and the baby. Tell your doctor right away if you become pregnant.''If you take topiramate during pregnancy: The benefit of preventing seizures may outweigh any risks posed by this medicine. There may be other medications that are safer to use. Do not start or stop taking topiramate without your doctor's advice.''If you are not pregnant or planning to become pregnant, use effective birth control to prevent pregnancy while taking topiramate.''Topiramate can make birth control pills less effective. Ask your doctor about using a non-hormonal birth control (condom, diaphragm, cervical cap, or contraceptive sponge) to prevent pregnancy.''It may not be safe to breastfeed a baby while you are using this medicine. Ask your doctor about any risks.''''"
How should I take topiramate? Topiramate,"''Follow all directions on your prescription label and read all medication guides or instruction sheets. Your doctor may occasionally change your dose. Use the medicine exactly as directed.''Topiramate can be taken with or without food.''Swallow the tablet whole and do not crush, chew, or break it. The Trokendi XR extended-release capsule must be swallowed whole. Do not break or open.''If you cannot swallow a Qudexy XR or Topamax Sprinkle Capsule whole, open it and sprinkle the medicine into a spoonful of applesauce or other soft food. Swallow the mixture right away without chewing. Do not save it for later use.''Carefully follow the swallowing instructions for your medicine.''Topiramate doses are sometimes based on weight in children. Your child's dose needs may change if the child gains or loses weight.''Drink plenty of liquids while you are taking topiramate, to prevent kidney stones or an electrolyte imbalance.''You will need frequent medical tests. If you need surgery, tell the surgeon ahead of time that you are using topiramate. Any medical care provider who treats you should know that you take seizure medication.''Do not stop using topiramate suddenly, even if you feel fine. Stopping suddenly may cause increased seizures. Follow your doctor's instructions about tapering your dose.''Call your doctor if your seizures get worse or you have them more often while taking topiramate.''Store at cool room temperature away from moisture, light, and high heat.''''What happens if I miss a dose?''Take the medicine as soon as you can. Do not take two doses at one time. Skip a missed Topamax dose if your next dose is due in less than 6 hours.''Call your doctor if you have missed more than one dose.''''"
What happens if I overdose? Topiramate,"''Seek emergency medical attention or call the Poison Help line at 1-800-222-1222. An overdose of topiramate can be fatal. Overdose can cause drowsiness, agitation, depression, double vision, thinking problems, problems with speech or coordination, fainting, and seizure (convulsions).''''"
What should I avoid while taking topiramate? Topiramate,"''Do not drink alcohol. Dangerous side effects or increased seizures may occur.''Avoid becoming overheated or dehydrated in hot weather. Topiramate can increase body temperature and decrease sweating, leading to life-threatening dehydration (especially in children).''Avoid the use of a ketogenic or ""ketosis"" diet (high in fat, low in carbohydrates) while you are taking topiramate.''Topiramate may cause blurred vision or impair your thinking or reactions. Avoid driving or operating machinery until you know how  topiramate will affect you.''Also avoid activities that could be dangerous if you have an unexpected seizure, such as swimming or climbing in high places.''''"
Topiramate side effects,"''Get emergency medical help if you have signs of an allergic reaction (hives, difficult breathing, swelling in your face or throat) or a severe skin reaction (fever, sore throat, burning eyes, skin pain, red or purple skin rash with blistering and peeling).''Report any new or worsening mood symptoms to your doctor, such as: mood or behavior changes, anxiety, panic attacks, trouble sleeping, or if you feel impulsive, irritable, agitated, hostile, aggressive, restless, hyperactive (mentally or physically), depressed, or have thoughts about suicide or hurting yourself.''Call your doctor at once if you have:''a skin rash, no matter how mild;vision problems, blurred vision, eye pain or redness, sudden vision loss (can be permanent if not treated quickly);confusion, problems with thinking or memory, trouble concentrating, problems with speech;dehydration symptoms--decreased sweating, high fever, hot and dry skin;signs of a kidney stone--severe pain in your side or lower back, painful or difficult urination;signs of too much acid in your blood--irregular heartbeats, feeling tired, loss of appetite, trouble thinking, feeling short of breath; orsigns of too much ammonia in your blood--vomiting, unexplained weakness, feeling like you might pass out.''Common side effects may include:''dizziness, drowsiness, tired feeling, slow reactions;problems with speech or memory;abnormal vision;numbness or tingling in your arms and legs, decreased sensation (especially in the skin);changes in your sense of taste;feeling nervous;nausea, diarrhea, stomach pain, loss of appetite;fever, weight loss; orcold symptoms such as stuffy nose, sneezing, sore throat.''This is not a complete list of side effects and others may occur. Call your doctor for medical advice about side effects. You may report side effects to FDA at 1-800-FDA-1088.''''"
What other drugs will affect topiramate? Topiramate,"''Using topiramate with other drugs that make you drowsy can worsen this effect. Ask your doctor before using opioid medication, a sleeping pill, a muscle relaxer, or medicine for anxiety or depression.''Tell your doctor about all your other medicines, especially:''zonisamide;birth control pills;divalproex, valproic acid; orother glaucoma medications, including eye drops.''This list is not complete. Other drugs may affect topiramate, including prescription and over-the-counter medicines, vitamins, and herbal products. Not all possible drug interactions are listed here.''''"
What is Toprol-XL?,''Toprol-XL (metoprolol succinate) is a beta-blocker that affects the heart and circulation (blood flow through arteries and veins).''Toprol-XL is used to treat angina (chest pain) and hypertension (high blood pressure).''Toprol-XL is also used to lower your risk of death or needing to be hospitalized for heart failure.''Toprol-XL may also be used for indications not in this medication guide.''
Important Information Toprol-XL,"''You should not use Toprol-XL if you have a severe heart block (greater than first degree), sick sinus syndrome without a pacemaker, severe circulation problems, severe heart failure, a history of slow heart beats that caused fainting, or if you are allergic to Toprol-XL or metoprolol.''"
Before taking this medicine Toprol-XL,"''You should not use Toprol-XL if you are allergic to metoprolol, or other beta-blockers (atenolol, carvedilol, labetalol, nadolol, nebivolol, propranolol, sotalol, and others), or if you have:''a serious heart problem such as heart block greater than first degree or sick sinus syndrome without a pacemaker;severe circulation problems;severe heart failure (that required you to be in the hospital); ora history of slow heart beats that have caused you to faint.''To make sure Toprol-XL is safe for you, tell your doctor if you have:''asthma, chronic obstructive pulmonary disease (COPD), sleep apnea, or other breathing disorder;diabetes (taking Toprol-XL may make it harder for you to tell when you have low blood sugar);liver disease;congestive heart failure;problems with circulation (such as Raynaud's syndrome);peripheral vascular disease or claudication (pain in your legs when walking);a thyroid disorder; orpheochromocytoma (tumor of the adrenal gland); orif you are planning major surgery or dental work.''Do not give Toprol-XL to a child without medical advice.''Tell your doctor about all medications you are taking before using Toprol-XL, especially any calcium channel blockers (including diltiazem, verapamil, and others).''Tell your doctor if you are pregnant or plan to become pregnant. It is not known whether metoprolol succinate will harm an unborn baby. However, having high blood pressure during pregnancy may cause complications such as diabetes or eclampsia (dangerously high blood pressure that can lead to medical problems in both mother and baby). The benefit of treating hypertension may outweigh any risks to the baby.''Ask a doctor before using Toprol-XL if you are breast-feeding. Metoprolol succinate can pass into breast milk and may cause dry skin, dry mouth, diarrhea, constipation, or slow heartbeats in your baby.''"
How should I take Toprol-XL?,"''Take Toprol-XL exactly as prescribed by your doctor. Follow all directions on your prescription label and read all medication guides or instruction sheets. Your doctor may occasionally change your dose.''Toprol-XL should be taken with a meal or just after a meal.''Take the medicine at the same time each day.''Swallow the extended release tablet whole and do not crush or chew the tablet.''A Toprol XL tablet can be divided in half if your doctor has told you to do so. Swallow the half-tablet whole, without chewing or crushing.''You will need frequent medical tests, and your blood pressure will need to be checked often.''If you need surgery, tell the surgeon ahead of time that you are using metoprolol.''You should not stop using Toprol-XL suddenly. Stopping suddenly may make your condition worse.''If you have high blood pressure, keep using Toprol-XL even if you feel well. High blood pressure often has no symptoms. You may need to use metoprolol for the rest of your life.''Store at room temperature away from moisture and heat.''"
Toprol-XL dosing information,"''Usual Adult Dose for Hypertension:'Metoprolol succinate extended release tablets:''Initial dose: 25 to 100 mg orally once a day''''Maintenance dose: 100 to 400 mg orally once a day''''Comments:''-May increase dose at weekly, or longer, intervals.''-Doses above 400 mg per day have not been studied.'Usual Adult Dose for Angina Pectoris:''Initial dose:-Metoprolol succinate extended release tablets: 100 mg orally once a dayMaintenance dose: 100 to 400 mg per day.''Usual Adult Dose for Congestive Heart Failure:''Metoprolol succinate extended release tablets:25 mg orally once a day (12.5 mg orally once a day in patients with more severe heart failure); double dose every 2 weeks to highest tolerated dose or up to 200 mg orally once a day''Usual Pediatric Dose for Hypertension:''Metoprolol succinate extended release tablets:6 Years or Older:Initial dose: 1 mg/kg orally once a day (not to exceed 50 mg orally once a day)Maximum dose: 2 mg/kg (or 200 mg) orally once a day''''What happens if I miss a dose?''Skip the missed dose and use your next dose at the regular time. Do not use two doses at one time.''"
What happens if I overdose? Toprol-XL,"''Seek emergency medical attention or call the Poison Help line at 1-800-222-1222. Signs and symptoms of an overdose may include chest pain, difficulty breathing, dizziness or fainting, nausea, vomiting, or coma. Death can occur.''Avoid driving or hazardous activity until you know how metoprolol succinate will affect you. Your reactions could be impaired.''Drinking alcohol can increase certain side effects of Toprol-XL.''"
