Questions,Answer
What should I avoid? Terazosin,"''Terazosin may impair your thinking or reactions. Be careful if you drive or do anything that requires you to be alert.''To prevent dizziness, avoid standing for long periods of time or becoming overheated during exercise and in hot weather.''Avoid getting up too fast from a sitting or lying position, or you may feel dizzy. Get up slowly and steady yourself to prevent a fall. Drinking alcohol can increase certain side effects of terazosin.''"
Terazosin side effects,"''Get emergency medical help if you have any of these signs of an allergic reaction to terazosin: hives; difficulty breathing; swelling of your face, lips, tongue, or throat. Call your doctor at once if you have any of these serious side effects:''fast or pounding heartbeats or fluttering in your chest;feeling like you might pass out;swelling in your hands, ankles, or feet; orpenis erection that is painful or lasts 4 hours or longer.''Less serious terazosin side effects may include:''mild dizziness;weakness, drowsiness;blurred vision;nausea; orheadache.''This is not a complete list of side effects and others may occur. Call your doctor for medical advice about side effects. You may report side effects to FDA at 1-800-FDA-1088.''''"
Terazosin dosing information,"''Usual Adult Dose for Hypertension:''Initial dose: 1 mg orally once a day at bedtimeMaintenance dose: 1-5 mg orally once a day.Maximum dose: 20 mg per day.''Usual Adult Dose for Benign Prostatic Hyperplasia:''Initial dose: 1 mg orally once a day at bedtime.Maintenance dose: Increased in a stepwise fashion to 2 mg, 5 mg, or 10 mg once a day to achieve desired improvement of symptoms.''"
What is terbinafine? Terbinafine,''Terbinafine is an antifungal medication that fights infections caused by fungus.''Terbinafine tablets are used to treat infections caused by fungus that affect the fingernails or toenails.''Terbinafine oral granules are used to treat a fungal infection of scalp hair follicles in children who are at least 4 years old.''Terbinafine may also be used for purposes not listed in this medication guide.''''
Important Information Terbinafine,"''Some people taking terbinafine have developed severe liver damage leading to liver transplant or death.''Call your doctor at once if you have symptoms of liver damage, such as nausea, upper stomach pain, vomiting, loss of appetite, tiredness, dark urine, clay-colored stools, jaundice (yellowing of the skin or eyes). These events can occur whether or not you have ever had liver problems before.''''"
Before taking this medicine Terbinafine,"''You should not use terbinafine if you are allergic to it, or if you have:''liver disease.''To make sure terbinafine is safe for you, tell your doctor if you have ever had:''liver problems;weak immune system (caused by disease or by using certain medicine); orlupus.''It is not known whether  terbinafine will harm an unborn baby. You should wait until after your pregnancy to start treating your nail or scalp infection with terbinafine. Tell your doctor if you are pregnant or plan to become pregnant during treatment.''Terbinafine can pass into breast milk and may harm a nursing baby. You should not breast-feed while using this medicine.''''"
How should I take terbinafine? Terbinafine,"''Follow all directions on your prescription label. Do not take this medicine in larger or smaller amounts or for longer than recommended.''You may take the terbinafine tablet with or without food.''Terbinafine granules should be sprinkled into a spoonful of pudding or mashed potatoes (do not mix with applesauce, fruit juice, or other fruit-based or acidic foods). Swallow this mixture right away without chewing. Do not save the mixture for later use.''Terbinafine is usually taken for 6 weeks to treat scalp or fingernail infections, and for 12 weeks to treat a toenail infection.''Use this medicine for the full prescribed length of time. Your symptoms may improve before the infection is completely cleared. Skipping doses may also increase your risk of further infection that is resistant to antifungal medicine. Terbinafine will not treat a viral infection such as the flu or a common cold.''While using terbinafine, you may need frequent blood tests.''It may take several months for your nails to return to their normal appearance after your treatment with terbinafine.''Store at room temperature away from moisture, heat, and light. Keep the terbinafine oral granules in their sealed packet until you are ready to use.''''What happens if I miss a dose?''Take the missed dose as soon as you remember. Skip the missed dose if it is almost time for your next scheduled dose. Do not take extra medicine to make up the missed dose.''''"
What happens if I overdose? Terbinafine,"''Seek emergency medical attention or call the Poison Help line at 1-800-222-1222.''Overdose symptoms may include headache, dizziness, vomiting, stomach pain, rash, and increased urination.''''"
What should I avoid while taking terbinafine? Terbinafine,"''Avoid coffee, tea, cola, energy drinks or other sources of caffeine while taking  terbinafine.''Avoid exposure to sunlight or tanning beds. Terbinafine can make you sunburn more easily. Wear protective clothing and use sunscreen (SPF 30 or higher) when you are outdoors.''''"
Terbinafine side effects,"''Get emergency medical help if you have signs of an allergic reaction (hives, difficult breathing, swelling in your face or throat) or a severe skin reaction (fever, sore throat, burning in your eyes, skin pain, red or purple skin rash that spreads and causes blistering and peeling).''Seek medical treatment if you have a serious drug reaction that can affect many parts of your body. Symptoms may include: skin rash, fever, swollen glands, flu-like symptoms, muscle aches, severe weakness, unusual bruising, or yellowing of your skin or eyes. This reaction may occur several weeks after you began using terbinafine.''Some people taking terbinafine have developed severe liver damage leading to liver transplant or death. It is not clear whether terbinafine actually caused the liver damage in these patients. In most cases, the patient had a serious medical condition before taking terbinafine.''Call your doctor at once if you have symptoms of liver damage, such as nausea, upper stomach pain, vomiting, loss of appetite, tiredness, dark urine, clay-colored stools, or jaundice (yellowing of the skin or eyes). These events can occur whether or not you have ever had liver problems before.''Also call your doctor if you have:''changes in your sense of taste or smell;depressed mood, sleep problems, lack of interest in daily activity, feeling anxious or restless;pale skin, easy bruising, unusual bleeding (nose, mouth, vagina, or rectum), purple or red pinpoint spots under your skin;swelling, rapid weight gain, little or no urinating;blood in your urine or stools;weight loss due to taste changes or loss of appetite; orskin sores, butterfly-shaped skin rash on your cheeks and nose (worsens in sunlight).''Common side effects may include:''diarrhea, nausea, gas, stomach pain or upset;rash;headache;abnormal liver function tests.''This is not a complete list of side effects and others may occur. Call your doctor for medical advice about side effects. You may report side effects to FDA at 1-800-FDA-1088.''''"
What is  Tessalon Perles?,"''Tessalon Perles is used to relieve coughing.''Tessalon Perles is a non-narcotic cough medicine that numbs the throat and lungs, making the cough reflex less active.''Tessalon Perles may also be used for purposes not listed in this medication guide.''''"
Important Information Tessalon Perles,''Never suck or chew on a Tessalon Perles capsule. Swallow the pill whole. Sucking or chewing the capsule may cause serious side effects.''Tessalon Perles is not approved for use by anyone younger than 10 years old. An overdose of benzonatate can be fatal to a young child.''''
Before taking this medicine Tessalon Perles,"''You should not use  Tessalon Perles if you are allergic to Tessalon Perles or topical numbing medicines such as tetracaine or procaine (found in some insect bite and sunburn creams).''Tell your doctor if you are pregnant or breastfeeding.''Tessalon Perles is not approved for use by anyone younger than 10 years old. An overdose of benzonatate can be fatal, especially to a young child who has accidentally swallowed the medicine.''''"
How should I take  Tessalon Perles?,"''Follow all directions on your prescription label and read all medication guides or instruction sheets. Use the medicine exactly as directed.''Never suck or chew on a Tessalon Perles capsule. Swallow the pill whole. Sucking or chewing the capsule may cause serious side effects.''Store at room temperature away from moisture, heat, and light.''''What happens if I miss a dose?''Skip the missed dose and use your next dose at the regular time. Do not use two doses at one time.''''"
What happens if I overdose? Tessalon Perles,"''Seek emergency medical attention or call the Poison Help line at 1-800-222-1222. An overdose of  Tessalon Perles can be fatal, especially to a child. Accidental death has occurred in children under 10 years old.''Overdose symptoms may include tremors, feeling restless, seizure (convulsions), slow heart rate, weak pulse, fainting, and slow breathing (breathing may stop).''''"
What should I avoid while taking benzonatate? Tessalon Perles,''Avoid eating or drinking anything while you feel numbness or tingling in your mouth or throat.''''
 Tessalon Perles side effects,"''Stop taking  Tessalon Perles and get emergency medical help if you have signs of an allergic reaction: hives; difficult breathing; swelling of your face, lips, tongue, or throat.''Call your doctor at once if you have:''severe drowsiness or dizziness;confusion, hallucinations.ongoing numbness or tingling in your mouth, throat, or face;numbness in your chest;a choking feeling;chills; orburning in your eyes.''Some of these side effects may result from chewing or sucking on a Tessalon Perles capsule.''Common side effects may include:''headache, dizziness;nausea, upset stomach;constipation;itching, rash; orstuffy nose.''This is not a complete list of side effects and others may occur. Call your doctor for medical advice about side effects. You may report side effects to FDA at 1-800-FDA-1088.''''"
What other drugs will affect  Tessalon Perles?,"''Using Tessalon Perles with other drugs that make you drowsy can worsen this effect. Ask your doctor before using opioid medication, a sleeping pill, a muscle relaxer, or medicine for anxiety or seizures.''Other drugs may affect Tessalon Perles, including prescription and over-the-counter medicines, vitamins, and herbal products. Tell your doctor about all your current medicines and any medicine you start or stop using.''''"
What is testosterone? Testosterone Injection,"''Testosterone is a naturally occurring sex hormone that is produced in a man's testicles. Small amounts of testosterone are also produced in a woman's ovaries and adrenal system.''Testosterone injection is used in men and boys to treat conditions caused by a lack of this hormone, such as delayed puberty or growth. It is only recommended for males with a known medical condition, such as a genetic disorder, problem with certain brain structures (called the hypothalamus and pituitary) or previous chemotherapy.''Testosterone injection is also used in women to treat certain types of breast cancer that have spread to other parts of the body.''Testosterone should not be used to enhance athletic performance or to treat normal male aging.''Testosterone injection is also used ""off-label"" for the treatment of gender dysphoria. Injections are typically administered weekly by the user in a home setting.''"
Important information Testosterone Injection,"''Do not use this medicine if you are pregnant or may become pregnant.''You should not receive testosterone if you have prostate cancer, male breast cancer, a serious heart condition, or severe liver or kidney disease.''Misuse of testosterone can cause dangerous or irreversible effects. Testosterone injections should be given only by a healthcare professional. Testosterone can lead to serious problems with the heart, brain, liver, endocrine, and mental health systems. Stopping testosterone may also lead to unpleasant withdrawal symptoms.''Testosterone injections have also been linked to a condition called pulmonary oil microembolism (POME), or a blood clot in the lung that can be fatal. Seek medical help immediately for symptoms including chest pain, dizziness, trouble breathing, urge to cough, throat tightening and fainting.''"
Before taking this medicine Testosterone Injection,"''You should not receive testosterone if you are allergic to it, or if you have:''prostate cancer;male breast cancer;a serious heart condition;severe liver disease;severe kidney disease; orif you are pregnant or may become pregnant.''To make sure testosterone is safe for you, tell your doctor if you have:''heart disease or coronary artery disease;a history of heart attack, stroke, or blood clot;diabetes;enlarged prostate;high cholesterol or triglycerides (a type of fat in the blood);breast cancer (in men, or in women who have hypercalcemia);liver or kidney disease;high calcium levels;if you are bedridden or otherwise debilitated; orif you take a blood thinner (warfarin, Coumadin, Jantoven).''This medicine can harm an unborn baby. Do not use testosterone if you are pregnant or may become pregnant. Tell your doctor right away if you become pregnant during treatment. Use effective birth control while you are receiving this medicine.''It is not known whether testosterone passes into breast milk or if it could harm a nursing baby. You should not breastfeed while using this medicine.''How is testosterone injection given?''Testosterone is injected into a muscle. The injection is usually given every 2 to 4 weeks.''Testosterone injections should be given only by a healthcare professional. Misuse can lead to serious side effects or death.''The length of treatment will depend on the condition being treated.''Testosterone will not enhance athletic performance and should not be used for that purpose.''While receiving this medicine, you will need frequent blood tests.''Testosterone can affect bone growth in boys who are treated for delayed puberty. Bone development may need to be checked with x-rays every 6 months during treatment.''''What happens if I miss a dose?''Call your doctor for instructions if you miss an appointment for your testosterone injection.''"
What happens if I overdose? Testosterone Injection,"''Since this medication is given by a healthcare professional in a medical setting, an overdose is unlikely to occur.''"
What should I avoid while receiving testosterone injection? Testosterone Injection,"''Follow your doctor's instructions about any restrictions on food, beverages, or activity.''"
Testosterone side effects Testosterone Injection,"''Get emergency medical help if you have any signs of an allergic reaction to testosterone: hives; difficult breathing; swelling of your face, lips, tongue, or throat.''Get emergency medical help if you have any signs of a blood clot in the lung after using testosterone. These symptoms include chest pain, dizziness, trouble breathing, urge to cough, throat tightening and fainting.''Misuse of testosterone can cause dangerous or irreversible effects, such as enlarged breasts, small testicles, infertility, high blood pressure, heart attack, stroke, liver disease, bone growth problems, addiction, and mental effects such as aggression and violence.''Call your doctor at once if you have:''chest pain or pressure, pain spreading to your jaw or shoulder;swelling in your ankles or feet, rapid weight gain;chest pain, sudden cough, wheezing, rapid breathing, coughing up blood;pain, swelling, warmth, or redness in one or both legs;nausea or vomiting;changes in skin color;increased or ongoing erection of the penis;impotence, ejaculation problems, decreased amounts of semen, decrease in testicle size;painful or difficult urination;shortness of breath (even with mild exertion);stomach pain, constipation, increased thirst or urination, muscle pain or weakness, joint pain, confusion, and feeling tired or restless; orupper stomach pain, itching, loss of appetite, dark urine, clay-colored stools, jaundice (yellowing of the skin or eyes).''Women receiving testosterone may develop male characteristics, which could be irreversible if treatment is continued. Call your doctor at once if you notice any of these signs of excess testosterone:''acne;changes in menstrual periods;male-pattern hair growth (such as on the chin or chest);hoarse or deepened voice; orenlarged clitoris.''Common testosterone side effects (in men or women) may include:''breast swelling;headache, anxiety;increased facial or body hair growth, male-pattern baldness;increased or decreased interest in sex;numbness or tingly feeling; orpain or swelling where the medicine was injected.''This is not a complete list of side effects and others may occur. Call your doctor for medical advice about side effects. You may report side effects to FDA at 1-800-FDA-1088.''''"
What other drugs will affect testosterone? Testosterone Injection,"''Certain drugs may interact with testosterone, including;''Blood thinners (including warfarin, Coumadin, Jantoven)Anti-inflammatory drugs, such as oxyphenbutazone''Other prescription and over-the-counter medicines, vitamins, and herbal products may also react with testosterone. Tell each of your health care providers about all medicines you use now and any medicine you start or stop using.''''"
What is tetracycline? Tetracycline,"''Tetracycline is an antibiotic that fights infection caused by bacteria.''Tetracycline is used to treat many different bacterial infections of the skin, intestines, respiratory tract, urinary tract, genitals, lymph nodes, and other body systems. It is often used in treating severe acne, or sexually transmitted diseases such as syphilis, gonorrhea, or chlamydia.''Tetracycline is also used to treat infections you can get from direct contact with infected animals or contaminated food.''In some cases, tetracycline is used when penicillin or another antibiotic cannot be used to treat serious infections such as Anthrax, Listeria, Clostridium, Actinomyces, and others.''"
Important information Tetracycline,''Children younger than 8 years old should not take this medicine.''Using tetracycline during pregnancy could harm the unborn baby or cause permanent tooth discoloration later in the baby's life.''Throw away any unused tetracycline when it expires or when it is no longer needed. Do not take this medicine after the expiration date on the label has passed. Expired tetracycline can cause a dangerous syndrome resulting in damage to the kidneys.''Tetracycline passes into breast milk and may affect bone and tooth development in a nursing baby. Do not take this medication without telling your doctor if you are breast-feeding a baby.''Avoid exposure to sunlight or artificial UV rays (sunlamps or tanning beds). Tetracycline can make your skin more sensitive to sunlight and sunburn may result. Use a sunscreen (minimum SPF 15) and wear protective clothing if you must be out in the sun.''
Before taking this medicine Tetracycline,"''You should not use this medicine if you are allergic to tetracycline or similar medicines such as demeclocycline, doxycycline, minocycline, or tigecycline.''To make sure tetracycline is safe for you, tell your doctor if you have:''liver disease; orkidney disease.''If you are using tetracycline to treat gonorrhea, your doctor may test you to make sure you do not also have syphilis, another sexually transmitted disease.''Taking this medicine during pregnancy may affect tooth and bone development in the unborn baby. Taking tetracycline during the last half of pregnancy can cause permanent tooth discoloration later in the baby's life. Tell your doctor if you are pregnant or if you become pregnant while using this medicine.''Tetracycline can make birth control pills less effective. Ask your doctor about using a non-hormonal birth control (condom, diaphragm with spermicide) to prevent pregnancy.''Tetracycline can pass into breast milk and may affect bone and tooth development in a nursing infant. Do not breast-feed while you are taking tetracycline.''Children younger than 8 years old should not take tetracycline. Tetracycline can cause permanent tooth discoloration and can also affect a child's growth.''"
How should I take tetracycline? Tetracycline,"''Take tetracycline exactly as it was prescribed for you. Follow all directions on your prescription label. Do not take this medicine in larger or smaller amounts or for longer than recommended.''Take tetracycline on an empty stomach, at least 1 hour before or 2 hours after a meal.''Do not take this medicine with milk or other dairy products, unless your doctor has told you to. Dairy products can make it harder for your body to absorb the medicine.''Shake the oral suspension (liquid) well just before you measure a dose. Measure liquid medicine with the dosing syringe provided, or with a special dose-measuring spoon or medicine cup. If you do not have a dose-measuring device, ask your pharmacist for one.''If you need surgery, tell the surgeon ahead of time that you are using tetracycline.''If you use this medicine long-term, you may need frequent medical tests.''Use this medicine for the full prescribed length of time. Your symptoms may improve before the infection is completely cleared. Skipping doses may also increase your risk of further infection that is resistant to antibiotics. Tetracycline will not treat a viral infection such as the flu or a common cold.''Do not share this medicine with another person, even if they have the same symptoms you have.''Store this medication at room temperature away from moisture and heat.''Throw away any unused tetracycline after the expiration date on the label has passed. Taking expired tetracycline can cause damage to your kidneys.''''What happens if I miss a dose?''Take the missed dose as soon as you remember. Skip the missed dose if it is almost time for your next scheduled dose. Do not take extra medicine to make up the missed dose.''"
What happens if I overdose? Tetracycline,''Seek emergency medical attention or call the Poison Help line at 1-800-222-1222.''
What should I avoid while taking tetracycline? Tetracycline,"''For at least 2 hours before or 2 hours after taking tetracycline: avoid taking iron supplements, multivitamins, calcium supplements, antacids, or laxatives.''Antibiotic medicines can cause diarrhea, which may be a sign of a new infection. If you have diarrhea that is watery or bloody, call your doctor. Do not use anti-diarrhea medicine unless your doctor tells you to.''Avoid exposure to sunlight or tanning beds. Tetracycline can make you sunburn more easily. Wear protective clothing and use sunscreen (SPF 30 or higher) when you are outdoors.''"
Tetracycline side effects,"''Get emergency medical help if you have signs of an allergic reaction to tetracycline: hives; difficult breathing; swelling of your face, lips, tongue, or throat.''Call your doctor at once if you have:''severe blistering, peeling, and red skin rash;fever, chills, body aches, flu symptoms;pale or yellowed skin, easy bruising or bleeding;any signs of a new infection.''Common tetracycline side effects may include:''nausea, vomiting, diarrhea, upset stomach, loss of appetite;white patches or sores inside your mouth or on your lips;swollen tongue, black or ""hairy"" tongue, trouble swallowing;sores or swelling in your rectal or genital area; orvaginal itching or discharge.''This is not a complete list of side effects and others may occur. Call your doctor for medical advice about side effects. You may report side effects to FDA at 1-800-FDA-1088.''''"
What other drugs will affect tetracycline? Tetracycline,"''Tell your doctor about all your current medicines and any you start or stop using, especially:''any other antibiotic;isotretinoin (Accutane);tretinoin (Renova, Retin-A, Vesanoid);a blood thinner (warfarin, Coumadin, Jantoven);an antacid or laxative medicine; ora vitamin or mineral supplement that contains iron, zinc, calcium, or magnesium.''This list is not complete. Other drugs may interact with tetracycline, including prescription and over-the-counter medicines, vitamins, and herbal products. Not all possible interactions are listed in this medication guide.''''"
What is theophylline? Theophylline,"''Theophylline is a bronchodilator that is used to treat symptoms of asthma, bronchitis, emphysema, and other breathing problems.''Theophylline may also be used for purposes not listed in this medication guide.''''"
Important Information Theophylline,"''Never use theophylline in larger amounts, or for longer than prescribed. Seek medical attention if your breathing problems get worse quickly, or if you think your medications are not working as well.''Overdose can occur if you take too much theophylline at one time, or if your daily doses are too high.''Tell your doctor about all your current medicines and any you start or stop using. Many drugs can interact with theophylline.''''"
