Questions,Answer
Before taking this medicine Tresiba,"''You should not use Tresiba if you are allergic to it, or if you are having an episode of hypoglycemia (low blood sugar) or diabetic ketoacidosis (call your doctor for treatment).''Tresiba should not be given to a child younger than 1 year old.''Tell your doctor if you are pregnant or breastfeeding.''Follow your doctor's instructions about using insulin if you are pregnant or you become pregnant. Controlling diabetes is very important during pregnancy, and having high blood sugar may cause complications in both the mother and the baby.''''How should I use  Tresiba?''Follow all directions on your prescription label and read all medication guides or instruction sheets. Use the medicine exactly as directed.''Tresiba is injected under the skin, usually once daily at any time of day. A healthcare provider will teach you how to properly use the medication by yourself.''Tresiba must not be given with an insulin pump, or mixed with other insulins. Read and carefully follow any Instructions for Use provided with your medicine. Ask your doctor or pharmacist if you don't understand all instructions.''A dose counter on the injection pen shows your dose in units. Do not convert your dose. Use the U-100 vial for a child whose dose is less than 5 units per day.''Do not inject  Tresiba into skin that is damaged, tender, bruised, pitted, thickened, scaly, or has a scar or hard lump.''Never share an injection pen with another person, even if the needle has been changed. Sharing these devices can allow infections or disease to pass from one person to another.''You may have low blood sugar (hypoglycemia) and feel very hungry, dizzy, irritable, confused, anxious, or shaky. To quickly treat hypoglycemia, eat or drink a fast-acting source of sugar (fruit juice, hard candy, crackers, raisins, or non-diet soda). Be sure you know how to use a glucagon injection kit if your doctor prescribes one.''Also watch for signs of high blood sugar (hyperglycemia) such as increased thirst or urination.''Blood sugar levels can be affected by stress, illness, surgery, exercise, alcohol use, or skipping meals. Ask your doctor before changing your dose or medication schedule.''Tresiba is only part of a complete treatment program that may also include diet, exercise, weight control, regular blood sugar testing, and special medical care. Follow your doctor's instructions very closely.''Do not freeze insulin or store it near the cooling element in a refrigerator. Throw away any insulin that has been frozen. Keep vials in their original container protected from heat and light.''Storing unopened (not in use) Tresiba:''Refrigerate and use until expiration date; orStore at room temperature and use within 8 weeks (56 days).''Storing opened (in use) Tresiba:''Refrigerate or store at room temperature and use within 8 weeks. Do not store the injection pen with a needle attached.''Do not use the medicine if it looks cloudy or has changed colors. Call your pharmacist for new medicine.''Use a needle and syringe only once and then place them in a puncture-proof ""sharps"" container. Follow state or local laws about how to dispose of this container. Keep it out of the reach of children and pets.''''What happens if I miss a dose?''Use the missed dose as soon as you remember. Then continue your regular dosing schedule, allowing at least 8 hours to pass between doses. Do not use two doses at one time.''Call your doctor for instructions if a child misses a dose.''Keep insulin on hand at all times. Get your prescription refilled before you run out of medicine completely.''''"
What happens if I overdose? Tresiba,"''Seek emergency medical attention or call the Poison Help line at 1-800-222-1222. Insulin overdose can cause life-threatening hypoglycemia. Symptoms include drowsiness, confusion, blurred vision, numbness or tingling in your mouth, trouble speaking, muscle weakness, clumsy or jerky movements, seizure (convulsions), or loss of consciousness.''''"
What should I avoid while using  Tresiba?,''Avoid driving or operating machinery until you know how  Tresiba will affect you.''Avoid medication errors by always checking the medicine label before injecting your insulin.''Avoid drinking alcohol. It can cause low blood sugar and may interfere with your diabetes treatment.''''
 Tresiba side effects,"''Get emergency medical help if you have signs of an allergic reaction: hives, itching, skin rash; wheezing, tiredness, trouble breathing; feeling like you might pass out; nausea, diarrhea; swelling of your face, lips, tongue, or throat.''Call your doctor at once if you have:''fluid retention--weight gain, swelling in your hands or feet, feeling short of breath; orlow potassium--leg cramps, constipation, irregular heartbeats, fluttering in your chest, increased thirst or urination, numbness or tingling, muscle weakness or limp feeling.''Common side effects may include:''low blood sugar;swelling, weight gain;itching, rash; orthickening or hollowing of the skin where you injected the medicine.''This is not a complete list of side effects and others may occur. Call your doctor for medical advice about side effects. You may report side effects to FDA at 1-800-FDA-1088.''''"
What other drugs will affect  Tresiba?,"''Tell your doctor if you also take pioglitazone or rosiglitazone (sometimes contained in combinations with glimepiride or metformin). Taking certain oral diabetes medicines while you are using insulin may increase your risk of serious heart problems.''Tresiba may not work as well when you use other medicines at the same time. This includes prescription and over-the-counter medicines, vitamins, and herbal products. Not all possible interactions are listed here. Tell your doctor about all medicines you start or stop using.''''"
What is tretinoin? Tretinoin,"''Tretinoin is used to cause remission of acute promyelocytic leukemia (APL), a type of blood cancer. Tretinoin is used only for remission of APL and not for continued (maintenance) treatment.''Tretinoin may also be used for other purposes not listed in this medication guide.''''"
Important Information Tretinoin,"''Tretinoin can cause severe birth defects, miscarriage, or premature birth. Tell your doctor if you are pregnant or plan to become pregnant. You will need frequent pregnancy testing before and during treatment with tretinoin.''Some people taking tretinoin develop a life-threatening condition called retinoic acid-APL syndrome. Tell your doctor right away if you have early symptoms of this syndrome: fever, shortness of breath, feeling light-headed, and/or weight gain.''You must remain under the care of a doctor while taking tretinoin.''''"
Before taking this medicine Tretinoin,"''Tretinoin taken in any amount (even for a short time) can cause severe birth defects, miscarriage, or premature birth. Tell your doctor if you are pregnant or plan to become pregnant. You will need frequent pregnancy testing before and during treatment with tretinoin.''Use 2 effective forms of birth control beginning 1 month before you start taking tretinoin and continuing for at least 1 month after your last dose.''You must use birth control unless you've had a hysterectomy and no longer have a uterus. Use birth control even if you think you cannot become pregnant or have gone through menopause. Tell your doctor right away if you miss a period or think you might be pregnant.''Ask your doctor about the best birth control methods to use. Tretinoin can make certain birth control pills less effective.''You should not use tretinoin if you are allergic to it or to other retinoids (such as Accutane, Retin-A, Renova).''Tell your doctor if you have ever had:''high cholesterol or triglycerides;liver disease; ora blood clot or stroke.''Do not breastfeed while taking tretinoin.''''How should I use tretinoin?''Follow all directions on your prescription label and read all medication guides or instruction sheets. Use the medicine exactly as directed.''You will need frequent medical tests.''Tretinoin is usually given until you have been in remission for 30 days, or after a total of 90 days (whichever comes first). Follow your doctor's dosing instructions very carefully.''Store at room temperature away from moisture, heat, and light.''''What happens if I miss a dose?''Take the medicine as soon as you can, but skip the missed dose if it is almost time for your next dose. Do not take two doses at one time.''''"
What happens if I overdose? Tretinoin,"''Seek emergency medical attention or call the Poison Help line at 1-800-222-1222.''Overdose symptoms may include headache, dizziness, weakness, warmth or tingling in your face, stomach pain, and dry or cracked lips.''''"
What should I avoid while using tretinoin? Tretinoin,''Do not use vitamin A supplements or multivitamins that contain vitamin A while you are taking tretinoin.''Avoid driving or hazardous activity until you know how  tretinoin will affect you. Your reactions could be impaired.''''
Tretinoin side effects,"''Get emergency medical help if you have signs of an allergic reaction: hives; difficulty breathing; swelling of your face, lips, tongue, or throat.''Some people taking tretinoin develop a life-threatening condition called retinoic acid-APL (RA-APL) syndrome. This syndrome can progress and cause failure of many organs in your body, such as the lungs, liver, or kidneys. Tell your doctor right away if you have early symptoms of RA-APL syndrome: fever, shortness of breath, feeling light-headed, and/or weight gain. RA-APL is treatable, but you may need to stop taking tretinoin for a short time. Follow your doctor's instructions carefully.''Call your doctor at once if you have:''a light-headed feeling, like you might pass out;mouth and throat ulcers, red or swollen gums, burning mouth pain, trouble swallowing;increased pressure inside the skull--severe headaches, ringing in your ears, nausea, vision problems, pain behind your eyes;kidney problems--little or no urination, swelling in your feet or ankles, feeling tired or short of breath;liver problems--upper stomach pain, loss of appetite, dark urine, jaundice (yellowing of the skin or eyes);lung problems--pain when you breathe, rapid heart rate, feeling short of breath (especially when lying down);signs of a blood clot--sudden numbness or weakness on one side of the body, chest pain, problems with vision or speech, pain or swelling in one leg;signs of infection--fever, chills, flu symptoms, easy bruising or bleeding, new or worsening cough, stabbing chest pain, wheezing, rapid and shallow breathing; orsigns of stomach bleeding--bloody or tarry stools, coughing up blood or vomit that looks like coffee grounds.''Common side effects may include:''headache, weakness, tiredness;fever, chills, infections, not feeling well;bleeding;swelling in your hands or feet;abnormal liver function tests;flushing (sudden warmth, redness, or tingly feeling);dry mouth, nose, or throat;stomach pain, nausea, vomiting, diarrhea;bone pain;rash; ormouth sores.''This is not a complete list of side effects and others may occur. Call your doctor for medical advice about side effects. You may report side effects to FDA at 1-800-FDA-1088.''''"
What other drugs will affect tretinoin? Tretinoin,"''Sometimes it is not safe to use certain medications at the same time. Some drugs can affect your blood levels of other drugs you take, which may increase side effects or make the medications less effective.''Tell your doctor about all your other medicines, especially:''aminocaproic acid;aprotinin;tranexamic acid; oran antibiotic--doxycycline, demeclocycline, minocycline, tetracycline.''This list is not complete. Other drugs may affect tretinoin, including prescription and over-the-counter medicines, vitamins, and herbal products. Not all possible drug interactions are listed here.''''"
What is triamcinolone? Triamcinolone,"''Triamcinolone belongs to a class of drugs called corticosteroids. It prevents the release of substances in the body that cause inflammation.''Triamcinolone oral (taken by mouth) is used to treat many different conditions such as allergic disorders, skin conditions, ulcerative colitis, arthritis, lupus, psoriasis, or breathing disorders.''Triamcinolone may also be used for purposes not listed in this medication guide.''"
Important information Triamcinolone,"''You should not use this medication if you are allergic to triamcinolone, or if you have a fungal infection anywhere in your body.''Before taking triamcinolone, tell your doctor about all of your medical conditions, and about all other medicines you are using. There are many other disease that can be affected by steroid use, and many other medicines that can interact with steroids.''Your steroid medication needs may change if you have any unusual stress such as a serious illness, fever or infection, or if you have surgery or a medical emergency. Tell your doctor about any such situation that affects you during treatment.''Steroid medications such as triamcinolone can weaken your immune system, making it easier for you to get an infection or worsening an infection you already have or have recently had. Tell your doctor about any illness or infection you have had within the past several weeks.''Avoid being near people who are sick or have infections. Call your doctor for preventive treatment if you are exposed to chicken pox or measles. These conditions can be serious or even fatal in people who are using steroid medication.''Do not receive a ""live"" vaccine while you are taking triamcinolone. Vaccines may not work as well while you are taking a steroid.''Do not stop using triamcinolone suddenly, or you could have unpleasant withdrawal symptoms. Talk to your doctor about how to avoid withdrawal symptoms when stopping the medication. Wear a medical alert tag or carry an ID card stating that you take triamcinolone. Any medical care provider who treats you should know that you take steroid medication.''"
Before taking this medicine Triamcinolone,"''You should not use this medication if you are allergic to triamcinolone, or if you have a fungal infection anywhere in your body.''Steroid medication can weaken your immune system, making it easier for you to get an infection. Steroids can also worsen an infection you already have, or reactivate an infection you recently had. Before taking this medication, tell your doctor about any illness or infection you have had within the past several weeks.''To make sure you can safely take triamcinolone, tell your doctor if you have any of these other conditions:''liver disease (such as cirrhosis);kidney disease;a thyroid disorder;diabetes;a history of malaria;tuberculosis;osteoporosis;a muscle disorder such as myasthenia gravis;glaucoma or cataracts;herpes infection of the eyes;stomach ulcers, ulcerative colitis, or diverticulitis;depression or mental illness;congestive heart failure; orhigh blood pressure''FDA pregnancy category C. It is not known whether triamcinolone will harm an unborn baby. Tell your doctor if you are pregnant or plan to become pregnant while using this medication. Triamcinolone can pass into breast milk and may harm a nursing baby. Do not use this medication without telling your doctor if you are breast-feeding a baby. Triamcinolone can affect growth in children. Talk with your doctor if you think your child is not growing at a normal rate while using triamcinolone.''"
How should I take triamcinolone? Triamcinolone,"''Take triamcinolone exactly as prescribed by your doctor. Do not take in larger or smaller amounts or for longer than recommended. Follow the directions on your prescription label.''Your doctor may occasionally change your dose to make sure you get the best results from this medication.''Take triamcinolone with food to prevent stomach upset.''Your steroid medication needs may change if you have unusual stress such as a serious illness, fever or infection, or if you have surgery or a medical emergency. Tell your doctor about any such situation that affects you.''This medication can cause you to have unusual results with certain medical tests. Tell any doctor who treats you that you are using triamcinolone.''Do not stop using triamcinolone suddenly, or you could have unpleasant withdrawal symptoms. Talk to your doctor about how to avoid withdrawal symptoms when stopping the medication. Carry an ID card or wear a medical alert bracelet stating that you are taking a steroid, in case of emergency. Any doctor, dentist, or emergency medical care provider who treats you should know that you are taking steroid medication.''Store triamcinolone at room temperature away from moisture and heat.''''What happens if I miss a dose?''Take the missed dose as soon as you remember. Skip the missed dose if it is almost time for your next scheduled dose. Do not take extra medicine to make up the missed dose.''"
What happens if I overdose? Triamcinolone,"''Seek emergency medical attention or call the Poison Help line at 1-800-222-1222.''An overdose of triamcinolone is not expected to produce life threatening symptoms. However, long term use of high steroid doses can lead to symptoms such as thinning skin, easy bruising, changes in the shape or location of body fat (especially in your face, neck, back, and waist), increased acne or facial hair, menstrual problems, impotence, or loss of interest in sex.''"
What should I avoid? Triamcinolone,"''Avoid being near people who are sick or have infections. Call your doctor for preventive treatment if you are exposed to chicken pox or measles. These conditions can be serious or even fatal in people who are using triamcinolone.''Do not receive a ""live"" vaccine while using triamcinolone. The vaccine may not work as well during this time, and may not fully protect you from disease. Avoid drinking alcohol while you are taking triamcinolone.''"
Triamcinolone side effects,"''Get emergency medical help if you have any of these signs of an allergic reaction to triamcinolone: hives; difficulty breathing; swelling of your face, lips, tongue, or throat.''Call your doctor at once if you have a serious side effect such as:''problems with your vision;swelling, rapid weight gain, feeling short of breath;severe depression, unusual thoughts or behavior, seizure (convulsions);bloody or tarry stools, coughing up blood;pancreatitis (severe pain in your upper stomach spreading to your back, nausea and vomiting, fast heart rate);low potassium (confusion, uneven heart rate, extreme thirst, increased urination, leg discomfort, muscle weakness or limp feeling); ordangerously high blood pressure (severe headache, blurred vision, buzzing in your ears, anxiety, confusion, chest pain, shortness of breath, uneven heartbeats, seizure).''Less serious triamcinolone side effects may include:''sleep problems (insomnia), mood changes;acne, dry skin, thinning skin, bruising or discoloration;slow wound healing;increased sweating;headache, dizziness, spinning sensation;nausea, stomach pain, bloating;muscle weakness; orchanges in the shape or location of body fat (especially in your arms, legs, face, neck, breasts, and waist);''This is not a complete list of side effects and others may occur. Call your doctor for medical advice about side effects. You may report side effects to FDA at 1-800-FDA-1088.''''"
What other drugs will affect triamcinolone? Triamcinolone,"''Many drugs can interact with triamcinolone. Below is just a partial list. Tell your doctor if you are using:''aspirin (taken on a daily basis or at high doses);a diuretic (water pill);a blood thinner such as warfarin (Coumadin, Jantoven);cyclosporine (Gengraf, Neoral, Sandimmune);insulin or diabetes medications you take by mouth;ketoconazole (Nizoral);rifampin (Rifadin, Rifater, Rifamate, Rimactane); orseizure medications such as phenytoin (Dilantin) or phenobarbital (Luminal, Solfoton).''This list is not complete and other drugs may interact with triamcinolone. Tell your doctor about all medications you use. This includes prescription, over-the-counter, vitamin, and herbal products. Do not start a new medication without telling your doctor.''''"
What is triamterene? Triamterene,"''Triamterene is a potassium-sparing diuretic (water pill) that prevents your body from absorbing too much salt and keeps your potassium levels from getting too low.''Triamterene is used to treat fluid retention (edema) in people with congestive heart failure, cirrhosis of the liver, or a kidney condition called nephrotic syndrome.''Triamterene is also used to treat edema caused by using steroid medicine or having too much aldosterone in your body. Aldosterone is a hormone produced by the adrenal glands to help regulate the salt and water balance in your body.''"
Important Information Triamterene,"''You should not use triamterene if you have severe kidney or liver disease, urination problems, or high levels of potassium in your blood. You should not take triamterene if you also take potassium supplements, or other diuretics such as amiloride or spironolactone.''Call your doctor right away if you have signs of hyperkalemia (high potassium), such as nausea, irregular heartbeats, weakness, or loss of movement. High potassium may be more likely in older adults, or in people with kidney disease, diabetes, or severe illness.''You should not take triamterene if you also take potassium supplements, or other diuretics such as amiloride or spironolactone.''Call your doctor right away if you have signs of hyperkalemia (high potassium), such as nausea, slow or unusual heart rate, weakness, or loss of movement. You may be more likely to have high potassium if you have kidney disease, diabetes, a severe illness, or if you an older adult.''Avoid drinking alcohol, which can increase some of the side effects of triamterene.''Avoid a diet high in salt. Too much salt will cause your body to retain water and can make this medication less effective.''Do not use salt substitutes or low-sodium milk products that contain potassium. These products could cause your potassium levels to get too high while you are taking triamterene.''Avoid becoming overheated or dehydrated during exercise and in hot weather. Follow your doctor's instructions about the type and amount of liquids you should drink. In some cases, drinking too much liquid can be as unsafe as not drinking enough.''Triamterene can cause side effects that may impair your thinking or reactions. Be careful if you drive or do anything that requires you to be awake and alert.''"
Before taking this medicine Triamterene,"''You should not use triamterene if you are allergic to it, or if you have:''severe kidney disease, or if you are unable to urinate;severe liver disease;high potassium levels (hyperkalemia); orif you take potassium supplements, or another potassium-sparing diuretic such as amiloride, eplerenone, or spironolactone.''To make sure triamterene is safe for you, tell your doctor if you have ever had:''diabetes;heart disease;kidney disease;liver disease;gout; orkidney stones.''Using triamterene may increase your risk of developing hyperkalemia (high levels of potassium in your blood). High potassium may be more likely in older adults, or in people with kidney disease, diabetes, or severe illness.''Tell your doctor if you are pregnant or if you become pregnant. Triamterene may harm an unborn baby. However, the benefit of treating edema during pregnancy may outweigh the risk to the baby.''You should not breastfeed while using this medicine.''Triamterene is not approved for use by anyone younger than 18 years old.''"
How should I take triamterene? Triamterene,"''Take triamterene exactly as prescribed by your doctor. Follow all directions on your prescription label and read all medication guides or instruction sheets. Your doctor may occasionally change your dose.''Take triamterene after eating a meal to avoid stomach upset.''Taking a diuretic can make you urinate more often, which could disrupt your sleep. If you take triamterene only once per day, take it in the morning to reduce the chance of night-time urination.''You may need frequent medical tests. Your heart function may need to be checked using an electrocardiograph or ECG (sometimes called an EKG).''This medicine can affect the results of certain medical tests. Tell any doctor who treats you that you are using triamterene.''If you need surgery, tell the surgeon ahead of time that you are using this mediciner.''Store at room temperature away from moisture, heat, and light. Keep the bottle tightly closed when not in use.''"
