Questions,Answer
What is tadalafil? Tadalafil,"''Tadalafil relaxes muscles of the blood vessels and increases blood flow to particular areas of the body.''Tadalafil under the name of Cialis is used to treat erectile dysfunction (impotence) and symptoms of benign prostatic hypertrophy (enlarged prostate). Another brand of tadalafil is Adcirca, which is used to treat pulmonary arterial hypertension and improve exercise capacity in men and women.''"
Important information Tadalafil,"''Do not take tadalafil if you are also using a nitrate drug for chest pain or heart problems, including nitroglycerin, isosorbide dinitrate, isosorbide mononitrate, and some recreational drugs such as ""poppers"". Taking tadalafil with a nitrate medicine can cause a sudden and serious decrease in blood pressure.''Some medicines can cause unwanted or dangerous effects when used with tadalafil. Tell your doctor about all your current medicines, especially riociguat (Adempas).''Contact your doctor or seek emergency medical attention if your erection is painful or lasts longer than 4 hours. A prolonged erection (priapism) can damage the penis.''Get medical help at once if you have nausea, chest pain, or dizziness during sex.''Stop using tadalafil and get emergency medical help if you have sudden vision loss.''"
Before taking this medicine Tadalafil,"''You should not take tadalafil if you are allergic to it.''Taking tadalafil with certain other medicines can cause a sudden and serious decrease in blood pressure. Do not take this medicine if you also use:''riociguat (to treat pulmonary arterial hypertension); ora nitrate drug (for chest pain or heart problems) such as nitroglycerin, isosorbide dinitrate, isosorbide mononitrate, or recreational drugs such as amyl nitrate or nitrite ""poppers"".''Some tadalafil can remain in your bloodstream for 2 or more days after each dose you take (longer if you have liver or kidney disease). Avoid nitrate use during this time.''To make sure this medicine is safe for you, tell your doctor if you have ever had:''heart disease or heart rhythm problems;a heart attack or stroke;angina (chest pain), high or low blood pressure;pulmonary hypertension (unless you are taking tadalafil for this);a condition called pulmonary veno-occlusive disease (narrowing of the veins that carry blood from the lungs to the heart);liver or kidney disease (or if you are on dialysis);vision loss, or retinitis pigmentosa (an inherited condition of the eye);a bleeding disorder;a blood cell disorder such as sickle cell anemia, multiple myeloma, or leukemia;a physical deformity of the penis (such as Peyronie's disease), or an erection lasting longer than 4 hours;a stomach ulcer; orhealth problems that make sexual activity unsafe.''Sudden vision loss has occurred in a small number of people taking medicines like tadalafil (Viagra or others). Most of these people already had certain eye problems or risk factors for blood vessel disorders (heart disease, diabetes, high blood pressure, high cholesterol, coronary artery disease, smoking, or being over 50 years old). It is not clear whether the medicine was the actual cause of vision loss. Sudden hearing loss has also been reported with tadalafil. Stop tadalafil and call your doctor immediately for any hearing loss, decrease in hearing, or ringing in the ears.''Tadalafil is not expected to harm an unborn baby. Tell your doctor if you are pregnant or plan to become pregnant.''It is not known whether tadalafil passes into breast milk or if it could affect the nursing baby. Tell your doctor if you are breast-feeding.''Tadalafil is not approved for use by anyone younger than 18 years old.''"
How should I take tadalafil? Tadalafil,"''Tadalafil is usually taken only once per day. Follow all directions on your prescription label. Do not take this medicine in larger or smaller amounts or for longer than recommended.''Tadalafil can be taken with or without food.''Do not break or split a Cialis tablet. Swallow it whole.''For erectile dysfunction, take Cialis just before sexual activity but not more than once per day. It can be used up to 36 hours before sexual activity. Cialis can help achieve an erection when sexual stimulation occurs. An erection will not occur just by taking a pill. Follow your doctor's instructions.''Do not take Cialis for erectile dysfunction if you are taking Adcirca for pulmonary arterial hypertension.''Store at room temperature away from moisture and heat.''''What happens if I miss a dose?''If tadalafil is used as needed, you are not likely to be on a dosing schedule.''If you take tadalafil every day and you miss a dose, take the missed dose as soon as you remember. Skip the missed dose if it is almost time for your next scheduled dose. Do not take extra medicine to make up the missed dose.''"
What happens if I overdose? Tadalafil,''Seek emergency medical attention or call the Poison Help line at 1-800-222-1222.''
What should I avoid while taking tadalafil? Tadalafil,"''Drinking alcohol with this medicine can cause a drop in blood pressure, leading to dizziness or fainting.''Grapefruit and grapefruit juice may interact with tadalafil and lead to unwanted side effects. Avoid the use of grapefruit products while taking this medicine.''"
Tadalafil side effects,"''Get emergency medical help if you have signs of an allergic reaction to tadalafil: hives; difficulty breathing; swelling of your face, lips, tongue, or throat.''Stop and get medical help at once if you have nausea, chest pain, or dizziness during sex. You could be having a life-threatening side effect.''Stop using tadalafil and call your doctor at once if you have:''a light-headed feeling, like you might pass out;an erection is painful or lasts longer than 4 hours (prolonged erection can damage the penis);vision changes or sudden vision loss;ringing in your ears or sudden hearing loss; orheart attack symptoms - chest pain or pressure, pain spreading to your jaw or shoulder, nausea, sweating.''Common tadalafil side effects may include:''headache;flushing (warmth, redness, or tingly feeling);nausea, upset stomach;stuffy nose; ormuscle pain, back pain, pain in your arms or legs.''This is not a complete list of side effects and others may occur. Call your doctor for medical advice about side effects. You may report side effects to FDA at 1-800-FDA-1088.''''"
What other drugs will affect tadalafil? Tadalafil,"''Tell your doctor about all your current medicines and any you start or stop using, especially:''medicines to treat erectile dysfunction or pulmonary arterial hypertension;an antibiotic or antifungal medicine;antiviral medicine to treat hepatitis C or HIV/AIDS;drugs to treat high blood pressure or a prostate disorder; orseizure medicine.''This list is not complete. Other drugs may interact with tadalafil, including prescription and over-the-counter medicines, vitamins, and herbal products. Not all possible interactions are listed in this medication guide.''''"
What is Tamiflu?,''Tamiflu (oseltamivir) is an antiviral medication that blocks the actions of influenza virus types A and B in your body.''Tamiflu is used to treat flu symptoms caused by influenza virus in people have had symptoms for less than 2 days. This medicine may also be given to prevent influenza in people who may be exposed but do not yet have symptoms. Tamiflu will not treat the common cold.''Tamiflu should not be used in place of getting a yearly flu shot. The Centers for Disease Control recommends an annual flu shot to help protect you each year from new strains of influenza virus.''
Important Information Tamiflu,"''Tamiflu is used to treat flu symptoms caused by influenza virus in patients who have had symptoms for less than 2 days. It may also be given to prevent influenza in people who may be exposed but do not yet have symptoms. This medicine will not treat the common cold.''Before taking Tamiflu, tell your doctor if you have received a nasal flu vaccine within the past 2 weeks, or if you have kidney disease, heart disease, lung disease, or any other serious disease or health problem. Also tell your doctor if you have any condition causing swelling or disorder of the brain.''Take Tamiflu for as many days as it has been prescribed for you even if you begin to feel better. Your symptoms may start to improve before the infection is completely treated.''Some people using oseltamivir have had rare side effects of sudden confusion, delirium, hallucinations, unusual behavior, or self-injury. These symptoms have occurred most often in children. It is not known whether this medicine was the exact cause of these symptoms. However, anyone using this medicine should be watched closely for signs of confusion or unusual behavior. Call a doctor at once if you or the child using this medicine has any of these symptoms.''"
Before taking this medicine Tamiflu,"''You should not use Tamiflu if you are allergic to oseltamivir.''Do not use Tamiflu to treat flu symptoms in a child younger than 2 weeks old. Children as young as 1 year old may use this medicine to prevent flu symptoms.''Tell your doctor if you have ever had:''kidney disease (or if you are on dialysis);heart disease or chronic lung disease;a condition causing swelling or disorder of the brain;a weak immune system (caused by disease or by using certain medicine);hereditary fructose intolerance; orif you have used a nasal flu vaccine (FluMist) within the past 2 weeks.''It is not known whether this medicine will harm an unborn baby. However, getting sick with influenza during pregnancy can cause complications leading to birth defects, low birth weight, preterm delivery, or stillbirth. Your doctor will decide whether you should receive oseltamivir if you are pregnant.''The Centers for Disease Control and Prevention (CDC) recommends that pregnant women may receive a yearly flu vaccine to prevent influenza. Oseltamivir is not to be used in place of the yearly flu shot.''It is not known whether Tamiflu passes into breast milk or if it could harm a nursing baby. Tell your doctor if you are breast-feeding a baby.''"
How should I take Tamiflu?,"''Take Tamiflu exactly as prescribed by your doctor. Follow all directions on your prescription label and read all medication guides or instruction sheets. Use the medicine exactly as directed.''Start taking Tamiflu as soon as possible after flu symptoms appear, such as fever, chills, muscle aches, sore throat, and runny or stuffy nose.''Take the capsule with a full glass of water.''Shake the oral suspension (liquid) before you measure a dose. Use the dosing syringe provided, or use a medicine dose-measuring device (not a kitchen spoon).''Tamiflu may be taken with food if it upsets your stomach.''To treat flu symptoms: Take Tamiflu every 12 hours for 5 days.''To prevent flu symptoms: Take Tamiflu every 24 hours for 10 days or as prescribed. Follow your doctor's instructions.''Read and carefully follow any Instructions for Use provided with your medicine. Ask your doctor or pharmacist if you do not understand these instructions.''Use this medicine for the full prescribed length of time, even if your symptoms quickly improve. Tell your doctor if your symptoms do not improve, or if they get worse.''Store capsules at room temperature away from moisture and heat.''Store liquid medicine in the refrigerator but do not freeze. Throw away any unused liquid after 17 days.''The liquid may also be stored at cool room temperature for up to 10 days''''What happens if I miss a dose?''Use the medicine as soon as you can, but skip the missed dose if your next dose is due in less than 2 hours. Do not use two doses at one time.''"
What happens if I overdose? Tamiflu,''Seek emergency medical attention or call the Poison Help line at 1-800-222-1222.''
What should I avoid while taking Tamiflu?,"''Do not use a nasal flu vaccine (FluMist) within 48 hours after taking Tamiflu. Oseltamivir may interfere with the drug action of FluMist, making the vaccine less effective. Follow your doctor's instructions.''"
Tamiflu side effects,"''Get emergency medical help if you have signs of an allergic reaction to Tamiflu (hives, difficult breathing, swelling in your face or throat) or a severe skin reaction (fever, sore throat, burning eyes, skin pain, red or purple skin rash with blistering and peeling).''Some people using Tamiflu (especially children) have had sudden unusual changes in mood or behavior. It is not certain that oseltamivir is the exact cause of these symptoms. Even without using oseltamivir, anyone with influenza can have neurologic or behavioral symptoms. Call your doctor right away if the person using this medicine has:''sudden confusion;tremors or shaking;unusual behavior; orhallucinations (hearing or seeing things that are not there).''Common Tamiflu side effects may include:''nausea, vomiting;headache; orpain.''This is not a complete list of side effects and others may occur. Call your doctor for medical advice about side effects. You may report side effects to FDA at 1-800-FDA-1088.''''"
What other drugs will affect Tamiflu?,"''Other drugs may interact with oseltamivir, including prescription and over-the-counter medicines, vitamins, and herbal products. Tell your doctor about all your current medicines and any medicine you start or stop using.''''"
What is tamoxifen? Tamoxifen,"''Tamoxifen blocks the actions of estrogen, a female hormone. Certain types of breast cancer require estrogen to grow.''Tamoxifen is used to treat some types of breast cancer in men and women. It is also used to lower a woman's chance of developing breast cancer if she has a high risk (such as a family history of breast cancer).''Tamoxifen may also be used for purposes not listed in this medication guide.''"
Important information Tamoxifen,"''Do not use tamoxifen if you are pregnant. It could harm the unborn baby. Use a barrier form of birth control (such as a condom or diaphragm with spermicide) while you are using this medication and for at least 2 months after your treatment ends. You should not use tamoxifen if you are allergic to it, if you have a history of blood clots in your veins or your lungs, or if you are taking a blood thinner such as warfarin (Coumadin).''Before using this medicine, tell your doctor if you have liver disease, high triglycerides (a type of fat in the blood), a history of cataract, or a history of stroke or blood clot. Also tell your doctor if you if you are receiving chemotherapy or radiation treatment.''If you are taking tamoxifen to reduce your risk of breast cancer, you may need to take your first dose while you are having a menstrual period. You may also need to have a pregnancy test before you start taking this medicine, to make sure you are not pregnant. Follow your doctor's instructions.''Taking tamoxifen may increase your risk of uterine cancer, stroke, or a blood clot in the lung, which can be fatal. Talk with your doctor about your specific risks in taking this medication.''To make sure this medication is not causing harmful effects, your doctor may want you to have mammograms and to perform routine breast self-exams on a regular basis. Your liver function may also need to be tested. Visit your doctor regularly.''"
Before taking this medicine Tamoxifen,"''You should not use tamoxifen if you are allergic to it.''You should not use tamoxifen to reduce your risk of breast cancer if you are also taking a blood thinner such as warfarin (Coumadin, Jantoven).''Do not take tamoxifen if you are pregnant. It could harm the unborn baby. Avoid becoming pregnant while you are using this medicine, and for at least 2 months after your treatment ends.''Hormonal contraception (such as birth control pills, injections, implants, skin patches, and vaginal rings) may not be effective enough to prevent pregnancy while taking tamoxifen. Use barrier or non-hormonal birth control (examples: condom, diaphragm with spermicide, or intrauterine device/IUD).''If you are taking tamoxifen to reduce your risk of breast cancer, you may need to take your first dose while you are having a menstrual period. You may also need to have a pregnancy test before you start taking tamoxifen, to make sure you are not pregnant. Follow your doctor's instructions.''Taking tamoxifen may increase your risk of uterine cancer, stroke, or a blood clot in the lung, which can be fatal. Talk with your doctor about your specific risks in taking this medicine.''To make sure tamoxifen is safe for you, tell your doctor if you have:''a history of stroke or blood clot;liver disease;high cholesterol or triglycerides (a type of fat in the blood);a history of cataracts; orif you are receiving chemotherapy or radiation.''It is not known whether tamoxifen passes into breast milk or if it could harm a nursing baby. This medicine has been shown to slow breast milk production. Do not breast-feed while taking tamoxifen.''"
How should I take tamoxifen? Tamoxifen,"''Follow all directions on your prescription label. Do not take this medicine in larger or smaller amounts or for longer than recommended.''Measure liquid medicine with the dosing syringe provided, or with a special dose-measuring spoon or medicine cup. If you do not have a dose-measuring device, ask your pharmacist for one.''Tamoxifen can be taken with or without food.''While using tamoxifen, you may need frequent blood tests.''If you need surgery or medical tests or if you will be on bed rest, you may need to stop using this medicine for a short time. Any doctor or surgeon who treats you should know that you are taking tamoxifen.''Have regular physical exams and mammograms, and self-examine your breasts for lumps on a monthly basis while using this medicine.''Use tamoxifen regularly to get the most benefit. Get your prescription refilled before you run out of medicine completely. You may need to keep using this medication for up to 5 years.''Store at room temperature away from moisture, heat, or cold. Do not freeze.''''What happens if I miss a dose?''Take the missed dose as soon as you remember. Skip the missed dose if it is almost time for your next scheduled dose. Do not take extra medicine to make up the missed dose.''"
What happens if I overdose? Tamoxifen,''Seek emergency medical attention or call the Poison Help line at 1-800-222-1222.''
What should I avoid while taking tamoxifen? Tamoxifen,"''This medicine can pass into body fluids (urine, feces, vomit). Caregivers should wear rubber gloves while cleaning up a patient's body fluids, handling contaminated trash or laundry or changing diapers. Wash hands before and after removing gloves. Wash soiled clothing and linens separately from other laundry.''Avoid grapefruit and grapefruit juice while taking tamoxifen.''"
Tamoxifen side effects,"''Get emergency medical help if you have signs of an allergic reaction to tamoxifen: hives; difficulty breathing; swelling of your face, lips, tongue, or throat.''Tamoxifen can increase your risk of stroke or blood clots. Call your doctor at once if you have:''signs of a stroke - sudden numbness or weakness (especially on one side of the body), sudden severe headache, slurred speech, problems with vision or balance;signs of a blood clot in the lung - chest pain, sudden cough, wheezing, rapid breathing, coughing up blood; orsigns of a blood clot in your leg - pain, swelling, warmth, or redness in one or both legs.''Also call your doctor at once if you have:''blurred vision, tunnel vision, eye pain, or seeing halos around lights;unusual vaginal bleeding or discharge;changes in your menstrual periods;pain or pressure in your pelvic area;a new breast lump;liver problems - nausea, upper stomach pain, itching, tired feeling, loss of appetite, dark urine, clay-colored stools, jaundice (yellowing of the skin or eyes); orhigh levels of calcium in your blood - vomiting, constipation, increased thirst or urination, muscle weakness, bone pain, confusion, lack of energy, or tired feeling.''Common tamoxifen side effects may include:''hot flashes;menstrual changes;flushing;nausea/vomiting;vaginal discharge; orweight loss.''This is not a complete list of side effects and others may occur. Call your doctor for medical advice about side effects. You may report side effects to FDA at 1-800-FDA-1088.''''"
What is tamsulosin? Tamsulosin,"''Tamsulosin (Flomax) is an alpha-blocker that relaxes the muscles in the prostate and bladder neck, making it easier to urinate.''Tamsulosin is used to improve urination in men with benign prostatic hyperplasia (enlarged prostate).''Tamsulosin is not FDA approved for use in women or children.''"
Important information Tamsulosin,"''You should not use this medication if you are allergic to tamsulosin. Do not take tamsulosin with other similar medicines such as alfuzosin (Uroxatral), doxazosin (Cardura), prazosin (Minipress), silodosin (Rapaflo), or terazosin (Hytrin).''Tamsulosin may cause dizziness or fainting, especially when you first start taking it or when you start taking it again. Be careful if you drive or do anything that requires you to be alert. Avoid standing for long periods of time or becoming overheated during exercise and in hot weather. Avoid getting up too fast from a sitting or lying position, or you may feel dizzy.''If you stop taking this medicine for any reason, call your doctor before you start taking it again. You may need a dose adjustment.''Tamsulosin can affect your pupils during cataract surgery. Tell your eye surgeon ahead of time that you are using this medication. Do not stop using tamsulosin before surgery unless your surgeon tells you to.''There are many other drugs that can interact with this medicine. Tell your doctor about all medications you use.''Follow all directions on your medicine label and package. Tell each of your healthcare providers about all your medical conditions, allergies, and all medicines you use.''"
Before taking this medicine Tamsulosin,"''You should not use tamsulosin if you are allergic to it. Do not take tamsulosin together with similar medicines such as alfuzosin (Uroxatral), doxazosin (Cardura), prazosin (Minipress), silodosin (Rapaflo), or terazosin (Hytrin).''To make sure tamsulosin is safe for you, tell your doctor if you have:''liver or kidney disease;a history of prostate cancer;low blood pressure; oran allergy to sulfa drugs.''Tamsulosin can affect your pupils during cataract surgery. Tell your eye surgeon ahead of time that you are using this medicine. Do not stop using tamsulosin before surgery unless your surgeon tells you to.''Although this medicine is not for use in women, tamsulosin is not expected to harm an unborn baby. If you are a woman using this medication, tell your doctor if you are pregnant or breast-feeding.''This medicine is not approved for use by anyone younger than 18 years old.''"
How should I take tamsulosin? Tamsulosin,"''Take tamsulosin exactly as it was prescribed for you. Follow all directions on your prescription label. Your doctor may occasionally change your dose to make sure you get the best results. Do not take this medicine in larger or smaller amounts or for longer than recommended.''Tamsulosin is usually taken once a day, approximately 30 minutes after a meal. Try to take this medication at the same time each day.''Do not crush, chew, or open a capsule. Swallow the capsule whole.''Tamsulosin lowers blood pressure and may cause dizziness or fainting, especially when you first start taking it, or when you start taking it again. Call your doctor if you have severe dizziness or feel like you might pass out.''Some things can cause your blood pressure to get too low. This includes vomiting, diarrhea, heavy sweating, heart disease, dialysis, a low-salt diet, or taking diuretics (water pills). Tell your doctor if you have a prolonged illness that causes diarrhea or vomiting.''Your blood pressure will need to be checked often. You will also need to be checked for prostate cancer before and during treatment with tamsulosin.''You may feel very dizzy when you first wake up. Be careful when standing or sitting up from a lying position.''If you stop taking tamsulosin for any reason, call your doctor before you start taking it again. You may need a dose adjustment.''Store at room temperature away from moisture and heat.''Read all patient information, medication guides, and instruction sheets provided to you. Ask your doctor or pharmacist if you have any questions.''"
Tamsulosin dosing information,"''Usual Adult Dose for Benign Prostatic Hyperplasia:''Initial Dose: 0.4 mg orally once a dayMaximum Dose: 0.8 mg orally once a dayComments:-If use is discontinued or interrupted for several days at either the 0.4 mg or 0.8 mg dose, treatment should be initiated again with the 0.4 mg once a day dose.Use: Treatment of the signs and symptoms of benign prostatic hyperplasia (BPH)''''What happens if I miss a dose?''Take the missed dose as soon as you remember. Skip the missed dose if it is almost time for your next scheduled dose. Do not take extra medicine to make up the missed dose.''If you miss your doses for several days in a row, contact your doctor before restarting the medication.''"
What happens if I overdose? Tamsulosin,''Seek emergency medical attention or call the Poison Help line at 1-800-222-1222.''
What should I avoid while taking tamsulosin? Tamsulosin,"''Tamsulosin may impair your thinking or reactions. Be careful if you drive or do anything that requires you to be alert. Avoid getting up too fast from a sitting or lying position, or you may feel dizzy. Get up slowly and steady yourself to prevent a fall.''Dizziness or severe drowsiness can cause falls, accidents, or severe injuries.''To prevent dizziness, avoid standing for long periods of time or becoming overheated during exercise and in hot weather.''Drinking alcohol can increase certain side effects of tamsulosin.''"
