Questions,Answer
What is Ubrelvy?,''Ubrelvy (ubrogepant) is used in adults to treat migraine headaches with or without aura.''Ubrelvy will not prevent a migraine headache.''It is not known if Ubrelvy is safe and effective in children.''
Important Information,"''You should not take Ubrelvy if you are taking medicines known as strong CYP3A4 Inhibitors, such as:''ketoconazoleclarithromycinitraconazole''Ask your healthcare provider if you are not sure if you are taking any of these medicines. Your healthcare provider can tell you if it is safe to take Ubrelvy with other medicines.''Tell your doctor about all your current medicines and any you start or stop using. Many drugs can interact, and some drugs should not be used together.''"
Before taking this medicine,"''Many drugs can interact and cause dangerous effects. Some drugs should not be used together with Ubrelvy. Your doctor may change your treatment plan if you also use:''nefazodone;an antibiotic - clarithromycin, telithromycin;antifungal medicine - itraconazole, ketoconazole; orantiviral medicine to treat HIV/AIDS - indinavir, nelfinavir, ritonavir, saquinavir.''To make sure this medicine is safe for you, tell your doctor if you have:''liver disease; orkidney disease.''Tell your doctor if you are pregnant or plan to become pregnant. It is not known whether Ubrelvy will harm an unborn baby. However, having migraine headaches during pregnancy may cause complications such as diabetes or eclampsia (dangerously high blood pressure that can lead to medical problems in both mother and baby). The benefit of treating migraines may outweigh any risks to the baby.''It may not be safe to breastfeed while using this medicine. Ask your doctor about any risk.''Ubrelvy is not approved for use by anyone younger than 18 years old.''"
How should I take Ubrelvy?,"''Take Ubrelvy exactly as prescribed by your doctor. Follow all directions on your prescription label and read all medication guides or instruction sheets. Use the medicine exactly as directed.''You may take this medicine with or without food. Avoid grapefruit or grapefruit juice.''After taking Ubrelvy: If your headache does not completely go away, or goes away and comes back, you may take a second tablet if it has been at least 2 hours since your first dose. If your symptoms have not improved, contact your doctor before taking any more tablets.''You should not take a second tablet within 24 hours if you have consumed a grapefruit product, or if you also take any of the following medications:''ciprofloxacin;cyclosporine;fluconazole;fluvoxamine; orverapamil.''Call your doctor if you have more than 8 headaches in one month (30 days). Tell your doctor if this medicine seems to stop working as well in treating your migraine attacks.''Store at room temperature away from moisture and heat.''"
Ubrelvy dosing information,"''Usual Adult Dose for Migraine:''Initial dose: 50 to 100 mg orally, once-After 2 hours, a second dose may be taken if neededMaximum dose: 200 mg in 24-hour periodComments:-The safety of treating more than 8 migraines in a 30-day period is unknown.Use: For the acute treatment of migraine with or without aura.''''What happens if I miss a dose?''Since Ubrelvy is used when needed, it does not have a daily dosing schedule. Do not take more than 200 milligrams in a 24-hour period. Do not use this medicine to treat more than 8 headaches per month.''"
What happens if I overdose?,''Seek emergency medical attention or call the Poison Help line at 1-800-222-1222.''
What should I avoid while taking Ubrelvy?,''Grapefruit may interact with ubrogepant and lead to unwanted side effects. You should not take a second Ubrelvy tablet within 24 hours after consuming grapefruit or grapefruit juice.''
Ubrelvy side effects,"''Get emergency medical help if you have signs of an allergic reaction to Ubrelvy: hives; difficult breathing; swelling of your face, lips, tongue, or throat.''Common Ubrelvy side effects may include:''nausea; ordrowsiness.''This is not a complete list of side effects and others may occur. Call your doctor for medical advice about side effects. You may report side effects to FDA at 1-800-FDA-1088.''''"
What other drugs will affect Ubrelvy?,"''Sometimes it is not safe to use certain medications at the same time. Some drugs can affect your blood levels of other drugs you take, which may increase side effects or make the medications less effective.''Tell your doctor about all your current medicines. Many drugs can interact with ubrogepant, especially:''curcumin (also called turmeric);cyclosporine;eltrombopag;fluconazole;fluvoxamine;phenytoin;St. John's wort;an antibiotic - ciprofloxacin, rifampin;a barbiturate - butabarbital, phenobarbital, secobarbital; orheart or blood pressure medicine - carvedilol, quinidine, verapamil.''This list is not complete and many Other drugs may interact with ubrogepant. This includes prescription and over-the-counter medicines, vitamins, and herbal products. Not all possible drug interactions are listed here.''''"
What is ubrogepant?,''Ubrogepant is used in adults to treat migraine headaches with or without aura.''Ubrogepant will not prevent a migraine headache.''Ubrogepant may also be used for purposes not listed in this medication guide.''''
Important Information,"''Tell your doctor about all your current medicines and any you start or stop using. Many drugs can interact, and some drugs should not be used together.''''"
Before taking this medicine,"''Many drugs can interact and cause dangerous effects. Some drugs should not be used together with ubrogepant. Your doctor may change your treatment plan if you also use:''nefazodone;an antibiotic--clarithromycin, telithromycin;antifungal medicine--itraconazole, ketoconazole; orantiviral medicine to treat HIV/AIDS--indinavir, nelfinavir, ritonavir, saquinavir.''Tell your doctor if you have ever had:''liver disease; orkidney disease.''Tell your doctor if you are pregnant or plan to become pregnant. It is not known whether ubrogepant will harm an unborn baby. However, having migraine headaches during pregnancy may cause complications such as diabetes or eclampsia (dangerously high blood pressure that can lead to medical problems in both mother and baby). The benefit of treating migraines may outweigh any risks to the baby.''It may not be safe to breastfeed while using  ubrogepant. Ask your doctor about any risk.''Ubrogepant is not approved for use by anyone younger than 18 years old.''''"
How should I take ubrogepant?,"''Follow all directions on your prescription label and read all medication guides or instruction sheets. Use the medicine exactly as directed.''You may take ubrogepant with or without food. Avoid grapefruit or grapefruit juice.''After taking ubrogepant: If your headache does not completely go away, or goes away and comes back, you may take a second tablet if it has been at least 2 hours since your first dose. If your symptoms have not improved, contact your doctor before taking any more tablets.''You should not take a second tablet within 24 hours if you have consumed a grapefruit product, or if you also take any of the following medications:''ciprofloxacin;cyclosporine;fluconazole;fluvoxamine; orverapamil.''Call your doctor if you have more than 8 headaches in one month (30 days). Tell your doctor if this medicine seems to stop working as well in treating your migraine attacks.''Store at room temperature away from moisture and heat.''''What happens if I miss a dose?''Since ubrogepant is used when needed, it does not have a daily dosing schedule. Do not take more than 200 milligrams in a 24-hour period. Do not use ubrogepant to treat more than 8 headaches per month.''''"
What happens if I overdose?,''Seek emergency medical attention or call the Poison Help line at 1-800-222-1222.''''
What should I avoid while taking ubrogepant?,''Grapefruit may interact with ubrogepant and lead to unwanted side effects. You should not take a second ubrogepant tablet within 24 hours after consuming grapefruit or grapefruit juice.''''
Ubrogepant side effects,"''Get emergency medical help if you have signs of an allergic reaction: hives; difficult breathing; swelling of your face, lips, tongue, or throat.''Common side effects may include:''nausea; ordrowsiness.''This is not a complete list of side effects and others may occur. Call your doctor for medical advice about side effects. You may report side effects to FDA at 1-800-FDA-1088.''''"
Ubrogepant dosing information,"''Usual Adult Dose for Migraine:Initial dose: 50 to 100 mg orally, once -After 2 hours, a second dose may be taken if needed Maximum dose: 200 mg in 24-hour periodComments:-The safety of treating more than 8 migraines in a 30-day period is unknown.  Use: For the acute treatment of migraine with or without aura.''"
What other drugs will affect ubrogepant?,"''Sometimes it is not safe to use certain medications at the same time. Some drugs can affect your blood levels of other drugs you take, which may increase side effects or make the medications less effective.''Tell your doctor about all your current medicines. Many drugs can affect ubrogepant, especially:''curcumin (also called turmeric);cyclosporine;eltrombopag;fluconazole;fluvoxamine;phenytoin;St. John's wort;an antibiotic--ciprofloxacin, rifampin;a barbiturate--butabarbital, phenobarbital, secobarbital; orheart or blood pressure medicine--carvedilol, quinidine, verapamil.''This list is not complete and many other drugs may affect ubrogepant. This includes prescription and over-the-counter medicines, vitamins, and herbal products. Not all possible drug interactions are listed here.''''"
What is Uceris?,"''Uceris (budesonide) is an extended release corticosteroid tablet that reduces inflammation in the body.''Uceris extended release tablets are a prescription medicine used to help get active, mild to moderate ulcerative colitis (UC) under control (induce remission) in adults.''It is not known if Uceris extended release tablets are safe and effective in children.''"
Important Information,"''When taking Uceris avoid being near people who are sick or have infections. Call your doctor for preventive treatment if you are exposed to chicken pox or measles. These conditions can be serious or even fatal in people who are using Uceris.''Call your doctor if you have signs of too much corticosteroid in your body, such as thinning skin, easy bruising, changes in the shape or location of body fat (especially in your face, neck, back, and waist), increased acne or facial hair, menstrual problems, impotence, or loss of interest in sex.''Follow all directions on your medicine label and package. Tell each of your healthcare providers about all your medical conditions, allergies, and all medicines you use.''"
Before taking this medicine,"''You should not use Uceris if you are allergic to budesonide.''To make sure Uceris is safe for you, tell your doctor if you have ever had:''tuberculosis;an infection, including chickenpox or measles;high blood pressure;a weak immune system (caused by disease or by using certain medicines);osteoporosis or low bone mineral density;a stomach ulcer;liver disease;eczema;any allergy; or(in you or a family member) diabetes, cataracts, or glaucoma.''Tell your doctor if you are pregnant or plan to become pregnant.''It is not known whether budesonide will harm an unborn baby. However, having untreated or uncontrolled ulcerative colitis during pregnancy can cause complications leading to preterm delivery or low birth weight. The benefit of treating ulcerative colitis may outweigh any risks to the baby.''If you have taken Uceris during pregnancy, tell your doctor if you notice weakness, irritability, vomiting, or feeding problems in your newborn baby.''You should not breastfeed while using this medicine.''Uceris is not approved for use by anyone younger than 18 years old.''"
How should I take Uceris?,"''Take Uceris exactly as it was prescribed for you. Follow all directions on your prescription label and read all medication guides or instruction sheets.''Take this medicine in the morning with a full glass of water.''Read and carefully follow any Instructions for Use provided with your medicine. Ask your doctor or pharmacist if you do not understand these instructions.''Swallow the tablet whole. Do not crush, chew, or break a tablet.''Your dosage needs may change if you have surgery, are ill, or are under stress. Do not change your doses or medication schedule without advice from your doctor.''Call your doctor if your symptoms do not improve, or if they get worse while using Uceris.''Uceris can weaken your immune system. Tell your doctor if you have signs of infection such as fever, chills, body aches, vomiting, or feeling tired.''If you use this medicine long-term, you may need frequent medical tests.''Store at room temperature away from moisture and heat. Keep the bottle tightly closed when not in use.''''What happens if I miss a dose?''Take the medicine as soon as you can, but skip the missed dose if it is almost time for your next dose. Do not take two doses at one time.''"
What happens if I overdose?,"''Seek emergency medical attention or call the Poison Help line at 1-800-222-1222.''High doses or long-term use of steroid medicine can lead to thinning skin, easy bruising, changes in body fat (especially in your face, neck, back, and waist), increased acne or facial hair, menstrual problems, impotence, or loss of interest in sex.''"
What should I avoid while taking Uceris?,''Grapefruit may interact with budesonide and lead to unwanted side effects. Avoid the use of grapefruit products.''Avoid being near people who are sick or have infections. Call your doctor for preventive treatment if you are exposed to chickenpox or measles. These conditions can be serious or even fatal in people who are using Uceris.''
Uceris side effects,"''Get emergency medical help if you have signs of an allergic reaction to Uceris: hives; difficulty breathing; swelling of your face, lips, tongue, or throat.''Call your doctor at once if you have:''thinning skin, easy bruising, increased acne or facial hair;swelling in your ankles;weakness, tiredness, or a light-headed feeling, like you might pass out;nausea, vomiting, rectal bleeding;pain or burning when you urinate;menstrual problems (in women), impotence or loss of interest in sex (in men); orsigns of too much steroid medicine in your blood - acne, bruising, thinning skin, increased facial or body hair, stretch marks, increased body fat, or changes in the shape or location of body fat (especially in your face, neck, back, and waist).''Common Uceris side effects may include:''headache, dizziness;indigestion, nausea, vomiting, stomach pain, bloating, gas, constipation;feeling tired;back pain, joint pain;painful urination;cold symptoms such as stuffy nose, sneezing, sore throat;pain anywhere in your body; orsigns of too much steroid medicine in your blood.''This is not a complete list of side effects and others may occur. Call your doctor for medical advice about side effects. You may report side effects to FDA at 1-800-FDA-1088.''''"
What is  Udenyca?,''Udenyca is used to prevent neutropenia (a lack of certain white blood cells) that is caused by receiving chemotherapy.''Udenyca is a form of a protein that stimulates the growth of white blood cells that help your body fight against infection.''Udenyca may also be used for purposes not listed in this medication guide.''''
Important Information Udenyca,"''Follow all directions on your medicine label and package. Tell each of your healthcare providers about all your medical conditions, allergies, and all medicines you use.''''"
Before taking this medicine Udenyca,"''You should not use  Udenyca if you are allergic to Udenyca or filgrastim (Neupogen).''Tell your doctor if you have ever had:''sickle cell disorder;kidney disease;chronic myeloid leukemia;radiation treatment;myelodysplasia (also called ""preleukemia""); ora latex allergy.''It is not known whether this medicine will harm an unborn baby. Tell your doctor if you are pregnant or plan to become pregnant. If you are pregnant, your name may be listed on a pregnancy registry to track the effects of pegfilgrastim on the baby.''It may not be safe to breast-feed while using this medicine. Ask your doctor about any risk.''''How should I use  Udenyca?''Follow all directions on your prescription label and read all medication guides or instruction sheets. Use the medicine exactly as directed. Udenyca should not be given within 14 days before or 24 hours after you receive chemotherapy.''Udenyca is injected under the skin. A healthcare provider may teach you how to properly use the medication by yourself.''Read and carefully follow any Instructions for Use provided with your medicine. Ask your doctor or pharmacist if you don't understand all instructions.''Prepare your injection only when you are ready to give it. Do not use if the medicine looks cloudy, has changed colors, or has particles in it. Call your pharmacist for new medicine.''Carefully follow your doctor's instructions when giving Udenyca to a child who weighs less than 99 pounds (45 kilograms). The correct dose for a child this size cannot be accurately measured using the prefilled syringe.''You may need frequent medical tests to help your doctor determine how long to treat you with Udenyca.''Store the prefilled syringe in its original package in the refrigerator, protected from light. Do not shake or freeze.''Take the syringe out of the refrigerator and let it reach room temperature for 15 to 30 minutes before injecting your dose. If a syringe has become frozen, thaw it in a refrigerator. Do not use any syringe that has been frozen more than one time.''Do not use a Neulasta or Udenyca syringe that has been left at room temperature for longer than 48 hours. Do not use a Fulphilaor Ziextenzo syringe that has been left at room temperature for longer than 72 hours.''The Neulasta Onpro Injector is a special device placed on the skin that delivers your Udenyca dose at a specific time. You will need to wear the device for 27 hours before the dose begins. The timed dose will then be released from the device slowly over a 45-minute period.''Keep Neulasta Onpro refrigerated until you are ready to wear it. Do not use an Onpro device that has been left out of a refrigerator for longer than 12 hours.''While wearing Neulasta Onpro, you or a caregiver will need to check the device to make sure it is working properly.''Each prefilled syringe or Onpro Injector is for one use only. Throw it away after one use, even if there is still medicine left inside.''Use a needle and syringe only once and then place them in a puncture-proof ""sharps"" container. Follow state or local laws about how to dispose of this container. Keep it out of the reach of children and pets.''''What happens if I miss a dose?''Call your doctor for instructions if you miss an injection, or if you have a problem with the Neulasta Onpro device.''''"
What happens if I overdose? Udenyca,''Seek emergency medical attention or call the Poison Help line at 1-800-222-1222.''''
What should I avoid while using  Udenyca?,"''When using Neulasta Onpro: Avoid traveling, driving, or operating machinery while wearing the device.''''"
 Udenyca side effects,"''Get emergency medical help if you have signs of an allergic reaction: hives, skin rash, sweating; dizziness, warmth or tingly feeling; wheezing, difficulty breathing; swelling of your face, lips, tongue, or throat.''Capillary leak syndrome is a rare but serious side effect of pegfilgrastim. Call your doctor right away if you have signs of this condition, which may include: decreased urination, tiredness, dizziness or light-headed feeling, trouble breathing, and sudden swelling, puffiness, or feeling of fullness.''Call your doctor at once if you have:''fever, tiredness, stomach pain, back pain;sudden or severe pain in your left upper stomach spreading up to your shoulder;easy bruising, unusual bleeding, purple or red spots under your skin;rapid breathing, feeling short of breath, pain while breathing;bruising, swelling, or a hard lump where the medicine was injected; orkidney problems--little or no urination, pink or dark urine, swelling in your face or lower legs.''Common side effects may include:''bone pain; orpain in your arms or legs.''This is not a complete list of side effects and others may occur. Call your doctor for medical advice about side effects. You may report side effects to FDA at 1-800-FDA-1088.''''"
What other drugs will affect  Udenyca?,"''Other drugs may affect Udenyca, including prescription and over-the-counter medicines, vitamins, and herbal products. Tell your doctor about all your current medicines and any medicine you start or stop using.''''"
What is ulipristal?,"''Ulipristal is an emergency contraceptive. It works by stopping or delaying the release of an egg from an ovary. Ulipristal may also make it harder for a fertilized egg to attach to the uterus.''Ulipristal is used to prevent pregnancy after having sex without using a condom or other effective birth control method. Ulipristal is also used to prevent pregnancy after a regular form of birth control has failed. Ulipristal is not to be used as a regular form of daily, weekly, or monthly birth control.''ULIPRISTAL SHOULD NOT BE USED TO TERMINATE AN EXISTING PREGNANCY.''Ulipristal may also be used for purposes not listed in this medication guide.''''"
Important Information,"''Ulipristal is not to be used as a regular form of daily, weekly, or monthly birth control.''Ulipristal can harm an unborn baby or cause birth defects. Do not use if you are already pregnant or think you might be pregnant.''''"
Before taking this medicine,"''You should not use  ulipristal if you have already confirmed that you are pregnant, or if you are allergic to ulipristal.''Do not use ulipristal if you have not yet started having menstrual periods, or if you are past menopause.''Tell your doctor if you have ever had:''an ectopic (tubal) pregnancy; orif your last menstrual period was more than 4 weeks ago.''This medicine can harm an unborn baby or cause birth defects. Do not use emergency contraception if you are already pregnant or think you might be pregnant.''You should not breast-feed while using this medicine.''''"
How should I take ulipristal?,"''Follow all directions on your prescription label and read all medication guides or instruction sheets. Use the medicine exactly as directed.''Ulipristal is usually given as soon as possible after unprotected sex or failed birth control method (such as a condom that broke during sex). Follow your doctor's dosing instructions very carefully. Ulipristal can be taken any time during your menstrual cycle, but you must use the medicine within 5 days (120 hours) after unprotected sex.''If you vomit within 3 hours after taking ulipristal, your medication may not be as effective. Call your doctor to discuss the need for taking another ulipristal tablet.''You may take ulipristal with or without food.''After taking ulipristal, you should use a barrier form of birth control (condom or diaphragm with spermicide) at least until your next menstrual period.''You should wait at least 5 days after taking ulipristal before you start using hormonal birth control (birth control pills, injections, implants, skin patches, vaginal rings). Both ulipristal and hormonal birth control may be less effective when used at the same time. You may need to use a barrier form of birth control until your hormonal birth control takes effect.''Store ulipristal in the original container at room temperature, away from moisture, heat, and light.''Contact your doctor if your next menstrual period is more than 1 week late. You will need a pregnancy test to make sure you are not pregnant. Do not take a second course of ulipristal.''''What happens if I miss a dose?''Since ulipristal is used only once when needed, it does not have a daily dosing schedule.''''"
What happens if I overdose?,''Seek emergency medical attention or call the Poison Help line at 1-800-222-1222.''''
What should I avoid while taking ulipristal?,"''Ulipristal will not protect you from sexually transmitted diseases, including HIV and AIDS. Using a condom is the only way to protect yourself from these diseases.''''"
Ulipristal side effects,"''Get emergency medical help if you have signs of an allergic reaction: hives; difficult breathing; swelling of your face, lips, tongue, or throat.''Call your doctor at once or seek emergency medical attention if you have severe pain in your lower stomach (especially on only one side) 3 to 5 weeks after using ulipristal.''Common side effects may include:''headache;dizziness, tired feeling;nausea, stomach pain; ormenstrual pain.''This is not a complete list of side effects and others may occur. Call your doctor for medical advice about side effects. You may report side effects to FDA at 1-800-FDA-1088.''''"
Ulipristal dosing information,"''Usual Adult Dose for Contraception:30 mg orally as soon as possible within 120 hours (5 days) after unprotected intercourse or a known or suspected contraceptive failureComments:-If vomiting occurs within 3 hours, consideration should be given to repeating the dose.-The drug can be taken at any time during the menstrual cycle.-This drug is not intended for routine use as a contraceptive.  Use: Prevention of pregnancy following unprotected intercourse or a known or suspected contraceptive failure''"
What is Uloric?,"''Uloric (febuxostat) reduces the production of uric acid in your body. A build-up of uric acid can cause gout symptoms.''Uloric is used to keep uric acid levels from getting to high in people with gout.''Uloric is for use only in people who cannot take another medicine called allopurinol, or when allopurinol has stopped working.''"
