Questions,Answer
Before taking this medicine Urea topical,"''You should not use urea topical if you are allergic to it.''FDA pregnancy category C. It is not known whether urea topical will harm an unborn baby. Do not use  urea topical without a doctor's advice if you are pregnant.''It is not known whether urea topical passes into breast milk or if it could harm a nursing baby. Do not use this medicine without a doctor's advice if you are breast-feeding a baby.''''How should I use urea topical?''Urea topical is available in many different forms (cream, lotion, ointment, liquid, gel, foam, shampoo, and others) for use on the skin or the scalp. Use your medicine exactly as directed on the label, or as prescribed by your doctor. Do not use in larger or smaller amounts or for longer than recommended.''Do not take by mouth. Urea topical is for use only on the skin. If this medication gets in your eyes, nose, mouth, rectum, or vagina, rinse with water.''Use a mild soap or cleanser to wash the skin or nail area to be treated. Urea topical may work best if the skin or nail to be treated is left slightly damp before the medicine is applied.''Apply a thin layer of this medicine to the affected skin and rub it in as completely as possible.''When applying urea topical to the nails, avoid getting any medicine on the cuticles or surrounding skin. Apply generously to the nail and allow the medicine to dry. You may cover the nail with a bandage or gauze if your doctor advises. The treated nail should be easily removed after several days.''Shake the urea topical foam well just before each use. Other forms of this medicine may also need to be shaken before use. Follow all directions on th medicine label.''Wash your hands with soap and water after applying this medicine, unless you are treating the skin on your hands.''Call your doctor if your symptoms do not improve, or if they get worse while using urea topical.''Store at room temperature away from moisture and heat. Do not freeze. Keep the medicine container tightly closed when not in use.''Keep the foam canister away from open flame or high heat. The canister may explode if it gets too hot. Do not puncture or burn an empty foam canister.''''What happens if I miss a dose?''Use the missed dose as soon as you remember. Skip the missed dose if it is almost time for your next scheduled dose. Do not use extra medicine to make up the missed dose.''''"
What happens if I overdose? Urea topical,''Seek emergency medical attention or call the Poison Help line at 1-800-222-1222.''''
What should I avoid while using urea topical? Urea topical,"''Do not use  urea topical on open wounds, burns, or areas of swollen skin. If this medication gets in your eyes, nose, mouth, rectum, or vagina, rinse with water.''''"
Urea topical side effects,"''Get emergency medical help if you have any of these signs of an allergic reaction: hives; difficult breathing; swelling of your face, lips, tongue, or throat.''Stop using urea topical and call your doctor at once if you have:''severe redness or irritation of treated skin.''Common side effects may include:''mild itching; ormild burning or stinging.''This is not a complete list of side effects and others may occur. Call your doctor for medical advice about side effects. You may report side effects to FDA at 1-800-FDA-1088.''''"
Urea topical dosing information,''Usual Adult Dose for Dermatological Disorders:Urea 30% foam:Urea 35% foam:Urea 35% lotion:Urea 39% cream:Urea 40% foam:Urea 42% foam:Urea 45% emulsion:Urea 45% solution:Urea 50% emulsion:Urea 50% ointment:Urea 50% suspension:Apply to affected skin twice/day.Urea 40% emulsion:Urea 40% suspension:Urea 42% pad:Urea 45% gel:Urea 50% cream:Urea 50% gel:Apply to nail tissue or affected skin twice/day.Urea 50% stick:Apply to affected nail tissue twice/day.''
What is  Urecholine?,"''Urecholine is used to treat urinary retention (trouble urinating) that may be caused by surgery, delivering a baby, or other conditions.''Urecholine may also be used for purposes not listed in this medication guide.''''"
Important Information Urecholine,"''Follow all directions on your medicine label and package. Tell each of your healthcare providers about all your medical conditions, allergies, and all medicines you use.''''"
Before taking this medicine Urecholine,"''You should not use Urecholine if you are allergic to it, or if you have:''slow heartbeats or very low blood pressure (especially if this has caused you to faint);coronary artery disease (clogged arteries);asthma;an overactive thyroid;epilepsy or other seizure disorder;an active ulcer in your stomach or intestines;a blockage in your digestive tract (stomach or intestines);peritonitis (inflammation of the membrane lining the organs inside your abdomen);a bladder obstruction or other urination problems;Parkinson's disease; orif you recently had surgery on your bladder or intestines.''Tell your doctor if you have ever had:''urination problems, or a bladder infection;a stomach or intestinal disorder;heart problems;low blood pressure;a thyroid disorder; orbreathing problems.''Tell your doctor if you are pregnant.''You should not breastfeed while using Urecholine.''Urecholine is not approved for use by anyone younger than 18 years old.''''"
How should I take  Urecholine?,"''Follow all directions on your prescription label and read all medication guides or instruction sheets. Your doctor may occasionally change your dose. Use the medicine exactly as directed.''Take Urecholine on an empty stomach, at least 1 hour before or 2 hours after a meal.''It may take up to 90 minutes before your symptoms improve. The effects of bethanechol usually last for about 1 hour.''Call your doctor if your symptoms do not improve within 90 minutes after taking Urecholine.''Store at room temperature away from moisture and heat.''Keep the tablets in their original container, along with the packet or canister of moisture-absorbing preservative.''''What happens if I miss a dose?''Take the medicine as soon as you can, but skip the missed dose if it is almost time for your next dose. Do not take two doses at one time.''''"
What happens if I overdose? Urecholine,"''Seek emergency medical attention or call the Poison Help line at 1-800-222-1222.''Overdose symptoms may include drooling, stomach discomfort, nausea, vomiting, or feeling hot.''''"
What should I avoid while taking  Urecholine?,"''Avoid driving or hazardous activity until you know how  Urecholine will affect you. Your reactions could be impaired.''Avoid getting up too fast from a sitting or lying position, or you may feel dizzy.''''"
 Urecholine side effects,"''Get emergency medical help if you have signs of an allergic reaction: hives; difficult breathing; swelling of your face, lips, tongue, or throat.''Call your doctor at once if you have:''slow heartbeats;a light-headed feeling, like you might pass out; orwheezing, chest tightness, trouble breathing.''Common side effects may include:''an urgent need to urinate;stomach cramps, nausea, diarrhea;burping, increased saliva;headache, dizziness;sweating, flushing (sudden warmth, redness, or tingly feeling);a general ill feeling; orwatery eyes, vision changes.''This is not a complete list of side effects and others may occur. Call your doctor for medical advice about side effects. You may report side effects to FDA at 1-800-FDA-1088.''''"
What is  Uribel?,"''Hyoscyamine produces many effects in the body, including relief from muscle spasms.''Methenamine and methylene blue work as mild antiseptics that fight bacteria in the urine and bladder.''Phenyl salicylate is a mild pain reliever.''Sodium biphosphate is a form of phosphorus, which is a naturally occurring substance that is important in every cell in the body.''Uribel is a combination medicine used to treat bladder irritation (pain, spasms, inflammation) caused by urinary tract infection.  Uribel is also used to prevent bladder discomfort during a medical procedure.''Uribel may also be used for purposes not listed in this medication guide.''''"
Important Information Uribel,"''Many drugs can interact with methylene blue. During your treatment with this medicine, do not start or stop using any other medications without your doctor's advice.''If you take an antidepressant or psychiatric medication, call your doctor right away if you have signs of a serious drug interaction, including: confusion, memory problems, feeling hyperactive (mentally or physically), loss of coordination, muscle twitching, shivering, sweating, diarrhea, and/or fever.''''"
Before taking this medicine Uribel,"''You should not use this medicine if you are allergic to hyoscyamine, methenamine, methylene blue, phenyl salicylate, or sodium biphosphate.''During your treatment with this medicine, do not start or stop using any other medications unless your doctor tells you to.''To make sure this medicine is safe for you, tell your doctor if you have:''heart disease;a heart rhythm disorder;congestive heart failure;coronary heart disease;a heart valve disorder;glaucoma;an enlarged prostate or bladder obstruction;myasthenia gravis;an ulcer or obstruction in your stomach;an allergy to belladonna (Donnatal and others); oran allergy to salicylates (such as aspirin, choline magnesium trisalicylate, magnesium salicylate).''It is not known whether this medication will harm an unborn baby. Tell your doctor if you are pregnant or plan to become pregnant while using this medicine.''This medicine can pass into breast milk and may harm a nursing baby. Tell your doctor if you are breast-feeding a baby.''Do not give this medicine to a child without medical advice.''''"
How should I take  Uribel?,"''Follow all directions on your prescription label. Do not take this medicine in larger or smaller amounts or for longer than recommended.''Drink plenty of liquids while you are taking this medicine.''Hyoscyamine can slow your digestion, and it may take longer for your body to absorb any medicines you take by mouth.''Store at room temperature away from moisture, heat, and light. Keep the bottle tightly closed when not in use.''''What happens if I miss a dose?''Take the missed dose as soon as you remember. Skip the missed dose if it is almost time for your next scheduled dose. Do not take extra medicine to make up the missed dose.''''"
What happens if I overdose? Uribel,''Seek emergency medical attention or call the Poison Help line at 1-800-222-1222.''''
What should I avoid while taking  Uribel?,"''Avoid taking an antacid or anti-diarrhea medicine within 1 hour before or after you take hyoscyamine, methenamine, methylene blue, phenyl salicylate, and sodium biphosphate. Antacids or anti-diarrhea medicine can make it harder for your body to absorb hyoscyamine.''If you also take ketoconazole (Nizoral), wait at least 2 hours after taking it before you take hyoscyamine, methenamine, methylene blue, phenyl salicylate, and sodium biphosphate.''''"
 Uribel side effects,"''Get emergency medical help if you have signs of an allergic reaction: hives; difficult breathing; swelling of your face, lips, tongue, or throat.''Stop using this medicine and call your doctor at once if you have:''severe dizziness, blurred vision, fast heart rate;painful or difficult urination; orshortness of breath.''Older adults may be more likely to have side effects from this medication.''Methylene blue will most likely cause your urine or stools to appear blue or green in color. This is a normal side effect of the medication and will not cause any harm.''Common side effects may include:''dizziness, drowsiness;dry mouth; ornausea, vomiting.''This is not a complete list of side effects and others may occur. Call your doctor for medical advice about side effects. You may report side effects to FDA at 1-800-FDA-1088.''''"
What is  Urispas?,"''Urispas reduces muscle spasms of the bladder and urinary tract.''Urispas is used to treat bladder symptoms such as painful urination, frequent or urgent urination, increased night-time urination, bladder pain, and incontinence (urine leakage). These bladder symptoms are often caused by overactive bladder, prostate enlargement, bladder infections, or irritation of the urethra.''Urispas will not treat a bladder infection. Infections must be treated with an antibiotic.''Urispas may also be used for purposes not listed in this medication guide.''''"
Important Information Urispas,"''You should not use Urispas if you have bleeding or a blockage in your digestive tract (stomach or intestines), a bladder obstruction, or if you are unable to urinate.''''"
Before taking this medicine Urispas,"''You should not use Urispas if you are allergic to it, or if you have:''blockage in your digestive tract (stomach or intestines);stomach or intestinal bleeding; orbladder obstruction or if you are unable to urinate.''To make sure Urispas is safe for you, tell your doctor if you have:''glaucoma; orurination problems.''Urispas is not expected to harm an unborn baby. Tell your doctor if you are pregnant or plan to become pregnant.''It is not known whether flavoxate passes into breast milk or if it could harm a nursing baby. Tell your doctor if you are breast-feeding a baby.''Urispas is not approved for use by anyone younger than 12 years old.''''"
How should I take  Urispas?,"''Follow all directions on your prescription label. Do not take this medicine in larger or smaller amounts or for longer than recommended.''Your doctor may occasionally change your Urispas dose to make sure you get the best results.''Call your doctor if your symptoms do not improve, or if they get worse.''If your doctor has also prescribed medicine to treat a bladder infection, use that medicine for the full prescribed length of time. Your symptoms may improve before the infection is completely cleared. Skipping doses may also increase your risk of further infection that is resistant to antibiotics.''Store Urispas at room temperature away from moisture, heat, and light.''''What happens if I miss a dose?''Take the missed dose as soon as you remember. Skip the missed dose if it is almost time for your next scheduled dose. Do not take extra medicine to make up the missed dose.''''"
What happens if I overdose? Urispas,''Seek emergency medical attention or call the Poison Help line at 1-800-222-1222.''''
What should I avoid while taking  Urispas?,''Urispas may cause blurred vision and may impair your thinking or reactions. Be careful if you drive or do anything that requires you to be alert and able to see clearly.''''
 Urispas side effects,"''Get emergency medical help if you have signs of an allergic reaction: hives; difficult breathing; swelling of your face, lips, tongue, or throat.''Common side effects may include:''nausea, vomiting, dry mouth;headache, dizziness, drowsiness;pounding heartbeats or fluttering in your chest;confusion, nervousness; orrash or itching.''This is not a complete list of side effects and others may occur. Call your doctor for medical advice about side effects. You may report side effects to FDA at 1-800-FDA-1088.''''"
What is  Urocit-K?,"''Potassium is a mineral that is found in many foods and is needed for several functions of your body, especially the beating of your heart.''Urocit-K is used to treat a kidney stone condition called renal tubular acidosis.''Urocit-K may also be used for other purposes other than those listed in this medication guide.''''"
Important Information Urocit-K,"''You should not use this medication if you have kidney failure, a urinary tract infection, uncontrolled diabetes, a peptic ulcer in your stomach, Addison's disease, severe burns or other tissue injury, if you are dehydrated, if you take certain diuretics (water pills), or if you have high levels of potassium in your blood (hyperkalemia).''You should not take Urocit-K tablets if you have problems with your esophagus, stomach, or intestines that make it difficult for you to swallow or digest pills.''Do not crush, chew, break, or suck on an extended-release tablet. Swallow the pill whole. Breaking or crushing the pill may cause too much of the drug to be released at one time. Sucking on a potassium tablet can irritate your mouth or throat.''Avoid lying down for at least 30 minutes after you take this medication.''Take this medication with a meal or bedtime snack, or within 30 minutes after a meal.''To be sure this medication is helping your condition, your blood may need to be tested often. Your heart rate may also be checked using an electrocardiograph or ECG (sometimes called an EKG) to measure electrical activity of the heart. This test will help your doctor determine how long to treat you with potassium. Do not miss any scheduled appointments.''Serious side effects of potassium citrate include uneven heartbeat, muscle weakness or limp feeling, severe stomach pain, and numbness or tingling in your hands, feet, or mouth.''Do not stop taking this medication without first talking to your doctor. If you stop taking potassium suddenly, your condition may become worse.''''"
Before taking this medicine Urocit-K,"''You should not use this medication if you are allergic to it, or if you have certain conditions. Be sure your doctor knows if you have:''high levels of potassium in your blood (hyperkalemia);kidney failure;a urinary tract infection;untreated or uncontrolled diabetes;Addison's disease (an adrenal gland disorder);a large tissue injury such as a severe burn;a peptic ulcer in your stomach;if you are severely dehydrated; orif you are taking a ""potassium-sparing"" diuretic (water pill) such as amiloride (Midamor, Moduretic), spironolactone (Aldactone, Aldactazide), triamterene (Dyrenium, Dyazide, Maxzide).''You should not take Urocit-K tablets if you have problems with your esophagus, stomach, or intestines that make it difficult for you to swallow or digest pills.''Before using Urocit-K, tell your doctor if you are allergic to any drugs, or if you have:''kidney disease;congestive heart failure, enlarged heart, or history of heart attack;other heart disease or high blood pressure;diabetes;a blockage in your stomach or intestines; orchronic diarrhea (such as ulcerative colitis, Crohn's disease).''If you have any of these conditions, you may need a dose adjustment or special tests to safely take Urocit-K.''FDA pregnancy category C. This medication may be harmful to an unborn baby. Tell your doctor if you are pregnant or plan to become pregnant during treatment.''It is not known whether potassium passes into breast milk or if it could harm a nursing baby. Do not use this medication without telling your doctor if you are breast-feeding a baby.''''"
How should I take  Urocit-K?,"''Take this medication exactly as prescribed by your doctor. Do not take it in larger amounts or for longer than recommended. Follow the directions on your prescription label.''Do not crush, chew, break, or suck on an extended-release tablet. Swallow the pill whole. Breaking or crushing the pill may cause too much of the drug to be released at one time. Sucking on a potassium tablet can irritate your mouth or throat. Call your doctor if it feels like the tablet is getting stuck in your throat when you swallow it.''Measure the liquid medicine with a special dose-measuring spoon or cup, not a regular table spoon. If you do not have a dose-measuring device, ask your pharmacist for one.''Liquid potassium should be mixed with at least 4 ounces (one-half cup) of cold water or fruit juice. Drink the mixture slowly, over 5 to 10 minutes in all. To make sure you get the entire dose, add a little more water to the same glass, swirl gently and drink right away.''Take this medication with a meal or bedtime snack, or within 30 minutes after a meal.''Your treatment may include a special diet. It is very important to follow the diet plan created for you by your doctor or nutrition counselor. You should become very familiar with the list of foods you should eat or avoid to help control your condition.''To be sure this medication is helping your condition, your blood may need to be tested often. Your heart rate may also be checked using an electrocardiograph or ECG (sometimes called an EKG) to measure electrical activity of the heart. This test will help your doctor determine how long to treat you with potassium. Do not miss any scheduled appointments.''Do not stop taking this medication without first talking to your doctor. If you stop taking potassium suddenly, your condition may become worse.''Store Urocit-K at room temperature away from moisture and heat. Keep the medication in a closed container.''''What happens if I miss a dose?''Take the missed dose as soon as you remember. If it is almost time for your next dose, wait until then to take the medicine and skip the missed dose. Do not take extra medicine to make up the missed dose.''''"
What happens if I overdose? Urocit-K,"''Seek emergency medical attention if you think you have used too much of  Urocit-K.''Overdose symptoms may include heavy feeling in your arms or legs, muscle weakness, limp feeling, slow or uneven heartbeat, chest pain, or feeling like you might pass out.''''"
What should I avoid while taking  Urocit-K?,"''Avoid lying down for at least 30 minutes after you take this medication.''Avoid taking potassium supplements or using other products that contain potassium without first asking your doctor. Salt substitutes or low-salt dietary products often contain potassium. If you take certain products together you may accidentally get too much potassium. Read the label of any other medicine you are using to see if it contains potassium.''While taking this medication, avoid strenuous exercise if you are not in proper condition for it.''''"
 Urocit-K side effects,"''Get emergency medical help if you have any of these signs of an allergic reaction: hives; difficulty breathing; swelling of your face, lips, tongue, or throat.''Stop using this medication and call your doctor at once if you have any of these serious side effects:''confusion, anxiety, feeling like you might pass out;uneven heartbeat;extreme thirst, increased urination;leg discomfort;muscle weakness or limp feeling;numbness or tingly feeling in your hands or feet, or around your mouth;severe stomach pain, ongoing diarrhea or vomiting;black, bloody, or tarry stools; orcoughing up blood or vomit that looks like coffee grounds.''Less serious side effects may include:''mild nausea or upset stomach;mild or occasional diarrhea; orappearance of a Urocit-K tablet in your stool.''This is not a complete list of side effects and others may occur. Tell your doctor about any unusual or bothersome side effect. You may report side effects to FDA at 1-800-FDA-1088.''''"
What is urofollitropin?,"''Urofollitropin is a purified form of a hormone called follicle-stimulating hormone (FSH). This hormone is important in the development of follicles (eggs) that are produced by the ovaries in women.''Urofollitropin is used together with other medicines to treat infertility in women with FSH deficiency. Urofollitropin is also used to help the ovaries produce multiple eggs for use in ""in-vitro"" fertilization.''Urofollitropin alone will not cause ovulation (production of an egg by the ovaries). You will need to receive other medicines to stimulate ovulation.''Urofollitropin may also be used for purposes not listed in this medication guide.''''"
Important Information,"''You should not use  urofollitropin if you have primary ovarian failure, abnormal vaginal bleeding, uncontrolled thyroid or adrenal gland disorders, an ovarian cyst, breast cancer, uterine or ovarian cancer, a pituitary gland tumor, or infertility that is not caused by lack of ovulation.''Do not use urofollitropin if you are pregnant.''Stop using urofollitropin, do not have sexual intercourse, and call your doctor right away if you have any of the following symptoms: stomach pain, bloating, nausea, vomiting, diarrhea, rapid weight gain, little or no urinating, or pain when you breathe, rapid heart rate, or shortness of breath.''''"
