Questions,Answer
 Yonsa side effects,"''Get emergency medical help if you have signs of an allergic reaction: hives; difficult breathing; swelling of your face, lips, tongue, or throat.''Call your doctor at once if you have:''swelling in your ankles or feet, pain in your legs;shortness of breath;pain or burning when you urinate, blood in your urine;fast heartbeats;headache, confusion;a light-headed feeling, like you might pass out;muscle weakness; orliver problems--stomach pain (upper right side), nausea, vomiting, dark urine, jaundice (yellowing of the skin or eyes).''Common side effects may include:''indigestion, vomiting, diarrhea, constipation;painful or difficult urination;swelling in your legs or feet;feeling weak, feeling very hot;muscle pain;abnormal blood tests;joint pain or swelling;bruising; orcold symptoms such as stuffy nose, sneezing, cough, sore throat.''This is not a complete list of side effects and others may occur. Call your doctor for medical advice about side effects. You may report side effects to FDA at 1-800-FDA-1088.''''"
What other drugs will affect  Yonsa?,"''Sometimes it is not safe to use certain medications at the same time. Some drugs can affect your blood levels of other drugs you take, which may increase side effects or make the medications less effective.''Tell your doctor about all your other prostate cancer medicines, especially radium Ra 223 (Xofigo).''Other drugs may affect Yonsa, including prescription and over-the-counter medicines, vitamins, and herbal products. Tell your doctor about all your current medicines and any medicine you start or stop using.''''"
What is Yupelri? Yupelri Inhalation,"''Yupelri (revefenacin) is an anticholinergic medicine. Anticholinergic medicines help the muscles around the airways in your lungs stay relaxed.''Yupelri is a prescription medicine used to treat chronic obstructive pulmonary disease (COPD), including emphysema and chronic bronchitis.''Yupelri relaxes the muscles in your lungs to help prevent wheezing, cough, chest tightness, and shortness of breath.''"
Important Information Yupelri Inhalation,"''Yupelri is not a rescue medicine for bronchospasm attacks. Use only fast-acting inhalation medicine for an attack. Seek medical attention if your breathing problems get worse quickly, or if you think your medications are not working as well.''"
Before taking this medicine Yupelri Inhalation,"''You should not use Yupelri if you are allergic to revefenacin.''To make sure Yupelri is safe for you, tell your doctor if you have ever had:''glaucoma;urination problems;an enlarged prostate; orliver disease.''Tell your doctor if you are pregnant or breastfeeding.''Yupelri is not approved for use by anyone younger than 18 years old.''"
How should I take Yupelri? Yupelri Inhalation,"''Use Yupelri exactly as prescribed by your doctor. Follow all directions on your prescription label and read all medication guides or instruction sheets.''Yupelri is an inhaled medicine that should be used only with a standard jet nebulizer connected to an air compressor. The usual dose is 1 vial per day. Do not mix this medicine with other medicines in the nebulizer cup (reservoir).''Yupelri is not a rescue medicine for bronchospasm attacks. Use only fast-acting inhalation medicine for an attack. Seek medical attention if your breathing problems get worse quickly, or if you think your medications are not working as well.''Read and carefully follow any Instructions for Use provided with your medicine. Ask your doctor or pharmacist if you do not understand these instructions.''Do not use the medicine if it has changed colors or looks cloudy. Call your pharmacist for new medicine.''Store this medicine in the foil pouch at room temperature. Use the medicine right away after opening. Discard any pouch not used before the expiration date on the label.''You should not stop using Yupelri suddenly. Stopping suddenly may make your condition worse.''"
Yupelri dosing information Yupelri Inhalation,"''Usual Adult Dose for Chronic Obstructive Pulmonary Disease -- Maintenance:''One 175 mcg vial once a day via a nebulizer with a mouthpiece''''What happens if I miss a dose?''Use the medicine as soon as you can, but skip the missed dose if it is almost time for your next dose. Do not use two doses at one time.''"
What happens if I overdose? Yupelri Inhalation,"''Seek emergency medical attention or call the Poison Help line at 1-800-222-1222.''Overdose symptoms may include nausea, vomiting, vision problems, trouble urinating, or feeling light-headed.''"
What should I avoid while taking Yupelri? Yupelri Inhalation,"''Follow your doctor's instructions about any restrictions on food, beverages, or activity.''"
Yupelri side effects Yupelri Inhalation,"''Get emergency medical help if you have signs of an allergic reaction to Yupelri: hives; difficult breathing; swelling of your face, lips, tongue, or throat.''Call your doctor at once if you have:''wheezing, choking, or other breathing problems after using this medicine;blurred vision, tunnel vision, eye pain or redness, or seeing halos around lights;painful or difficult urination; ortrouble emptying your bladder (a weak stream of urine).''Common Yupelri side effects may include:''headache;back pain; orcold symptoms such as runny nose, sneezing, cough, sore throat.''This is not a complete list of side effects and others may occur. Call your doctor for medical advice about side effects. You may report side effects to FDA at 1-800-FDA-1088.''''"
What other drugs will affect Yupelri? Yupelri Inhalation,"''Tell your doctor about all your other medicines, especially:''medicine to treat depression, anxiety, mood disorders, or mental illness;cold or allergy medicine (Benadryl and others);medicine to treat Parkinson's disease;medicine to treat stomach problems, motion sickness, or irritable bowel syndrome;medicine to treat overactive bladder; orbronchodilator asthma medication.''This list is not complete. Other drugs may interact with revefenacin, including prescription and over-the-counter medicines, vitamins, and herbal products. Not all possible drug interactions are listed here.''''"
