Questions,Answer
Before taking this medicine Zestoretic,"''You should not use Zestoretic if you are allergic to hydrochlorothiazide or lisinopril, or if:''you have hereditary angioedema;you are unable to urinate;you recently took a heart medicine called sacubitril;you have an allergy to sulfa drugs; oryou have ever had a severe allergic reaction to any ACE inhibitor (benazepril, captopril, enalapril, fosinopril, moexipril, perindopril, quinapril, ramipril, trandolapril).''Do not take Zestoretic within 36 hours before or after taking medicine that contains sacubitril (such as Entresto).''If you have diabetes, do not use hydrochlorothiazide and lisinopril together with any medication that contains aliskiren (a blood pressure medicine).''You may also need to avoid taking Zestoretic with aliskiren if you have kidney disease.''To make sure Zestoretic is safe for you, tell your doctor if you have:''kidney disease (or if you are on dialysis);cirrhosis or other liver disease;glaucoma;heart disease or congestive heart failure;asthma or allergies;gout;lupus;an allergy to sulfa drugs or penicillin; orif you are on a low-salt diet.''Do not use if you are pregnant. Stop using the medicine and tell your doctor right away if you become pregnant. Lisinopril can cause injury or death to the unborn baby if you take the medicine during your second or third trimester.''You should not breastfeed while using hydrochlorothiazide and lisinopril.''Zestoretic is not approved for use by anyone younger than 18 years old.''"
How should I take Zestoretic?,"''Take Zestoretic exactly as prescribed by your doctor. Follow all directions on your prescription label and read all medication guides or instruction sheets. Your doctor may occasionally change your dose.''Call your doctor if you have ongoing vomiting or diarrhea, or if you are sweating more than usual. You can easily become dehydrated while taking this medicine. This can lead to very low blood pressure, electrolyte disorders, or kidney failure.''Your blood pressure will need to be checked often, and you may need occasional blood tests.''If you need surgery, tell your surgeon you currently use this medicine.''Keep using this medicine as directed, even if you feel well. High blood pressure often has no symptoms. You may need to use blood pressure medication for the rest of your life.''Store at room temperature away from moisture, heat, and light.''"
Zestoretic dosing information,"''Usual Adult Dose for Hypertension:''Initial dose: Hydrochlorothiazide 12.5 mg-Lisinopril 10 to 20 mg orally once a day, depending on the current monotherapy doseMaximum dose: Hydrochlorothiazide 50 mg-Lisinopril 80 mg per dayComments:-May increase dose every 2 to 3 weeks.-If blood pressure is controlled with monotherapy hydrochlorothiazide 25 mg per day, but significant potassium loss occurs, then similar or greater blood pressure control without electrolyte disturbance may be achieved with hydrochlorothiazide 12.5 mg-lisinopril 10 mg orally once a day.''''What happens if I miss a dose?''Take the medicine as soon as you can, but skip the missed dose if it is almost time for your next dose. Do not take two doses at one time.''"
What happens if I overdose? Zestoretic,''Seek emergency medical attention or call the Poison Help line at 1-800-222-1222.''
What should I avoid while taking Zestoretic?,"''Drinking alcohol can further lower your blood pressure and may increase certain side effects of this medicine.''Do not use potassium supplements or salt substitutes while you are taking this medicine, unless your doctor has told you to.''Avoid getting up too fast from a sitting or lying position, or you may feel dizzy.''Avoid becoming overheated or dehydrated during exercise, in hot weather, or by not drinking enough fluids. Follow your doctor's instructions about the type and amount of liquids you should drink. In some cases, drinking too much liquid can be as unsafe as not drinking enough.''"
Zestoretic side effects,"''Get emergency medical help if you have signs of an allergic reaction to Zestoretic: hives; severe stomach pain; difficulty breathing; swelling of your face, lips, tongue, or throat.''Call your doctor at once if you have:''a light-headed feeling, like you might pass out;eye pain, vision problems;little or no urination;weakness, drowsiness, or feeling restless;fever, chills, sore throat, mouth sores, trouble swallowing;jaundice (yellowing of the skin or eyes);high potassium - nausea, tingly feeling, chest pain, irregular heartbeats, loss of movement;low potassium - leg cramps, constipation, irregular heartbeats, fluttering in your chest, increased thirst or urination, numbness or tingling, muscle weakness or limp feeling; orlow sodium - headache, confusion, slurred speech, severe weakness, vomiting, loss of coordination, feeling unsteady.''Common Zestoretic side effects may include:''cough;headache;dizziness; ortired feeling.''This is not a complete list of side effects and others may occur. Call your doctor for medical advice about side effects. You may report side effects to FDA at 1-800-FDA-1088.''''"
What is Zestril?,"''Zestril (lisinopril) is an ACE inhibitor. ACE stands for angiotensin converting enzyme.''Zestril is used to treat high blood pressure (hypertension) in adults and children who are at least 6 years old.''Zestril is also used to treat congestive heart failure in adults, or to improve survival after a heart attack.''"
Important information Zestril,"''Do not use Zestril if you are pregnant. It could harm the unborn baby. Stop using this medicine and tell your doctor right away if you become pregnant.''You should not use Zestril if you have ever had angioedema. Do not take this medicine within 36 hours before or after taking medicine that contains sacubitril (such as Entresto).''If you have diabetes, do not use Zestril together with any medication that contains aliskiren (such as Tekturna or Tekamlo).''You may also need to avoid taking Zestril with aliskiren if you have kidney disease.''"
Before taking this medicine Zestril,"''You should not use Zestril if you are allergic to lisinopril, or if you:''have a history of angioedema;recently took a heart medicine called sacubitril; orare allergic to any other ACE inhibitor, such as benazepril, captopril, enalapril, fosinopril, moexipril, perindopril, quinapril, ramipril, or trandolapril.''Do not take Zestril within 36 hours before or after taking medicine that contains sacubitril (such as Entresto).''If you have diabetes, do not use Zestril together with any medication that contains aliskiren (such as Tekturna or Tekamlo).''To make sure Zestril is safe for you, tell your doctor if you have:''kidney disease (or if you are on dialysis);liver disease; orhigh levels of potassium in your blood.''Do not use Zestril if you are pregnant, and tell your doctor right away if you become pregnant. Lisinopril can cause injury or death to the unborn baby if you take the medicine during your second or third trimester.''You should not breastfeed while using Zestril.''"
How should I take Zestril?,"''Take Zestril exactly as prescribed by your doctor. Follow all directions on your prescription label. Your doctor may occasionally change your dose to make sure you get the best results. Do not take this medicine in larger or smaller amounts or for longer than recommended.''Drink plenty of water each day while you are taking this medicine.''Zestril can be taken with or without food.''Your blood pressure will need to be checked often. Your kidney function and electrolytes may also need to be checked.''Call your doctor if you are sick with vomiting or diarrhea, or if you are sweating more than usual. You can easily become dehydrated while taking lisinopril. This can lead to very low blood pressure, a serious electrolyte imbalance, or kidney failure.''If you need surgery, tell the surgeon ahead of time that you are using Zestril.''If you have high blood pressure, keep using this medication even if you feel well. High blood pressure often has no symptoms. You may need to use blood pressure medication for the rest of your life.''Store Zestril at room temperature away from moisture and heat.''''What happens if I miss a dose?''Take the missed dose as soon as you remember. Skip the missed dose if it is almost time for your next scheduled dose. Do not take extra medicine to make up the missed dose.''"
What happens if I overdose? Zestril,''Seek emergency medical attention or call the Poison Help line at 1-800-222-1222.''
What should I avoid while taking Zestril?,"''Drinking alcohol can further lower your blood pressure and may increase certain side effects of Zestril.''Avoid becoming overheated or dehydrated during exercise, in hot weather, or by not drinking enough fluids. Zestril can decrease sweating and you may be more prone to heat stroke.''Do not use potassium supplements or salt substitutes while taking Zestril, unless your doctor has told you to.''Avoid getting up too fast from a sitting or lying position, or you may feel dizzy. Get up slowly and steady yourself to prevent a fall.''"
Zestril side effects,"''Get emergency medical help if you have signs of an allergic reaction to Zestril: hives; severe stomach pain, difficult breathing; swelling of your face, lips, tongue, or throat. You may be more likely to have an allergic reaction if you are African-American.''Call your doctor at once if you have:''a light-headed feeling, like you might pass out;fever, sore throat;high potassium - nausea, weakness, tingly feeling, chest pain, irregular heartbeats, loss of movement;kidney problems - little or no urination, swelling in your feet or ankles, feeling tired or short of breath; orliver problems - nausea, upper stomach pain, itching, tired feeling, loss of appetite, dark urine, clay-colored stools, jaundice (yellowing of the skin or eyes).''Common Zestril side effects may include:''headache, dizziness;cough; orchest pain.''This is not a complete list of side effects and others may occur. Call your doctor for medical advice about side effects. You may report side effects to FDA at 1-800-FDA-1088.''''"
Zestril dosing information,"''Usual Adult Dose for Hypertension:''Initial dose: 10 mg orally once a day; 5 mg orally once a dayMaintenance dose: 20 to 40 mg orally once a dayMaximum dose: 80 mg orally once a dayComments:-The initial dose is 5 mg orally once a day in patients receiving a diuretic.-The 80 mg dose is used but does not appear to give greater effect.-If blood pressure is not controlled with lisinopril alone, a low dose of a diuretic may be added (e.g., hydrochlorothiazide, 12.5 mg). After the addition of a diuretic, it may be possible to reduce the dose of lisinopril.''Usual Adult Dose for Congestive Heart Failure:''Initial dose: 2.5 to 5 mg orally once a dayMaintenance dose: Dosage should be increased as toleratedMaximum dose: 40 mg orally once a dayComments:-The diuretic dose may need to be adjusted to help minimize hypovolemia, which may contribute to hypotension. The appearance of hypotension after the initial dose of lisinopril does not preclude subsequent careful dose titration with the drug.''Usual Adult Dose for Myocardial Infarction:''Initial dose: 5 mg orally (within 24 hours of the onset of acute myocardial infarction)Subsequent doses: 5 mg orally after 24 hours, then 10 mg orally after 48 hours.Maintenance dose: 10 mg orally once a day. Dosing should continue for at least 6 weeks.Comments:-Therapy should be initiated at 2.5 mg in patients with a low systolic blood pressure (less than or equal to 120 mm Hg and greater than 100 mmHg) during the first 3 days after the infarct. If prolonged hypotension occurs (systolic blood pressure less than 90 mmHg for more than 1 hour) therapy should be withdrawn.Uses: Reduction of mortality in acute myocardial infarction''Usual Adult Dose for Diabetic Nephropathy:''Initial dose: 10 to 20 mg orally once a dayMaintenance dose: 20 to 40 mg orally once a dayDosage may be titrated upward every 3 daysComments:-Not an approved indication.''Usual Geriatric Dose for Hypertension:''Initial dose: 2.5 to 5 mg orally once a dayMaintenance dose: Dosages should be increased at 2.5 mg to 5 mg per day at 1 to 2 week intervals.Maximum dose: 40 mg orally once a day''Usual Pediatric Dose for Hypertension:''Pediatric patients greater than or equal to 6 years of age:Initial dose: 0.07 mg/kg orally once a day (Maximum initial dose is 5 mg once a day)Maintenance dose: Dosage should be adjusted according to blood pressure response at 1 to 2 week intervals.Maximum dose: Doses above 0.61 mg/kg or greater than 40 mg have not been studied in pediatric patientsComments:-This drug is not recommended in pediatric patients less than 6 years old or in pediatric patients with glomerular filtration rate less than 30 mL/min.''"
What other drugs will affect Zestril?,"''Tell your doctor about all your current medicines and any you start or stop using, especially:''a diuretic or ""water pill"";lithium;gold injections to treat arthritis;insulin or oral diabetes medicine;a potassium supplement;medicine to prevent organ transplant rejection - everolimus, sirolimus, tacrolimus, temsirolimus; orNSAIDs (nonsteroidal anti-inflammatory drugs) - aspirin, ibuprofen (Advil, Motrin), naproxen (Aleve), celecoxib, diclofenac, indomethacin, meloxicam, and others.''This list is not complete. Other drugs may interact with lisinopril, including prescription and over-the-counter medicines, vitamins, and herbal products. Not all possible interactions are listed in this medication guide.''''"
What is Zetia?,''Zetia (ezetimibe) reduces the amount of cholesterol absorbed by the body.''Zetia is used to treat high cholesterol.''Zetia is sometimes given with other cholesterol-lowering medications.''
Important information Zetia,"''Zetia is only part of a complete program of treatment that also includes diet, exercise, and weight control. Follow your diet, medication, and exercise routines very closely.''Some cholesterol medications should not be taken at the same time. If you take Zetia with another cholesterol medicine, follow your doctor's dosing instructions very carefully.''You should not use Zetia if you have moderate to severe liver disease. You should not use ezetimibe with a ""statin"" cholesterol medicine if you have active liver disease, or if you are pregnant or breast-feeding a baby.''Call your doctor right away if you have unexplained muscle pain, tenderness, or weakness especially if you also have fever, unusual tiredness, and dark colored urine.''"
Before taking this medicine Zetia,"''You should not use Zetia if you are allergic to ezetimibe, or if you have:''moderate to severe liver disease.''You should not use ezetimibe with a ""statin"" cholesterol medicine (Zocor, Lipitor, Crestor, and others) if:''you have active liver disease;you are pregnant; oryou are breast-feeding a baby.''To make sure Zetia is safe for you, tell your doctor if you have:''kidney disease; ora thyroid disorder.''Before you start taking Zetia, tell your doctor if you already take a statin cholesterol medicine.''Some cholesterol medications can cause a condition that results in the breakdown of skeletal muscle tissue, leading to kidney failure. This condition may be more likely to occur in older adults and in people who have kidney disease or poorly controlled hypothyroidism (underactive thyroid).''You should not take ezetimibe with a statin medication if you are pregnant or breast-feeding.''It is not known whether Zetia alone will harm an unborn baby. Tell your doctor if you are pregnant or plan to become pregnant. Use effective birth control to prevent pregnancy while you are using ezetimibe with a statin medication.''It is not known whether ezetimibe alone passes into breast milk or if it could harm a nursing baby. Tell your doctor if you are breast-feeding a baby. You should not breast-feed if you take Zetia with a statin medication.''"
How should I take Zetia?,"''Take Zetia exactly as it was prescribed for you. Follow all directions on your prescription label. Do not take this medicine in larger or smaller amounts or for longer than recommended.''Zetia is usually taken once daily. Take the medicine at the same time each day.''You may take this medicine with or without food.''Zetia may be taken at the same time with fenofibrate, or with a statin medication such as atorvastatin, lovastatin, simvastatin, pravastatin, or fluvastatin.''Some cholesterol medications should not be taken at the same time.''If you also take cholestyramine, colestipol, or colesevelam: Wait at least 4 hours after taking any of these medicines before you take ezetimibe. You may also take ezetimibe 2 hours before taking any of these other medicines.You should not take ezetimibe with gemfibrozil.''You may need frequent blood tests to check your liver function if you take ezetimibe with a statin medicine.''It may take up to 2 weeks before your cholesterol levels improve. Keep using your medication as directed. You will need frequent blood tests to measure your cholesterol levels.''Zetia is only part of a complete program of treatment that also includes diet, exercise, and weight control. Follow your diet, medication, and exercise routines very closely.''Store at room temperature away from moisture and heat.''''What happens if I miss a dose?''Take the missed dose as soon as you remember. Skip the missed dose if it is almost time for your next scheduled dose. Do not take extra medicine to make up the missed dose.''"
What happens if I overdose? Zetia,''Seek emergency medical attention or call the Poison Help line at 1-800-222-1222.''
What should I avoid while taking Zetia?,''Avoid eating foods that are high in fat or cholesterol. Zetia will not be as effective in lowering your cholesterol if you do not follow a cholesterol-lowering diet plan.''
Zetia side effects,"''Get emergency medical help if you have signs of an allergic reaction to Zetia: hives; difficult breathing; swelling of your face, lips, tongue, or throat.''Some cholesterol medications can cause a condition that results in the breakdown of skeletal muscle tissue, leading to kidney failure. Call your doctor right away if you have unexplained muscle pain, tenderness, or weakness especially if you also have fever, unusual tiredness, and dark colored urine.''Side effects may be more likely in older adults.''Common Zetia side effects may include:''muscle or joint pain;stuffy nose, sinus pain, sore throat;diarrhea; orpain in an arm or leg.''This is not a complete list of side effects and others may occur. Call your doctor for medical advice about side effects. You may report side effects to FDA at 1-800-FDA-1088.''''"
Zetia dosing information,''Usual Adult Dose for Hyperlipidemia:''10 mg once a day with or without food.''Usual Adult Dose for Sitosterolemia:''10 mg once a day with or without food.''
What other drugs will affect Zetia?,"''Tell your doctor about all your current medicines and any you start or stop using, especially:''cyclosporine; ora blood thinner (warfarin, Coumadin, Jantoven).''This list is not complete. Other drugs may interact with Zetia, including prescription and over-the-counter medicines, vitamins, and herbal products. Not all possible interactions are listed in this medication guide.''''"
What is Ziac?,"''Ziac contains a combination of hydrochlorothiazide and bisoprolol. Hydrochlorothiazide is a thiazide diuretic (water pill) that helps prevent your body from absorbing too much salt, which can cause fluid retention.''Bisoprolol is a beta-blocker. Beta-blockers affect the heart and circulation (blood flow through arteries and veins).''Ziac is used to treat high blood pressure (hypertension).''Ziac may also be used for purposes not listed in this medication guide.''"
Important information Ziac,"''You should not use Ziac if you are unable to urinate. You should not use this medicine if you have a serious heart condition such as ""sick sinus syndrome"" or ""AV block,"" severe heart failure, or slow heartbeats that have caused you to faint.''Before using Ziac, tell your doctor if you have congestive heart failure, circulation problems, kidney or liver disease, cirrhosis, glaucoma, asthma, bronchospastic lung disease, a thyroid disorder, lupus, gout, diabetes, or a penicillin allergy.''If you are diabetic, check your blood sugar carefully. Using bisoprolol can make it harder for you to tell when you have low blood sugar. Your insulin or diabetic medication needs may change while you are taking Ziac. Talk with your doctor before changing any doses.''Avoid becoming overheated or dehydrated during exercise and in hot weather. Follow your doctor's instructions about the type and amount of liquids you should drink. In some cases, drinking too much liquid can be as unsafe as not drinking enough.''Keep using Ziac even if you feel fine. High blood pressure often has no symptoms.''"
Before taking this medicine Ziac,"''You should not use Ziac if you are allergic to hydrochlorothiazide or bisoprolol, or if you have:''severe or uncontrolled heart failure;slow heartbeats that have caused you to faint;a serious heart condition called ""sick sinus syndrome"" or ""AV block"" (2nd or 3rd degree); orif you are unable to urinate.''To make sure Ziac is safe for you, tell your doctor if you have:''congestive heart failure;asthma or other breathing disorder;diabetes;a thyroid disorder;glaucoma;peripheral vascular disease such as Raynaud's syndrome;kidney disease;liver disease (or cirrhosis);lupus;gout; oran allergy to sulfa drugs or penicillin.''It is not known whether Ziac will harm an unborn baby. Tell your doctor if you are pregnant or plan to become pregnant.''Hydrochlorothiazide and bisoprolol can pass into breast milk and may harm a nursing baby. You should not breast-feed while using this medicine.''Ziac is not approved for use by anyone younger than 18 years old.''"
How should I take Ziac?,"''Take Ziac exactly as prescribed by your doctor. Follow all directions on your prescription label. Your doctor may occasionally change your dose to make sure you get the best results. Do not use Ziac in larger or smaller amounts or for longer than recommended.''You may have very low blood pressure while taking Ziac. Call your doctor if you are sick with vomiting or diarrhea, or if you are sweating more than usual. Prolonged illness can lead to a serious electrolyte imbalance, making it dangerous for you to use Ziac.''Your blood pressure will need to be checked often. Your blood and urine may both be tested if you have been vomiting or are dehydrated.''If you are diabetic, check your blood sugar carefully. Taking bisoprolol may make it harder for you to tell when you have low blood sugar. Your insulin or diabetes medication needs may change while you are taking Ziac. Do not change your medication dose or schedule without your doctor's advice.''If you need surgery or medical tests, tell the doctor ahead of time that you are taking medication that contains hydrochlorothiazide. You may need to stop using the medicine for a short time.''Do not skip doses or stop using Ziac suddenly. Stopping suddenly may make your condition worse. Follow your doctor's instructions about tapering your dose.''Keep using Ziac as directed, even if you feel well. High blood pressure often has no symptoms. You may need to use blood pressure medicine for the rest of your life.''Store at room temperature, away from heat and moisture. Keep the bottle tightly closed when not in use.''"
Ziac dosing information,"''Usual Adult Dose for Hypertension:''Initial dose: Bisoprolol 2.5 mg-Hydrochlorothiazide 6.25 mg orally once a dayMaximum dose: Bisoprolol 20 mg-Hydrochlorothiazide 12.5 mg orally once a dayComments:-Increase the dose every 14 days if optimal response not achieved.-This drug may be substituted for titrated individual components (e.g., inadequate control on bisoprolol 2.5 to 20 mg or adequate control on hydrochlorothiazide 50 mg but with significant potassium loss).-Abrupt discontinuation should be avoided; taper therapy gradually over approximately 2 weeks.-If withdrawal symptoms occur, therapy may be temporarily reinstituted.''''What happens if I miss a dose?''Take the missed dose as soon as you remember. Skip the missed dose if it is almost time for your next scheduled dose. Do not take extra medicine to make up the missed dose.''"
What happens if I overdose? Ziac,"''Seek emergency medical attention or call the Poison Help line at 1-800-222-1222.''Overdose symptoms may include confusion, leg cramps, numbness and tingling, slow heartbeats or fainting.''"
What should I avoid while taking Ziac?,"''Avoid drinking alcohol. It may increase your blood levels of bisoprolol.''Ask your doctor before using an antacid, and use only the type your doctor recommends. Some antacids can make it harder for your body to absorb Ziac.''Avoid getting up too fast from a sitting or lying position, or you may feel dizzy. Get up slowly and steady yourself to prevent a fall.''"
