Questions,Answer
What other drugs will affect  Zofran ODT?,"''Zofran ODT can cause a serious heart problem, especially if you use certain medicines at the same time, including antibiotics, antidepressants, heart rhythm medicine, antipsychotic medicines, and medicines to treat cancer, malaria, HIV or AIDS. Tell your doctor about all medicines you use, and those you start or stop using during your treatment with this medicine.''Taking Zofran ODT while you are using certain other medicines can cause high levels of serotonin to build up in your body, a condition called ""serotonin syndrome,"" which can be fatal. Tell your doctor if you also use:''medicine to treat depression;medicine to treat a psychiatric disorder;a narcotic (opioid) medication; ormedicine to prevent nausea and vomiting.''This list is not complete and many other drugs can interact with Zofran ODT. This includes prescription and over-the-counter medicines, vitamins, and herbal products. Give a list of all your medicines to any healthcare provider who treats you.''''"
What is Zoladex?,"''Zoladex (goserelin) is a man-made form of a hormone that regulates many processes in the body. Goserelin overstimulates the body's own production of certain hormones, which causes that production to shut down temporarily.''Zoladex is used in men to treat symptoms of prostate cancer.''Zoladex is used in women to treat breast cancer or endometriosis. Goserelin is also used in women to prepare the lining of the uterus for endometrial ablation (a surgery to correct abnormal uterine bleeding).''"
Important information Zoladex,"''Zoladex can harm an unborn baby or cause birth defects. Unless you are being treated for advanced breast cancer, you should not use Zoladex during pregnancy. Use effective non-hormonal (barrier) birth control during treatment and for at least 12 weeks after treatment ends. Tell your doctor right away if you become pregnant during treatment. You should not breast-feed while you are using Zoladex.''You should not use Zoladex if you are allergic to goserelin or to similar hormone medications such as leuprolide (Lupron, Eligard, Viadur), nafarelin (Synarel), or ganirelix (Antagon).''Before you receive Zoladex, tell your doctor if you have osteoporosis, diabetes, urination problems, a condition affecting your spine, a history of heart attack or stroke, risk factors for coronary artery disease (such as high blood pressure, high cholesterol, smoking, or being overweight), or if you have abnormal bleeding that your doctor has not checked.''Zoladex can decrease bone mineral density, which may increase your risk of developing osteoporosis. This risk may be greater if you smoke, drink alcohol frequently, have a family history of osteoporosis, or use certain drugs such as seizure medications or steroids. Talk to your doctor about your individual risk of bone loss.''Call your doctor at once if you have a serious side effect while using Zoladex, such as severe numbness or tingling in your legs or feet, muscle weakness, problems with balance or coordination, loss of bladder or bowel control, urinating less than usual, pain or burning when you urinate, blood in your urine or stools, easy bruising, increased thirst or urination, fruity breath odor, trouble breathing, sudden numbness or weakness, sudden severe headache, confusion, problems with vision or speech, or chest pain spreading to the arm or shoulder.''"
Before taking this medicine Zoladex,"''You should not use Zoladex if you are allergic to goserelin, or:''if you are allergic to other hormone medications such as leuprolide (Lupron, Eligard, Viadur), nafarelin (Synarel), or ganirelix (Antagon).''Unless you are being treated for advanced breast cancer, you should not use a Zoladex implant during pregnancy.''To make sure Zoladex is safe for you, tell your doctor if you have ever had:''diabetes;heart disease, heart attack, or stroke;risk factors for coronary artery disease (such as high blood pressure, high cholesterol, smoking, or being overweight);personal or family history of long QT syndrome;osteoporosis or low bone density;a condition affecting your spine;abnormal vaginal bleeding that has not been checked by a doctor; orif you take a blood thinner such as warfarin (Coumadin, Jantoven).''Zoladex can decrease bone mineral density, which may increase your risk of developing osteoporosis. This risk may be greater if you smoke, drink alcohol frequently, have a family history of osteoporosis, or use certain drugs such as seizure medications or steroids. Talk to your doctor about your individual risk of bone loss.''This medicine can harm an unborn baby or cause birth defects. However, Zoladex is sometimes given to pregnant women being treated for advanced breast cancer. Unless you are being treated for advanced breast cancer, you should not use Zoladex during pregnancy.''You may need to have a negative pregnancy test before receiving the implant.''Use a barrier form of birth control (condom or diaphragm with spermicide). Hormonal contraception (birth control pills, injections, implants, skin patches, and vaginal rings) may not be effective enough to prevent pregnancy during your treatment. Keep using birth control for at least 12 weeks after the Zoladex implant is removed.''It is not known whether goserelin passes into breast milk or if it could harm a nursing baby. You should not breast-feed while the Zoladex implant is in place.''How is Zoladex given?''Zoladex implant is inserted through a needle into the skin of your upper stomach, once every 28 days. You will receive the implant in a clinic or doctor's office.''Your dosing schedule may be different if you are also receiving chemotherapy. Follow your doctor's instructions. It is very important to receive your Zoladex injections on time each month.''You are not likely to be able to feel the implant through your skin, and it should not cause pain or discomfort. The implant will dissolve in your body over time.''While your hormone levels are adjusting, you may notice new or worsening symptoms of your condition during the first few weeks of treatment. Tell your doctor if your symptoms do not improve after several weeks.''If you are a premenopausal woman, you should stop having menstrual periods while the Zoladex implant is in place. Call your doctor if you still have regular periods. Missing a dose can cause breakthrough bleeding. After you stop using Zoladex, you should begin having regular periods within 12 weeks.''Your blood sugar may need to be checked while using Zoladex, even if you are not diabetic. You may need other blood tests at your doctor's office.''Zoladex can cause you to have unusual results with certain medical tests. Tell any doctor who treats you that you are using Zoladex.''"
Zoladex dosing information,"''Usual Adult Dose of Zoladex for Prostate Cancer:''For the palliative treatment of advanced carcinoma of the prostate:3.6 mg or 10.8 mg subcutaneously into the upper abdominal wall once.The 3.6 mg dosage may be repeated every 28 days.The 10.8 mg dosage may be repeated every 12 weeks.Intended for long-term administration unless clinically inappropriate.For use in the treatment of Stage B2-C prostate cancer: When administered in combination with radiotherapy and flutamide for patients with Stage T2b-T4 (Stage B2-C) prostate cancer, treatment should be started 8 weeks prior to initiating radiotherapy and should continue during radiotherapy.''Usual Adult Dose for Endometriosis:''For use in the management of endometriosis, including pain relief and reduction of endometriotic lesions for the duration of therapy: 3.6 mg subcutaneously into the upper abdominal wall once.The 3.6 mg dosage may be repeated every 28 days.The recommended duration of therapy is 6 months.''Usual Adult Dose for Breast Cancer - Palliative:''For use in the palliative treatment of advanced breast cancer: 3.6 mg subcutaneously into the upper abdominal wall once.The 3.6 mg dosage may be repeated every 28 days.Intended for long-term administration unless clinically inappropriate.''Usual Adult Dose for Bleeding:''For use as an endometrial thinning agent prior to endometrial ablation for dysfunctional uterine bleeding: 1 or 2 of the 3.6 mg subcutaneous depot injections (with each depot given four weeks apart). When one depot is administered, surgery should be performed at 4 weeks. When two depots are administered, surgery should be performed within 2 to 4 weeks following administration of the second depot.''''What happens if I miss a dose?''Call your doctor for instructions if you miss an appointment for your Zoladex implant injection.''"
What happens if I overdose? Zoladex,"''Since the Zoladex implant contains a specific amount of the medication, you are not likely to receive an overdose.''"
What should I avoid while receiving Zoladex?,"''Avoid drinking alcohol. It can increase your risk of bone loss while you are being treated with Zoladex.''Avoid smoking, which can increase your risk of bone loss, stroke, or heart problems.''This medicine can pass into body fluids (urine, feces, vomit). Caregivers should wear rubber gloves while cleaning up a patient's body fluids, handling contaminated trash or laundry or changing diapers. Wash hands before and after removing gloves. Wash soiled clothing and linens separately from other laundry.''"
Zoladex side effects,"''Get emergency medical help if you have signs of an allergic reaction to Zoladex: hives; difficult breathing; swelling of your face, lips, tongue, or throat.''Call your doctor at once if you have:''painful or difficult urination;pain, bruising, swelling, redness, oozing, or bleeding where the implant was injected;high blood sugar - increased thirst, increased urination, hunger, dry mouth, fruity breath odor, drowsiness, dry skin, blurred vision, weight loss;high calcium levels - nausea, vomiting, constipation, increased thirst or urination, muscle pain or weakness, bone pain, confusion, and feeling tired or restless;heart attack symptoms - chest pain or pressure, pain spreading to your jaw or shoulder, nausea, sweating;nerve problems - back pain, muscle weakness, problems with balance or coordination, severe numbness or tingling in your legs or feet, loss of bladder or bowel control; orsigns of a stroke - sudden numbness or weakness (especially on one side of the body), sudden severe headache, slurred speech, problems with vision or balance.''Common Zoladex side effects may include:''hot flashes, sweating;mood changes, increased or decreased interest in sex;changes in sexual function, fewer erections than normal;headache;swelling in your hands or feet;vaginal dryness, itching, or discharge;changes in breast size; oracne, mild skin rash or itching.''This is not a complete list of side effects and others may occur. Call your doctor for medical advice about side effects. You may report side effects to FDA at 1-800-FDA-1088.''''"
What is zoledronic acid? Zoledronic acid,"''Reclast and Zometa are two different brands of zoledronic acid.''Reclast is used to treat or prevent osteoporosis caused by menopause, or steroid use.  zoledronic acid also increases bone mass in men with osteoporosis. Reclast is for use when you have a high risk of bone fracture.''Reclast is also used to treat Paget's disease of bone.''Zometa is used to treat high blood levels of calcium caused by cancer (also called hypercalcemia of malignancy). This medicine also treats multiple myeloma (a type of bone marrow cancer) or bone cancer that has spread from elsewhere in the body.''You should not use Reclast and Zometa at the same time.''Zoledronic acid may also be used for purposes not listed in this medication guide.''''"
Important Information Zoledronic acid,"''Zoledronic acid may harm an unborn baby. Avoid getting pregnant while using this medicine and tell your doctor if you become pregnant.''Zoledronic acid can cause serious kidney problems, especially if you are dehydrated, if you take diuretic medicine, or if you already have kidney disease. Call your doctor if you urinate less than usual, if you have swelling in your feet or ankles, or if you feel tired or short of breath.''Also call your doctor if you have muscle spasms, numbness or tingling (in hands and feet or around the mouth), new or unusual hip pain, or severe pain in your joints, bones, or muscles.''''"
Before taking this medicine Zoledronic acid,"''You should not be treated with zoledronic acid if you are allergic to it.''You also should not receive Reclast if you have:''low levels of calcium in your blood (hypocalcemia); orsevere kidney disease.''You should not be treated with zoledronic acid if are currently using any other bisphosphonate (such as alendronate, etidronate, ibandronate, pamidronate, risedronate, or tiludronate).''Tell your doctor if you have ever had:''kidney disease;hypocalcemia;thyroid or parathyroid surgery;surgery to remove part of your intestine;asthma caused by taking aspirin;any condition that makes it hard for your body to absorb nutrients from food (malabsorption);a dental problem (you may need a dental exam before you receive zoledronic acid);if you are dehydrated; orif you take a diuretic or ""water pill"".''Zoledronic acid can cause serious kidney problems, especially if you are dehydrated, if you take diuretic medicine, or if you already have kidney disease.''zoledronic acid may cause jaw bone problems (osteonecrosis). The risk is highest in people with cancer, blood cell disorders, pre-existing dental problems, or people treated with steroids, chemotherapy, or radiation. Ask your doctor about your own risk.''Zoledronic acid may harm an unborn baby. Use effective birth control to prevent pregnancy, and tell your doctor if you become pregnant.''You may need to have a negative pregnancy test before starting this treatment.''You should not breastfeed while using zoledronic acid.''''How is zoledronic acid given?''Zoledronic acid is given as an infusion into a vein. A healthcare provider will give you this injection.''Zoledronic acid is sometimes given as a single dose only one time. It may also be given once every 1 or 2 years. How often you receive zoledronic acid will depend on why you are using this medicine. Follow your doctor's instructions.''Drink at least 2 glasses of water within a few hours before your injection to keep from getting dehydrated.''You may need frequent medical tests to help your doctor determine how long to treat you with zoledronic acid. Your kidney function may also need to be checked.''Pay special attention to your dental hygiene while using zoledronic acid. Brush and floss your teeth regularly. If you need to have any dental work (especially surgery), tell the dentist ahead of time that you are using zoledronic acid.''Zoledronic acid is only part of a complete program of treatment that may also include diet changes and taking calcium and vitamin supplements. Follow your doctor's instructions very closely.''Your doctor will determine how long to treat you with this medicine. Zoledronic acid is often given for only 3 to 5 years.''''What happens if I miss a dose?''Call your doctor for instructions if you miss an appointment for your zoledronic acid injection.''''"
What happens if I overdose? Zoledronic acid,''Seek emergency medical attention or call the Poison Help line at 1-800-222-1222.''''
What should I avoid while receiving zoledronic acid? Zoledronic acid,"''Avoid smoking, or try to quit. Smoking can reduce your bone mineral density, making fractures more likely.''Avoid drinking large amounts of alcohol. Heavy drinking can also cause bone loss.''''"
Zoledronic acid side effects,"''Get emergency medical help if you have signs of an allergic reaction: hives; wheezing, chest tightness, trouble breathing; swelling of your face, lips, tongue, or throat.''Call your doctor at once if you have:''new or unusual pain in your thigh or hip;jaw pain or numbness, red or swollen gums, loose teeth, or slow healing after dental work;severe joint, bone, or muscle pain;kidney problems--little or no urination, swelling in your feet or ankles, feeling tired;low red blood cells (anemia)--pale skin, unusual tiredness, feeling light-headed or short of breath, cold hands and feet; orlow calcium levels--muscle spasms or contractions, numbness or tingly feeling (around your mouth, or in your fingers and toes).''Serious side effects on the kidneys may be more likely in older adults.''Common side effects may include:''trouble breathing;nausea, vomiting, diarrhea, constipation;bone pain, muscle or joint pain;fever or other flu symptoms;tiredness;eye pain or swelling;pain in your arms or legs;headache; oranemia.''This is not a complete list of side effects and others may occur. Call your doctor for medical advice about side effects. You may report side effects to FDA at 1-800-FDA-1088.''''"
What is zolmitriptan? Zolmitriptan,"''Zolmitriptan is a headache medicine that narrows blood vessels around the brain. Zolmitriptan also reduces substances in the body that can trigger headache pain, nausea, sensitivity to light and sound, and other migraine symptoms.''Zolmitriptan is used to treat migraine headaches in adults.''Zolmitriptan will only treat a headache that has already begun. It will not prevent headaches or reduce the number of attacks.''Zolmitriptan should not be used to treat a common tension headache, a headache that causes loss of movement on one side of your body, or any headache that seems to be different from your usual migraine headaches. Use this medication only if your condition has been confirmed by a doctor as migraine headaches.''Zolmitriptan may also be used for purposes not listed in this medication guide.''''"
Important Information Zolmitriptan,"''You should not use  zolmitriptan if you have uncontrolled high blood pressure, heart problems, certain heart rhythm disorders, a history of heart attack or stroke, or circulation problems that cause a lack of blood supply within the body.''Do not use this medicine if you have used an MAO inhibitor in the past 14 days, such as isocarboxazid, linezolid, methylene blue injection, phenelzine, rasagiline, selegiline, or tranylcypromine.''Do not use zolmitriptan within 24 hours before or after using another migraine headache medicine.''''"
Before taking this medicine Zolmitriptan,"''You should not use zolmitriptan if you are allergic to it, or if you have:''coronary heart disease, angina (chest pain), blood circulation problems, lack of blood supply to the heart;a history of heart disease, heart attack, or stroke, including ""mini-stroke"";Wolff-Parkinson-White syndrome;severe or uncontrolled high blood pressure;a blood vessel disorder or circulation problems that cause a lack of blood supply within the body; ora headache that seems different from your usual migraines.''Do not use zolmitriptan if you have used an MAO inhibitor in the past 14 days. A dangerous drug interaction could occur. MAO inhibitors include isocarboxazid, linezolid, methylene blue injection, phenelzine, rasagiline, selegiline, tranylcypromine, and others.''To make sure zolmitriptan is safe for you, tell your doctor if you have:''heart disease, high blood pressure, or a heart rhythm disorder;epilepsy or seizures;liver or kidney disease;a condition for which you take cimetidine (Tagamet); orcoronary heart disease (or risk factors such as diabetes, menopause, smoking, being overweight, having high cholesterol, having a family history of coronary artery disease, being older than 40 and a man, or being a woman who has had a hysterectomy).''Zolmitriptan disintegrating tablets may contain phenylalanine. Talk to your doctor before using this form of zolmitriptan if you have phenylketonuria (PKU).''It is not known whether this medicine will harm an unborn baby. Tell your doctor if you are pregnant or plan to become pregnant.''It is not known whether zolmitriptan passes into breast milk or if it could harm a nursing baby. Tell your doctor if you are breast-feeding a baby.''Zolmitriptan is not approved for use by anyone younger than 18 years old.''''"
How should I take zolmitriptan? Zolmitriptan,"''Follow all directions on your prescription label. Your doctor may occasionally change your dose to make sure you get the best results. Do not use  zolmitriptan in larger or smaller amounts or for longer than recommended.''Use zolmitriptan as soon as you notice migraine symptoms.''Take the regular tablet whole with a full glass of water.''To take the orally disintegrating tablet (Zomig-ZMT):''Keep the tablet in its blister pack until you are ready to take it. Open the package and peel back the foil. Do not push a tablet through the foil or you may damage the tablet.Use dry hands to remove the tablet and place it in your mouth.Do not swallow the tablet whole. Allow it to dissolve in your mouth without chewing. If desired, you may drink liquid to help swallow the dissolved tablet.''After taking a tablet: If your headache does not completely go away, or goes away and comes back, take a second tablet 2 hours after the first. Do not take more than 10 mg of zolmitriptan in 24 hours. If your symptoms have not improved, contact your doctor before taking any more tablets.''Call your doctor if your headache does not go away at all after taking the first zolmitriptan tablet.''Never use more than your recommended dose. Overuse of migraine headache medicine can make headaches worse.''Contact your doctor if you have more than four headaches in one month (30 days). Tell your doctor if this medicine seems to stop working as well in treating your migraine attacks.''Zolmitriptan can raise blood pressure to dangerous levels. Your blood pressure may need to be checked often while you are using this medicine. Your heart function may need to be checked using an electrocardiograph or ECG (sometimes called an EKG).''Store at room temperature away from moisture, heat, and light.''''What happens if I miss a dose?''Since zolmitriptan is used as needed, it does not have a daily dosing schedule. Call your doctor promptly if your symptoms do not improve after using zolmitriptan.''''"
What happens if I overdose? Zolmitriptan,''Seek emergency medical attention or call the Poison Help line at 1-800-222-1222.''''
What should I avoid while taking zolmitriptan? Zolmitriptan,"''Do not take zolmitriptan within 24 hours before or after using another migraine headache medicine, including:''zolmitriptan nasal spray, almotriptan, eletriptan, frovatriptan, naratriptan, rizatriptan, or sumatriptan; orergot medicine--dihydroergotamine, ergotamine, ergonovine, methylergonovine.''Zolmitriptan may impair your thinking or reactions. Be careful if you drive or do anything that requires you to be alert.''''"
Zolmitriptan side effects,"''Get emergency medical help if you have signs of an allergic reaction: hives; difficulty breathing; swelling of your face, lips, tongue, or throat.''Stop using zolmitriptan and call your doctor at once if you have:''feeling of tightness in your jaw, neck, throat, or chest;fast or pounding heartbeats, dizziness;sudden and severe stomach pain and bloody diarrhea;heart attack symptoms--chest pain or pressure, pain spreading to your jaw or shoulder, nausea, sweating; orhigh levels of serotonin in the body--agitation, hallucinations, fever, fast heart rate, overactive reflexes, nausea, vomiting, diarrhea, loss of coordination, fainting.''Common side effects may include:''pain or tightness in your throat or chest;dry mouth, upset stomach;pressure or heavy feeling anywhere in your body;drowsiness, feeling tired; orflushing (warmth, redness, or tingly feeling).''This is not a complete list of side effects and others may occur. Call your doctor for medical advice about side effects. You may report side effects to FDA at 1-800-FDA-1088.''''"
What is Zoloft?,"''Zoloft (sertraline) is an antidepressant belonging to a group of drugs called selective serotonin reuptake inhibitors (SSRIs). Sertraline affects chemicals in the brain that may be unbalanced in people with depression, panic, anxiety, or obsessive-compulsive symptoms.''Zoloft is used to treat depression, obsessive-compulsive disorder, panic disorder, anxiety disorders, post-traumatic stress disorder (PTSD), and premenstrual dysphoric disorder (PMDD).''Zoloft may also be used for purposes not listed in this medication guide.''"
Important information Zoloft,"''You should not use Zoloft if you also take pimozide, or if you are being treated with methylene blue injection.''Do not use Zoloft if you have used an MAO inhibitor in the past 14 days, such as isocarboxazid, linezolid, methylene blue injection, phenelzine, rasagiline, selegiline, or tranylcypromine.''Some young people have thoughts about suicide when first taking an antidepressant. Stay alert to changes in your mood or symptoms. Report any new or worsening symptoms to your doctor.''Seek medical attention right away if you have symptoms of serotonin syndrome, such as: agitation, hallucinations, fever, sweating, shivering, fast heart rate, muscle stiffness, twitching, loss of coordination, nausea, vomiting, or diarrhea.''"
